Review Title,Review Text,Stay Date,Trip Type,Room Tips,Review Date,Author Location,Author Info,Overall Rating,Specific Ratings
Service Makes The Difference,"Excellent staff and service at this functional hotel in Lagos. Membership was recognized, rooms were clean and overall a fine experience.  I've read reviews saying ""not great"", but I would disagree. I felt safe and secure during my trip, and the AC worked well the whole time.",October 2023,Traveled on business,There is a pool.and workspace.,wrote a review Oct 2023,Switzerland,"['268 contributions', '159 helpful votes']",40,"['Value bubble_40', 'Location bubble_40', 'Service bubble_50']"
Extremely Disappointing Stay,"Very stressful and disappointing stay. Room was not ready when we first arrived and we had to wait until one was ready, despite checking in on the app. When I finally got into the room, it was humid and the ceiling was leaking and had to be fixed. Additionally, the air conditioning did not work and when maintenance person arrived to fix the ceiling, I pointed out the air issue and he (frustratingly) insisted it was just me not knowing how to work it, even though it clearly didn’t work even when he made the “correct adjustments” (though it ultimately was proven that the system just wouldn’t get cooler - it wasn’t me not knowing).   I asked to be moved but was asked to remain in the room for a night with a promise a new room the next day, so no sleep to say the least as someone",September 2023,Traveled on business,,wrote a review Oct 2023,,"['1 contribution', '1 helpful vote']",10,[]
"Horrible experience, should not be a Marriott Bonvoy property","Highly recommend NOT staying at this hotel. The rooms are not clean.  The air in the rooms is damp and moldy and the AC doesn't work well.  If you like a smelly room that is 25-28 degrees, this is the hotel for you.  After moving to a different room, the AC worked ok, but the bed was horrible. I did not sleep well.  I can not see how this hotel maintains the Bonvoy/Sheraton brand.  I have submitted my complaints to Bonvoy as well and have encouraged all of my colleagues that stayed there to do the same.",September 2023,Traveled on business,Avoid this hotel at all costs ,wrote a review Sep 2023,"London, United Kingdom","['10 contributions', '5 helpful votes']",10,[]
Poor maintenance. 1*,"This hotel is now a rundown 1* hotel. I stayed here a few years ago but clearly there has been no ongoing maintenance and the new management are doing a poor job.  Our room smelt like urine, no soaps, broken furniture and more. They changed our room after we complained and upgraded us to a much larger suite that was slightly cleaner but had limited light sources.  The breakfast area was old, not maintained and the food not fresh. Even the frying pans used to make eggs looked like they had not been replaced in years. Very unhygienic.    As a Marriott Elite member I was appalled and believe that the Marriott standard does not exist here.   Unfortunately, I will not be coming back.",June 2023,Traveled with family,,wrote a review Jun 2023,,"['6 contributions', '4 helpful votes']",10,[]
Sheraton?? Nope!,"I dont know why Sheraton would have their name on this hotel. Service is terrible. Have to ring mu;tipletimes EVERY time you orfer room service , have to ring multiple times EVERY time you get laundry done. Staff just dont care at all. Options are limited in Lagos but there must be better than this",April 2023,Traveled on business,,wrote a review Apr 2023,,"['4 contributions', '3 helpful votes']",20,"['Value bubble_10', 'Location bubble_20', 'Service bubble_10']"
Very average experience,"Very good room, large and well equipped. Well cleaned and good services. Only one small bar on the second floor, outside bar area is very dark, inside no tables, I would rate this very basic for a Sheraton. The restaurant is also basic, one big empty room with no atmosphere, may as well be a canteen. Breakfast is supposed to start at 6.30 am but no point in going at this time as less than half of the items are available, no chef at the egg station, toaster did not work and I struggled to get a coffee out of the coffee machine. I stayed for over a week and on a few occasions resorted to having a coffee in the coffee shop on the ground floor where the staff, especially Sarah Ukpeh were very helpful. If it was not for the friendly service at the coffee shop I may have checked out",November 2022,Traveled on business,,wrote a review Dec 2022,"High Wycombe, United Kingdom","['43 contributions', '14 helpful votes']",30,"['Location bubble_30', 'Cleanliness bubble_40', 'Service bubble_10']"
Nice hotel located conveniently with comfortable rooms,"The staff at the hotel are very friendly and service levels are very good. The rooms are spacious, clean and comfortable. Their main dining has buffet options through all meal times but the cafe has a wide range of snacks and light bites and very good coffee",September 2022,Traveled on business,Ask for renovated rooms,wrote a review Sep 2022,"Nairobi, Kenya","['239 contributions', '65 helpful votes']",40,[]
Amazing staff,"I switched from the dreadful Oriental Lagos to the Four Points for the second half of my week in Lagos and the difference was night and day. The 4 Points is what I would have expected in Nigeria but the staff outdid themselves....shout outs to Onifade Ayodeji at the front desk and Omoniye in the front office along with Bobo the chef, Favour in the restaurant, Ruth at the front desk, and Kayode and Aderonke in the bar!!",August 2022,Traveled on business,,wrote a review Sep 2022,,"['3 contributions', '1 helpful vote']",50,"['Value bubble_50', 'Location bubble_50', 'Service bubble_50']"
A Pleasurable Experience! 🤩 🏨,"Four Points By Sheraton is a hotel that I've been passing by for years, especially when heading to The Palms Mall @ Lekki. It appears to 'sit' on the border of Victoria Island and Lekki. I've always wanted to stay here, but never got the opportunity to do so until now. Booking was super easy on Booking.com, and upon arrival, the check-in process was a breeze. I'll divide this review into the 'Positives' and the 'Negatives', as I customarily do.   PROS: First of all, the entire hotel is lovely!😍 This includes the lobby, rooms, swimming pool and other environs. Except for some scaffolding/repairs, everything about the hotel appeared neat, clean and orderly. The exterior of the hotel is kempt and well-maintained. Our room was beautifully decorated. It was done in attractive pale,",August 2022,Traveled with family,"Leave time to get there, as there can sometimes be traffic on this V.I/Lekki 'Border' Hotel.",wrote a review Sep 2022,Nigeria,"['3686 contributions', '237 helpful votes']",40,[]
"Deteriorated over the years - musty, leaky, terrible","This hotel has deteriorated since my husband and I stayed there ten years ago. During this stay we ended up changing rooms three times. First, we were allegedly upgraded to a suite based on my husband’s status in the Marriott Rewards program. When we arrived at our room, it was certainly not a suite. We called down and were told they did not have any available suites but persuaded to stay in the “nice” room we were given. We agreed. Within the first day, the ceiling developed a leak, which was attributed to a faulty air conditioning duct system. Their maintenance crew could not fix it so we were moved to a second room. The minute we walked into the second room we knew we couldn’t stay there - the air smelled horribly musty and the dead bolt on the door was broken. We were then",May 2022,Traveled as a couple,,wrote a review May 2022,,['9 contributions'],10,[]
Review Title,Review Text,Stay Date,Trip Type,Room Tips,Review Date,Author Location,Author Info,Overall Rating,Specific Ratings
Friends mothers burial,"It was a lovely stay for me as always. Friendly cordial staff. I am always looking forward diving into their bed it really relaxing. Clean rooms,  Breakfast is always rich with a lot of healthy choices. what’s not to like. I am definitely coming back again soon.  Nike",February 2022,,,wrote a review Mar 2022,"Abuja, Nigeria","['137 contributions', '42 helpful votes']",40,[]
Nice hotel but don’t forget your stuff in the room!,"I spent 2 days at the hotel, friendly staff, good breakfast and environment but forgot my airpod in the room just in front of the tv after packing. Called next day and only to be told the room cleaner didn’t find anything! I was 100% sure where I left it because I left the hotel to the house and on getting to the house, I called the hotel number all day (on Sunday) it wasn’t connecting and next day airpod gone.",October 2021,,,wrote a review Nov 2021,"Lagos, Nigeria","['6 contributions', '2 helpful votes']",30,[]
AWESOME EXPERIENCE,The reception was spectacular. The little interracrion I had with a few staff made me conclude that they have a well trained staff members who truly love and enjoy what they do.   Amazing food as well. ..oh yea! I had chicken wings and fries. I must say I enjoyed every bite.  I happened to also meet the Geeneral Manager - one Mr Patik ( not aure of the spelling) He is a very warm peraon.  We spoke briefly about covod and its impact on hospitality. Quite optimistic and excited about the return of life to the hospitality sector.  He spoke quite freely and down to earth.  I will always go back there when next there is a need to.,October 2021,,,wrote a review Oct 2021,,['1 contribution'],50,[]
Brasserie Sunday Brunch: Pasta Station worth it. Not much else for $32USD EACH,"Posted 12noon start time isnt possible per the Head Chef.  Well, they were supposed to start at 12:30p and somethings were ready at 12:44pm.   The pasta station is what led me to choose this brunch offering. They have Alfredo and Red marina sauce. No pesto. Actually, no basil available at all.   The chef said ask for what you want and they'll deliver. Well, basil never showed and I was befuddled no one considered the bar would have basil and floored that the kitchen didn't have it all.   The buffet includes:  Salad bar with coleslaw.  Some salad fixings  Pitted olives  Some dressings but no blue cheese, ranch, balsamic neither Italian. They have french, oil, mayo based Thousand Island and soy sauce that wasn't labeled so I thought it was balsamic.   Dessert: grab it upon arrival",September 2021,,,wrote a review Sep 2021,,"['26 contributions', '9 helpful votes']",20,[]
A Fall from Grace,"Very disappointing to see this hotel go from international standard 2 years ago to below average now.    I absolutely loved the hotel during my last stay 2 years ago so I was surprised to see it run down so quickly.   Upon arriving, there was a stench in hotel lobby, lack of maintenance all around was apparent, checkin was smooth and fast. Room was not as impressive, mattress and pillows were old and worn out, the bed did not feel sturdy. Bathroom was the worst as there was no wash cloth, I inquired and they said there was none in the entire hotel due to some supply problems. Towels were worn out.  The food was still good though and room service was prompt. Staff was nice and professional.  I did not enjoy my room and didn’t feel I was getting value for my money. I cut my stay",June 2021,,,wrote a review Jun 2021,"Dallas, Texas","['45 contributions', '48 helpful votes']",20,[]
Friends wedding,"Home Sweet home!!! As always it’s always a great place to be at. Clean room lovely friendly, polite staff. As always a place to stay when in lagos👍🏼👍🏼. Let’s not forget good food too!! The ambience of this hotel is like none.",May 2021,,,wrote a review May 2021,,['2 contributions'],50,[]
Very Disappointing,"where do i even begin?? i spent over 3k us dollars to not have a working tub.....despite expressing the concern to one of the managers. once the tub issue got addressed THE CLEANING PERSON NEVER CLEANED THE THE TUB ""despite"" me asking him too. i let it go. the cloth used to clean the restroom was sour because it smelled IMMEDIATELY AFTER IT WAS CLEANED MORW THAN ONCE. both nightstands never got wiped nor the TV stand area MY ENTIRE STAY. no wait, my first day there was a great cleaning guy who liked his job AND CLEANED WELL. security people were very kind sufficient polite professional and did their jobs very very well my entire duration. Ruth and one other lady showed EXCELLENT customer service skills. the food taste decent. some times come with no silverware. open food,",September 2020,,,wrote a review Oct 2020,"Marina del Rey, California","['46 contributions', '37 helpful votes']",20,[]
"Great staff, good rooms, awesome breakfast","We spent two nights at this hotel on our visit to Lagos. We were given a Bonvoy upgrade to the top floor, which gave us a huge, comfortable, well-appointed room. The only challenge is that the hot water is pumped up from lower floors, according to what we were told. So it takes quite some time to get to the top. We thought something was wrong, but it was explained to us an we adjusted. No big deal.  The breakfast was included and amazing. There was so much variety, so plentiful and tasty. The coffee machines were annoying, but were eventually conquered. The staff were the best - Emmanuel and others at the front desk, breakfast crew and Managers. The Manager and front desk staff were so kind to us when we arrived late for checkout after getting stuck in legendary Lagos traffic.",December 2019,,,wrote a review Feb 2020,"Manquin, Virginia","['283 contributions', '117 helpful votes']",40,[]
Fun,"The hotel okay , the staff a bit slow in responding to request. The restaurant, fantastic food and the staff very pleasant. The evenings quite nice with the live band....The grilled fish is so nice. .",January 2020,,,wrote a review Jan 2020,"Abuja, Nigeria","['52 contributions', '35 helpful votes']",40,[]
GREAT PLACE !!!!!!,"The ambiance was really soothing. Great environment, with superb security arrangement in place.  I was not surprised,being a member of the Sheraton hotel chain.The meals were tasty, and I thoroughly enjoyed the Nigerian dish which was served.",November 2019,,,wrote a review Jan 2020,"Lagos, Nigeria","['32 contributions', '51 helpful votes']",40,[]
Review Title,Review Text,Stay Date,Trip Type,Room Tips,Review Date,Author Location,Author Info,Overall Rating,Specific Ratings
3 days stays,It was a nice stay. As usual nice and friendly staff. Clean rooms. Thanks to Ruth who took really good care of us as always. Had a lovely massage and the Lady Ebere was really good. I enjoyed it. Hope to visit again soon and spend more time.,January 2020,,,wrote a review Jan 2020,"Abuja, Nigeria","['137 contributions', '42 helpful votes']",40,[]
A good experience,"I've visited most of the hotels in Kagos, Victoria Island, and Fourpoints is arguably in the top two from my experience. Good location, clean, friendly staff, good breakfast, good conferencing facilities. If you're visiting Lagos VI area, it's a good hotel.",January 2020,,,wrote a review Jan 2020,"Cape Town, South Africa","['26 contributions', '1 helpful vote']",40,[]
Very bad hotel,"One of the worst experience you can ever experience, the food quality, rooms , all services are terrible , it is not value for many at all , the bills not accurate you have to review it carefully, the lundry takes arround 4 days :-(  Really horrible experience",January 2020,,,wrote a review Jan 2020,,"['2 contributions', '1 helpful vote']",10,[]
Worst level of service and poor environment,"The stuff are not helpful and services are very poor. There are no windows in rooms so the smell is very bad. It is not possible to get help from first time, you need to keep asking until someone may help. The invoice usually have some charges that not belong to you so need to keep your eyes open and confirm everything. The rates are too high regarding the level of service provided. no smoking rooms and level of cleanness is poor",December 2019,,,wrote a review Dec 2019,"Cairo, Egypt","['6 contributions', '1 helpful vote']",20,[]
Unexpectedly Outstanding Hotel,"Usually I write a review if I am highly satisfied, or highly disappointed...  This was my first visit to Lagos, and I booked a Five-nights stay in this property with no high expectations... however, I was highly impressed with the great quality of service I received... starting from Airport pickup, security check, check in process, property ambiance as well as, the room cleanliness.  Staff was very welcoming, very helpful and hospitable, and everyone is always making sure to greet you and ask how is/was your day with a very warm and friendly smile.  Breakfast buffet is full of varieties, which will make you have a great start of your day.   Gym is very well equipped with TechnoGym machines, which definitely satisfies everyone in the Gym.  One night before I check out, there was",December 2019,,,wrote a review Dec 2019,"Dubai, United Arab Emirates","['79 contributions', '19 helpful votes']",50,[]
Very average for a four point,"I would be honest here to say that the stay was below average. Don’t expect four point cleanliness and class. It’s is surely safe and secure, which is an essential part of the stay. The electricity keeps going off and on, which is also standard for Lagos to have. Good pool and good fitness center. The traffic situation is worst on the lane hence at times makes it difficult to travel to and from the hotel.",December 2019,,,wrote a review Dec 2019,"Singapore, Singapore","['100 contributions', '48 helpful votes']",30,[]
Very disappointing,"Sheraton should take away their license at this location .This hotel is a Complete mess, The service is terrible  bathrooms are so nasty old,outdated mildew/mold growing, not cleaned properly old brown towels. Stains on the walls in the room. Worst of all is the kitchen service the food is a 3/10 all the servers are completely lost they have no clue what they’re doing. One of the waitresses had terrible body odor.I would never stay at the 4 Points Sheraton ever again",November 2019,,,wrote a review Nov 2019,,"['2 contributions', '2 helpful votes']",10,[]
Terrible room service policy,"For security reasons I do not leave my card details in some hotels in Lagos and that’s fine hotels would just accept cash during room service but in the case of this hotel you’ll have to go downstairs to make your order, wait for it and take it to your room yourself.  Almost it’s at a very busy intersection so driving out of the building is a nightmare and the security don’t do anything to help u get outside.  Walkway smells damp too.  Only plus is that it’s at the heart of Victoria island.",November 2019,,,wrote a review Nov 2019,,['11 contributions'],20,[]
Very good Management and service,"The Hotel is very good, clean, has an Ocean view (from one side). Rooms are good. Breakfast is very nice. Thanks for the reception Management of the Hotel (Miss. Tummise) who was very helpful and supportive. Thanks for the full reception staff. Service globally is good and there is a nice mall just behind the Hotel.",November 2019,,,wrote a review Nov 2019,"Nairobi Region, Kenya","['9 contributions', '13 helpful votes']",40,[]
Disappointing completely - rethinking to change,Extremely disappointed 1. Day 1 water in the room 2. Room change not executed 3. Breakfast menu is not filled up most time - see photos below 4. Hardly options for Veg food 5. Tomato soup extremely cold in spite of complain 6. Guest services you call is always on waiting 7. Elevator is most time not available,October 2019,,,wrote a review Oct 2019,"Mumbai, India","['17 contributions', '7 helpful votes']",10,[]
Review Title,Review Text,Stay Date,Trip Type,Room Tips,Review Date,Author Location,Author Info,Overall Rating,Specific Ratings
Still waiting for the sauna in the spa to be fixed!,"For too long the sauna in the spa has been faulty. It needs a permanent fix. The problem with the spa has spanned over a year and yet management are yet to give a solution. Also, the pool remains freezing, it’s been like this since it opened, not ideal for family pool time.",October 2019,,,wrote a review Oct 2019,"Lagos, Nigeria","['64 contributions', '51 helpful votes']",30,[]
Does the job,"The hotel is nothing to write home about but provides the main things that are needed. The Gym, Terrace, and Breakfast are among the best things. The rooms are relatively basic, offering the elements of a four Star room, but do not stand out. Staff is very friendly.",October 2019,,,wrote a review Oct 2019,"Cairo, Egypt","['46 contributions', '60 helpful votes']",40,[]
Awful,"Because of the humidity, rooms smell terrible. No carpets on the room floor. Food is not good. Staff is helpful but service is limited. Mini bar is empty. Mostly local people are staying at the hotel. I don’t think I will stay again in this hotel.",September 2019,,,wrote a review Sep 2019,"Istanbul, Türkiye","['66 contributions', '25 helpful votes']",20,[]
Excellent,"Perfect stay, the staff were all excellent, very friendly and always helped us and accommodated us. The facilities were great and very comfortable. The breakfast buffet was really good, choice of Nigerian food and European too, and delicious! Finally the rooftop bar is perfect to relax. Good security too, we felt safe throughout our whole stay there.",August 2019,,,wrote a review Sep 2019,"Birmingham, United Kingdom",['4 contributions'],50,[]
Never again,"We chose Sheraton in Lagos, because we thought its name guarantees us quality. Instead we were met with mould in every of the three rooms we tried, worn-down furniture and a constant smell of a hotel in a desperate need of a total make over. It was so humid in the room, that the door to the bathroom could not even close properly and while sleeping it felt like all the bedsheets are soaked in a little bit of water. The mould was visible on the walls and the ceiling, and, of course, in the bathroom. Not to mention other little details like missing light, broken hair dryer, chipped furniture. And all of this for an outrageous price. Definitely never again, in Lagos or elsewhere.",August 2019,,,wrote a review Aug 2019,,['1 contribution'],10,[]
Below average,"Stayed with 4 colleagues really not up to standard. Room has mold on ceiling, curtains were falling down and had holes. Sink plug did not work and hot water was extremely erratic. Breakfast was one of the worst I have ever experienced.",July 2019,,,wrote a review Jul 2019,,['1 contribution'],20,[]
Unexpect the Expected,The hot water does not work which is unexpected of a Sheraton class hotel. Ran the tap for a good 10 minutes and only tepid water flowed out. The welcome service at Brazzerie dies not exist. Its more like reporting at the Prisons & Corrections office for a prisoner visit.,July 2019,,,wrote a review Jul 2019,,"['55 contributions', '26 helpful votes']",30,[]
"Decent option, room feels a bit ""tired"".","Four Points is a pretty safe option to stay in Lagos, security is tight. It`s in the Victoria island area, quite a distance away from LOS International. The rooms are spacious, but certain stains on the floor make the room feel a little dated. Friendly personnel, though.",July 2019,,,wrote a review Jul 2019,"Guayaquil, Guayas, Ecuador","['409 contributions', '316 helpful votes']",40,[]
"Chaotic, shambolic and best-avoided","I spent one night here and couldn't wait to get out.  Dialing the front desk is a waste of time and I've never had a noisier room. Some kind of loud music event was happening in the pool area that sounded as if it was happening right inside my room, which went well into midnight and beyond. This place has no business bearing the Sheraton branding. Never again.",July 2019,,,wrote a review Jul 2019,"Plumstead, South Africa","['38 contributions', '24 helpful votes']",10,[]
Excellent Business Hotel,I spent 2 nights here and was totally impressed by the service and staff at the facility.  The rooms are well appointed and everything functional. WiFi is excellent as we could do all our internet related work without glitches.  We had meals at the Brazzerie and the buffet was nice and the guy at the omelette stand for breakfast does his job so well. The office room bar in the evening was also a delight with the staff willing to go the extra mile to make sure you are satisfied.  Overall I think this hotel is up to standard and so on point. I'd definitely recommend this hotel to anyone coming to Victoria Island and environs for business or pleasure,June 2019,,,wrote a review Jun 2019,"Benin City, Nigeria","['54 contributions', '47 helpful votes']",50,[]
Review Title,Review Text,Stay Date,Trip Type,Room Tips,Review Date,Author Location,Author Info,Overall Rating,Specific Ratings
This is not a Sheraton,Reception team are kind and helpful but dirt and  mold starts from the elevator. Finger prints everywhere. Dirty carpet in the corridor. Smell of damp in the room. Every corner of the bathroom is dirty and brown mold is expanding. Floor is sticky and there are no slippers.  The food at the grill and resto are ok.  In general very overpriced and misrepresented.  I will never stay there again. Not even for free.,May 2019,,,wrote a review May 2019,,"['144 contributions', '92 helpful votes']",20,[]
