Review Title,Review Text,Stay Date,Trip Type,Room Tips,Review Date,Author Location,Author Info,Overall Rating,Specific Ratings
A welcome relief to the organised chaos that is Lagos,"Stepping off the plane my heart sank. The airport was worse than I remember and just as ramshackle passport and customs as I remember. I want to catch the plane back straight away.   So what excitement I experienced to be checking into the 4 Points - modern, friendly and efficient check in and a great room. My 6 days was going to be fine with a refuge to look forward to at the end of the day. All the essentials for a business traveller are there. Big comfortable bed, ample room for a work station - desk, swivel chair and internet (see later). Bathroom has all the toiletries needed - soap, shampoo etc. and of a good quality. Sufficient towels albeit the bath towels were a little small but does the trick. Dressing gown welcome as I needed it to feel warm in the cool air",July 2013,,,wrote a review Jul 2013,"Lagos, Nigeria","['134 contributions', '135 helpful votes']",40,[]
Pretty Good with a few glitches,"I stayed at the Four Points for a week. Travelling alone on business, my key concerns were  cleanliness, safety and a decent environment in which to work. This hotel meets all three of these requirements reasonably well, with the exception of their wifi service, which was at best annoying and at worst, non-existent for a full day.  The hotel advertises ""free"" in-room wifi. The reality: signal strength was poor inside my room and the ""free"" service is throttled, forcing you through a tedious log-in process every 45 minutes. Continuous wifi service is available at a cost (too steep for my needs) so I put up with the login annoyance. One day, all wifi was unavailable and hotel staff just stated this as a fact with no apology or any indication of the length of time to repair.  Other",June 2013,,,wrote a review Jul 2013,"Toronto, Canada","['28 contributions', '22 helpful votes']",40,[]
Pleasant stay,"I moved here after a day at Radisson Blu, and fond Four Points to be a breath of fresh air. The staff were attentive, and made me feel welcome from the reception desk. Ruth, Akinwale and Shirley deserve special mention.  I was a female traveller alone on business and felt safe throughout my stay. I used the hotel taxis quite a bit which was convenient.  A downside is I think the prices are a bit steep for what you get. The food, and price of rooms were quite steep. Also, there were 'hidden' charges, so a price seen suddenly gets hiked with taxes and service charges. As one based in a country that doesn't do this, can be quite a shock. Also, the power cuts can be quite unsettling especially at nights but the generator comes on after a few seconds. The management might want to",May 2013,,,wrote a review Jun 2013,United Kingdom,"['45 contributions', '13 helpful votes']",40,[]
One of the more functional and efficient business hotels in Lagos,"We stayed in Four Points as part of our new year holiday. Mistake. The hotel does not have much to offer families by way of holiday diversion. So you must treat this as a strictly business hotel - in this, they come up looking pretty good. Service not spectacular, looks understaffed, cramped rooftop bar with poorly-trained, overworked waiters; but the food, as is the tradition with Sheraton was excellent. The rooms were also sparkling - but it really is a Spartan, if elegant hotel. But nothing stands out in the memory to warrant a repeat leisure stay, but I would put my business visitors here without hesitation. Not a vacation destination.",January 2013,,,wrote a review Jun 2013,Durban,"['4 contributions', '3 helpful votes']",40,[]
Top of the line for Nigeria,"Secure hotels are few & far between in Lagos, thus you will pay a premium to stay here.  We chose this hotel on recommendations made by our Security Team. Reservations: Made them through the Starwood 800 number.  Requested a conference room & a menu, and was told the hotel would contact me directly.  I received an email from the hotel telling me the conference room was 70,000 NGN [about $450 USD] per day.  After some negotiation they offered 50,000 NGN.  I asked to reserve it for three days, and never received any confirmation.  I also asked for a menu in every email exchange.  That request was never even acknowledged.  Some of my associates were arriving before me and the hotel required a credit card pre-authorization for each room and each type of charge [food, etc.]  Took a",April 2013,,,wrote a review May 2013,"Dallas, Texas, USA","['56 contributions', '9 helpful votes']",40,[]
Won't recommend it,"The hotel is really poor, the food is not good at all, nothing to do in there except just sitting in the lobby with a friend. The SPA and Gym are not good as well, so you won't enjoy them, but you have to exercise anyway to waste your time and get healthy. The surrounding area is extremely poor and I won't recommend anyone to get out of the hotel on foot specially at night.",May 2013,,,wrote a review May 2013,"Dubai, United Arab Emirates","['112 contributions', '52 helpful votes']",20,[]
In fourpoints I feel home,"I'm a frequent traveler to Lagos, the best moment after coming back from a long day of work and long traffic is to reach the Hotel, the staff are very friendly, available and caring, the management team are very accessible and they do whatever possible to make my stay enjoyable, the rooms are clean, there some rooms that I personnaly dont like, eventhough they are big ;-) cause they are noisy and some have less wireless coverage on the high floors at the edge of the corridors, central rooms are the best. There is always live music ending at 10:30 at the roof top bar which varies every day, from time to time they bring amazing singers or musiciens, but overall diverse.  The Spa is amazing with a very perofesional asian therapists, even though I found the massage price a bit",May 2013,,,wrote a review May 2013,"London, United Kingdom","['5 contributions', '3 helpful votes']",50,[]
Price to value is poor,"The location is not too bad , price  of $500 to $600 a night without breakfast is way over priced . Security is the best for preferred customers and executives . Food is excellent , rooms are very clean . They should provide adapters for foreign phones as standards in all rooms . Customer service is great . Their location in IKaja need serious update the rugs smells like pee . All and all not a bad place to stay",April 2013,,,wrote a review Apr 2013,"Taunton, Massachusetts",['2 contributions'],50,[]
What a pity...,"This is my first time at this hotel. On the face of it, lobby, rooms etc., the hotel is attractive. Front desk was understaffed, my agent booked me $ 280 pd - excludes $30 breakfast? Now in for $310. I had to pay $800 deposit for 2 nights, wow. Price includes free Internet that is designed to log you off every 45 minutes, so you have to keep logging in. You can buy a better Internet plan, but I refuse to pay for internet at a hotel. Finally get a room that smelled like a cigar lounge. Apologies were offered amd accepted and I was given a new room. Nice room. Internet was up and down like a yo-yo, almost as unstable as the electricity. Power went off 3 times in the last 5 hours. Called to have dinner sent up..no answer...engaged..no answer...customer service...no",April 2013,,,wrote a review Apr 2013,"Nazare, Portugal","['160 contributions', '46 helpful votes']",20,[]
A very bad hotel,A hotel that is not in line with Sheraton expectations  During my stay the electricity was cutting all the time  The quality of the breakfast is bad  The team is under qualified to book and for the check out it's a long story  Please remove this hotel from your list of hotel this will be a good choice :-),April 2013,,,wrote a review Apr 2013,"Paris, France","['38 contributions', '12 helpful votes']",10,[]
Review Title,Review Text,Stay Date,Trip Type,Room Tips,Review Date,Author Location,Author Info,Overall Rating,Specific Ratings
Great Hotel in VI,"a very good hotel with great conference facilities .... rooms are nice... restaurant serves a good variety of food.. staff is very friendly and helpful.  There is an outside bar/terrace which is beautiful to sit during the evenings... nice music playing while you enjoy the evening breeze.  Pay attention to your bills though, on the day i was checking out a guy from the restaurant came running to me asking that i pay for breakfast separately since I'd already checked out, i almost handed him a $50 bill when i realized that my accommodation was B&B which means breakfast that morning was included in overnight charges!   be careful.. it's Nigeria after all! :))",December 2012,,,wrote a review Apr 2013,"Nairobi, Kenya","['98 contributions', '109 helpful votes']",40,[]
Good First Impression.,"It was indeed a good first impression by the hotel front desk staff who made my business associates visiting Nigeria for the first time feel welcome after a long flight. She made the checking in process seem like breeze for them. Unexpectedly, while waiting for their turn to check in, a staff Shola brought complementary cold glasses of juice for us and all the other guests waiting to check in. It was timely and a good way to say welcome to guests after a long and exhaustive trip no matter how insignificant it might seem. Good impression and do keep it up.",April 2013,,,wrote a review Apr 2013,"Abuja, Nigeria","['26 contributions', '4 helpful votes']",40,[]
wonderful island into Victoria island,"i don't actually know other hotels in town but anyway the four points turned out to be a great choice for a very tough working week in Lagos. the position is central for a standard oil&gas meetings agenda, the rooms are large, clean and furniture is new and nice. the view is not the best being Lagos... Lagos but you can see the ocean or the lagoon which is not bad anyway. there is a nice sport bar and top roof bar, personal is nice and warm and even pretty fast for the local standards. wifi internet in room is weak if there is any, but this seems to be more a 4 points problem since also in houston i have had the same problem.",April 2013,,,wrote a review Apr 2013,"Milan, Italy","['48 contributions', '45 helpful votes']",40,[]
Best hotel in VI - Clean and reasonably priced,If you are working in VI or Lekki this is the place to be.  Only a few years old.  Large rooms with god AC - free wireless and big comfy beds.  Good gated security and a very relaxed lobby area with a nice coffee shop that does sit in or takeaway.  The outside bar/terrace is a lovely place to sit in the evenings but the food is not great!  The price by Lagos standards is actually pretty reasonable!,March 2013,,,wrote a review Apr 2013,"Dunblane, United Kingdom","['127 contributions', '93 helpful votes']",40,[]
Good hotel that cant seem to manage the demand... Expected more for the price,"Stayed here long term for business so had a chance to feel things out.  Would I come back? Only to keep my SPG status and for the distance between the hotel and my office.  Pros: Some of the staff are very attentive and give fantastic service... Above the standards of four points which was nice.  Pros: The suites are pretty decent sized, four bottles of water daily, nice bed, nice balcony... No complaints here.  Cons: Good  luck getting a coffee at breakfast.  Started just going up to the machine and making my own. Also... No Takeaway cups unless  so that you need to go downstairs and pay $5 for a cup of mediocre coffee  Cons: internet setup is horrendous.  You need to keep signing in every few minutes... On various devices, same thing.  Called them a few times to no avail.",February 2013,,,wrote a review Mar 2013,"Austin, Texas","['35 contributions', '12 helpful votes']",30,[]
Better than Expected,"I've stayed at a number of Four Points hotels but must admit I had some preconceived notions about what this one might be like given that it's in Lagos. Color me surprised. All though the food is only average at the hotels numerous restaurants, the service was friendly, accommodating and eager to help. The room was a great size, the bed was comfy and I found it to be a great value overall. Would definitely recommend it to anyone heading to Lagos.",February 2013,,,wrote a review Mar 2013,"Atlanta, Georgia","['75 contributions', '44 helpful votes']",40,[]
No value for money,"Staff are quite friendly and service is average. I stayed in an executive room on the 8th floor and was surprised to find the bath tub patched up with some tape! Seems that there was a hole in the tub that got patched up. I didn't get the feeling that the bath tub was very clean and it should just be replaced. No bed room slippers provided. For the $450 per night paid for the room, I expected more. The room is spacious and comfortable. Wifi unbelievably slow and non-existent in the bar on the ground floor. I appreciated the 4 bottles of water provided in the room daily. Be prepared to put up with all the smokers when visiting the sports bar on the ground floor; no smokers section.",February 2013,,,wrote a review Feb 2013,"Nairobi, Kenya","['226 contributions', '43 helpful votes']",30,[]
Workshop at Four Points by Sheraton,"It was a pleasant experience, the food is simply amazing and tasty, the staff were courteous and ready to help. I sure did have a nice time, especially with the variety of teas during the coffee break. I would visit over and over again",March 2012,,,wrote a review Feb 2013,"Milton Keynes, United Kingdom","['35 contributions', '12 helpful votes']",40,[]
Clean and self contained,"In Lagos this is as good as it gets for now.  This is a land of growth and opportunity and this is a place to pause in the chaos and has good security, service, and accommodation. Coffee in the AM downstairs is good, sitting outside upstairs on the lobby roof at night is a nice place for a lounge to relax and have a drink or quick bite, the resturant serves a great breakfast.   But beware before coming it is clearly posted at the front desk that "" money laundering transactions are prohibited by the management"".......in plain English.  You have to smile, it is Nigeria after all.",January 2013,,,wrote a review Feb 2013,"Gig Harbor, Washington","['118 contributions', '78 helpful votes']",30,[]
Ideal Business Hotel in Lagos,Recntly stayed here for a week on business.  Overall quite an enjoyable experience. I found the room to be quite large and well appointed. WIFI was quite fast.  Onléy minor downsides I found were the poor quality towels and smoking in the hotel bar (yuck!). I can't complain about the views over the shanty town - it's hardly under the control of the hotel.  Location is ideal for VI & Lekki.   Breakfast and dinner in the 1st floor restaurant were buffets of a reasonable quality.,January 2013,,,wrote a review Jan 2013,"Cardiff, United Kingdom","['68 contributions', '30 helpful votes']",40,[]
Review Title,Review Text,Stay Date,Trip Type,Room Tips,Review Date,Author Location,Author Info,Overall Rating,Specific Ratings
Correct but expensive. Lagos needs hotels!!!,"It is a brand new hotel that due to the maintennance and the use will be old within no more than two or three years. Rooms are big, well ecquiped, the bathroom is may be the weak point but today is ok if you visit Lagos for business.",January 2013,,,wrote a review Jan 2013,"Madrid, Spain","['48 contributions', '68 helpful votes']",30,[]
Another Enjoyable Stay,"I have had the pleasure of staying in this welcoming hotel on a number of occasions for both long and short stays and I can honestly say that I have never been let down.  The location is ideally situated (for VI and Lekki), the Guards and Staff are always polite and respectful and the food in the main restaurant and on the Ground floor is of a good quality. The level of customer service is also exceptionally high. The rooms are always clean, spacious and well appointed, and the pool/gym and spa are all of a high standard.  This is certainly my hotel of choice within Lagos - the only negative would be if you have a room overlooking the terrace bar, as it can get a little noisy with music. However, the staff were happy to move me.",December 2012,,,wrote a review Jan 2013,"Portsmouth, United Kingdom","['23 contributions', '29 helpful votes']",40,[]
Good Hotel at Good location,Lagos has been waiting for some good business hotels and 4 points has pathed this gap. The location is very good as both the Vitoria Island as well as Lekki peninsula are at aprochable distance. The service is Good and the open air lounge is awesome.,February 2012,,,wrote a review Jan 2013,"New Delhi, India","['50 contributions', '62 helpful votes']",40,[]
4/5 Star but..........................,"This has every prospect of being a superb 4/5 star hotel in a challenging environment. The reception staff are very welcoming and helpful as is everyone else I have met and the security seems very good. However.... There is not one single piece of documentation in the room regarding facilities, restaurants etc or how to set the alarm clock, let alone any notepaper. The room is lovely but one morning there was no hot water and the next there was no shampoo and reduced numbers of bottles of water. Both quickly rectified but ...... The TV seems to work ok but do not hope that the channel guide under the glass on the credenza bears any resemblance to the actuality. Wifi very good. Does anyone here know how to clean stainless steel (as in the lift doors). The gym is really well",January 2013,,,wrote a review Jan 2013,"Coulsdon, Chipstead, Surrey, United Kingdom","['255 contributions', '141 helpful votes']",30,[]
satisfactory stay,The hotel is well located and has a fantastic design with attractive interior decor. The reception staff gave a very superb performance. We had plenty to keep  us busy and fun filled for the new year stay. The only but is the 3pm check in which is on the late side.,December 2012,,,wrote a review Jan 2013,Ibadan,"['11 contributions', '3 helpful votes']",40,[]
Nice Hotel,"Comfortable hotel. The rooms are spacious and well ventilated. Goog courteous staff. The breakfast menu is very good. A variety of food choices are available. The Adrenalin bar is very good for hanging out. The hotel is at a good location on Victoria Island not far from the Palms Mall, Genesis Cinema and the GET Arena... Rooms facing the high-way may experience some traffic noise but all in all, I enjoyed my stay.",February 2012,,,wrote a review Jan 2013,"Lilleroed, Denmark","['43 contributions', '47 helpful votes']",40,[]
Good proximity to Victoria Island and Ikoyi,"The service was great from booking till we stepped out of the hotel to our home.  The staff were very supportive, clarifying gray areas.  Our room was promptly made each time we left for more than an hour.  The food remained consistent in taste and variety.  I had another occasion to be a part of a daylong strategy session in the Four Points. The food was really tasty for a hotel of that size.  From my experience most 3 and 4 star hotels don't live upto the billing when it comes to food. But Four Points Lagos is an exception.  I will recommend this hotel to holiday makers who want to stay close to restaurants and interesting places on Lagos island.  Also for business visitors who want to be close to Offices in VI and Ikoyi, but stay removed from the centre of official activities",February 2012,,,wrote a review Dec 2012,"Lagos, Lagos, Nigeria","['85 contributions', '54 helpful votes']",40,[]
"Good for Lagos, could easily be better though","This is Lagos, so managing to deliver something average for an exorbitant price is actually a the norm.  My rating means it's a very good hotel for Lagos, not that it's a very good hotel I would choose to stay in if I had the choice.  The Four Points does very well when it comes to staff (helpful and friendly, possessing common sense), food and drink (a good sports bar, outdoor bar and buffet restaurant), room service (prompt, good choice) and location (near to wherever I tend to need to go).  There are also no 'overly friendly' ladies hanging around bothering you, which makes a nice change.  Security staff are very conscientious . One evening my door was not closed properly and staff called me within minutes to inform me and check everything was ok.  Rooms have coffee and tea",November 2012,,,wrote a review Dec 2012,"Dubai, United Arab Emirates","['49 contributions', '39 helpful votes']",40,[]
Friendly and polite service,"I have just returned from a longer than usual stay at this hotel.    While I agree that the wait time for checking-in could be improved (perhaps the hotel could utilise the guest relations desk as overflow during peak check in?), I found other comments difficult to reconcile with my experience.  I found every member of staff in the hotel (from the check-in staff to the security staff) to be polite, friendly (without being over-bearing), and attentive.  Unlike a competitor's check-in staff down the road, the staff at this hotel are far more friendly and do not give the impression that they are doing you a favour at the check-in desk.  The rooms were nice, and the beds comfortable.  I also personally like the shade of the furnishing as it is not brash and in your face.  However,",November 2012,,,wrote a review Nov 2012,London,"['8 contributions', '10 helpful votes']",40,[]
Very bad hotel - so sorry I stayed here,"If I could do my whole life over....  Pros: None  Cons:  1) 2 hours from the Lagos International airport (I kid you not due to highway construction) 2) Service is horrendous - I waited 1 hour for them to process me and 1 hour for them to bring my bags 3) Rooms are horrible (too cold or too hot) 4) Rate is way too high (they know they're the only game in town, but they're not)  You've been warned. Don't be fooled like I was.",November 2012,,,wrote a review Nov 2012,"Dallas, Texas","['25 contributions', '34 helpful votes']",10,[]
Review Title,Review Text,Stay Date,Trip Type,Room Tips,Review Date,Author Location,Author Info,Overall Rating,Specific Ratings
Nice hotel,"Bear in mind the hotel is going through external renovation. at least half of the hotel rooms have scafolding out of the window. apart from that food, service and the rest is just fine but very expensive",November 2012,,,wrote a review Nov 2012,Israel,"['3 contributions', '1 helpful vote']",40,[]
Very average hotel. Probably good by Lagos standards,"For a new hotel, this place does not look great. The finishes are terrible, and tiles are chipped all over the place. The A/C sounds like a Boeing 747 flying through the room. Water from the taps looks like water I would flush down the toilet, and the check in process is diabolical. I am a Starwood Gold member, and tok over 40 minutes to check in, so when people comment about service being a bit slow it is an understatement.  Having said all of this, the hotel has a reasonable restaurant where you can eat the food......a major plus point for Nigeria. Prices for meals at the hotel are horrendous, but this is to be expected in Lagos for edible food. Staff are generally friendly, but not efficient.would I stay here again? Yes, as this hotel is decent by Nigerian standards and",November 2012,,,wrote a review Nov 2012,"Cape Town Central, South Africa","['107 contributions', '77 helpful votes']",30,[]
Wins on customer service,"Have now racked up many many weeks staying here and having tried all the hotels in Lagos at some point this one wins hands down on the service - really very well trained, friendly, and some nice personal touches.  Rooms are simple and room service menu a bit limited - but the terrace bar is very pleasant, and the Brazzerie restaurant pretty good.  The innovation of the coffee bar is great too.  A big thankyou to the staff for making me feel very welcome.",October 2012,,,wrote a review Nov 2012,United Kingdom,"['45 contributions', '26 helpful votes']",40,[]
"Good Atmosphere, Nice","Stayed here for two nights like it a lot, check in a bit slow I get free coffee and very friendly staff make the waiting a bit ok . After traveling10 days around the country from Lagos-Calabar-Abuja and back to Lagos visiting relatives and friends staying in different hotels it feels so good to experience a hotel worth what you paid. Room is tidy and clean, the shower is nice even few little things in the bathroom need more attention, amenities good. Enjoy it a lot with relatives & friends sitting every night at the 'The Office Bar Terrace' great Atmosphere nice music, microphone and sounds system need an up grade. The Lobby area are very nice for meeting friends with a good coffee and croissant. Good Hotel Location. Staff and security are very friendly, polite and professional",October 2012,,,wrote a review Oct 2012,"Zurich, Switzerland","['3 contributions', '2 helpful votes']",40,[]
"Courteous Staff, Good food , Centrally located","This was my second business trip to Lagos and I had previously stayed at the Radisson Blu. I enjoyed the week i spent at the Sheraton  and found the hotel to be clean, modern and safe ( they have security on every floor in the evenings) The views are not that great as you will either find yourself facing the main road or a highway. I found that the power cuts were more frequent this time round ( apparently this is worse when it rains) The food was above average with a variety of dishes available each night. The entertainment at the bar on the second floor could be a little annoying sometimes and the service was a bit slow. However the Giant grilled shrimp and chicken wings were a hit with our party. I had to hire a driver for the week that i was there and i found the  taxi/car",October 2012,,,wrote a review Oct 2012,london,"['6 contributions', '3 helpful votes']",40,[]
