Review Title,Review Text,Stay Date,Trip Type,Room Tips,Review Date,Author Location,Author Info,Overall Rating,Specific Ratings
"Nice, functional hotel","I traveled to Lagos on a short business trip and stayed at this hotel.  My room was very large, and nicely decorated.  The only practical, energy-saving, smart but yet irritating thing was the room key card that also controls the light. The card goes inside a ""device"" to keep the lights on and has to be removed at night to turns them off, ALL of them.  This means that in the middle of the night, in the pitch black, asleep and disoriented (the 1st night at least), you have to remember where you left the room card, as no light works, or feel your way across the cold floor, to the bathroom. There should be at least 1 night light that works independent from this whole system (if there is one, I could not find it).  Other that you must try the delicious, finger-licking good grilled",September 2015,,,wrote a review Sep 2015,"New York City, New York","['25 contributions', '42 helpful votes']",30,[]
Nice hotel on Victoria Island,"The rooms are very big and well equipped, the hotel offers a wide range of bars, restaurants, gym, swimming pool and spa. Overpriced but this is usual in west Africa, food not particularly tasty and by far too expensive.",September 2015,,,wrote a review Sep 2015,"Gussago, Italy","['143 contributions', '79 helpful votes']",40,[]
Event flop,Had an event at the hotel and apart from the fact that it was crazy expensive during the event there was a black out during the show and the staff took their sweet time in ensuring that back up generators were working. The shocker is that no apology was made instead they tried cook up silly excuses. Really sad,October 2014,,,wrote a review Sep 2015,,"['12 contributions', '3 helpful votes']",20,[]
Nice hotel,"I have stayed at this hotel twice, on business. Although a very nice hotel the first thing that I noticed on entry was the very small car park- finding parking space is certainly a problem. Front desk staff were helpful and welcoming. Security within this hotel is very good as you need your room key card to operate the lift with exception of the 1st and 2nd floors where the restaurants are based. The bed was not as comfortable as I would have liked and found it difficult to sleep well. The large shower head in the standard bathtub was not ideal and the water tended to go everywhere which I think is a bit of a design error. I stayed on 7th floor and found the corridors in the lead up to my room cold, narrow and a little unnerving. That said, staff were great, food was always very",September 2015,,,wrote a review Sep 2015,"London, United Kingdom","['55 contributions', '27 helpful votes']",40,[]
Good First Impressions,"My husband & I stayed here for a night on a weekend in August and we had a lovely time. The check in/out was a breeze. The staff at the reception desk was efficient but could have been a little friendlier in my opinion. Our room was cosy but spacious enough for two and very elegantly furnished. I'm a TV girl & the TV selection was very good. Wifi was efficient too, and we could connect with two devices. The breakfast & dinner buffet were quite extensive and yummy but expensive, as expected in most hotels in Lagos. The restaurant staff were very attentive but one guy was quite eager about how we intend to pay which we didn't like. The high point of the stay was when the salon was opened earlier than usual for me to have a blow dry on Saturday morning while the downside was",August 2015,,,wrote a review Sep 2015,,"['10 contributions', '10 helpful votes']",40,[]
"Quiet, Well Appointed Property in Lekki","This hotel has all of things one would want for a fine quality business stay in Lagos. Convenient location, various restaurants on the property and very quiet rooms for a good sleep. The icing on the cake is the staff, each of whom is professional, courteous, and will go out their way to accommodate requests.",September 2015,,,wrote a review Sep 2015,"Nairobi, Kenya","['102 contributions', '91 helpful votes']",40,[]
Review Title,Review Text,Stay Date,Trip Type,Room Tips,Review Date,Author Location,Author Info,Overall Rating,Specific Ratings
Good Hotel on the Lagos Island,"I find this to be a good hotel along the Lekki Road.  You do not want to miss the buffet breakfast.  Also, you may want to book your hotel room in advance if you want to both get a room and a good rate at the same time.",June 2015,,,wrote a review Sep 2015,"Lagos, Nigeria","['208 contributions', '77 helpful votes']",40,[]
The Spa Next Time.......,"Overnighted in May and liked it so much that I returned in August for another overnight.  Inside the lobby is big, gleaming, and polished with minimal yet chic decor.....Nothing major to report about the Check-in/Check-out process....I could care less if you smile at me or chat me up during the process....all am concerned about is getting into my room (and a FREE upgrade all the better but if not no yawa) or checking out of my room without undue hassle and so for that purpose those attending to me really tried and succeeded in doing their job....I divert abit but the check-in/check-out process made me notice how some people lose their manners, sense of civility...they see a person queuing yet still jut to the front desk to be served...or they see the attendant attending to a",August 2015,,,wrote a review Sep 2015,"New York City, New York","['44 contributions', '14 helpful votes']",40,[]
"Terrible experience...staff were either poorly trained, rude or both!","We enjoyed our stay at this hotel on our wedding night and few days just before heading off to Paris for the honeymoon proper. This informed booking a suite for the weekend hoping to have a quiet, relaxing weekend.  The disappointments began at check in. We ended up with a room close to the elevator despite pleas that my 4 month old daughter was a light sleeper and would be awoken by noise in the hallway. Requested for a fruit platter that never came. The next morning we planned to spend the day at the pool but were told that the pool was unavailable due to a private event. At this point we decided to cut short our stay and go some place else to complete our weekend.",August 2015,,,wrote a review Aug 2015,"Lagos, Nigeria","['9 contributions', '3 helpful votes']",10,[]
Nice hotel but expensive,I stayed here for 5 nights in July. I understand Lagos is not a cheap place when it comes to Hotel accommodation and was proved right. Meals at the hotel restaurant were expensive too as compared to other cities I've been to in Africa. Staff was friendly save for one lady at the reception who had some bit of attitude - one guest even told her to work on being courteous. My room was nice though and WiFi worked well which is very important for me.,July 2015,,,wrote a review Aug 2015,,"['57 contributions', '20 helpful votes']",30,[]
Lovely hotel with a great staff,"I stayed at the Four Point in Lagos for a week while there on business. The hotel was more than gracious to have us there. Every part of our stay was above anything we expected. Food was great. Drinks were plentiful and most of all the staff was incredibly courteous and accommodating. My first time to Lagos from the US and will go back there in a second. No problems with their wifi, used it to call back to Los Angeles through Skype and no delays at all - a little freaky when you think about it!",July 2015,,,wrote a review Aug 2015,"Los Angeles, California",['1 contribution'],50,[]
Four Points deserves 5 points,"Nice hotel, large room, very clean, breakfast was very good, shopping possibilities available right next door.This hotel has a big swimming pool, a very nice outdoor restaurant, a gym and a tennis court. The staff here are very nice people It's such a great place to be. You should all come, too!",March 2015,,,wrote a review Aug 2015,"Lagos, Nigeria","['26 contributions', '9 helpful votes']",40,[]
Comfortable,"The hotel is clean and simple. The staff were pleasant and friendly. The room and bathroom were clean and bed was very comfortable. Breakfast was good and quite a wide variety.  On the downside , the parking space is small. Though located in a busy area, it is quiet .  On the whole, I will stay here again.",July 2015,,,wrote a review Aug 2015,"Lagos, Nigeria","['50 contributions', '19 helpful votes']",40,[]
"Good location, nice people","It's a nice hotel with a nice sportsbar, a terrace restaurant and a normal restaurant. All of those are good, sometimes service can be a bit slow though. Hotel pool not really recommended. Did not check the gym.  Rooms are spacious and clean. Try to get a room facing away from the street (due to car noise and sometimes music from the terrace bar).  Location is good for business on VI. But Lagos traffic is always bad, so make sure to take that into account.  In general the hotel is not as good anymore as it has been 1-2 years ago. The hotel director changed from an Austrian guy to a German guy.",June 2015,,,wrote a review Aug 2015,"Linz, Austria","['599 contributions', '230 helpful votes']",40,[]
Nice comfortable hotel,"The hotel is nice and well maintained. The rooms are clean but the view is disturbing as it is still VI. The bathing room is clean but somehow not comfortable as the shower inside the bath. The AC works but makes much noise and it stops when reaching the selected degree. The breakfast is fair and basic, the service is excellent. The GYM is clean and has all the relevant facilities. A big draw back is that there is no garden. I would recommend the hotel as it is still VI.",July 2015,,,wrote a review Jul 2015,"Ra'anana, Israel",['11 contributions'],40,[]
Overall positive experience,"The hotel has a standard sheraton feel. it is situated in a strategic location on the Island. The service was good, though I once experienced the hot water was not coming out when I took a shower. But nontheless, I would recomend this hotel to anyone seeking to stay in a decent place in Lagos (whether on businesss or on pleasure).",July 2015,,,wrote a review Jul 2015,"Calgary, Canada",['1 contribution'],40,[]
Review Title,Review Text,Stay Date,Trip Type,Room Tips,Review Date,Author Location,Author Info,Overall Rating,Specific Ratings
Four Points by Sheraton is very accomodating!,"Wonderful 7 day stay, great enthusiastic staff, gourmet food and comfortable rooms. I wish they had a coffee machine in every room but other than that....quite wonderful. I always felt safe, secure and rested!!!!",July 2015,,,wrote a review Jul 2015,"Appleton, Wisconsin",['2 contributions'],50,[]
Good if you dont go out of VI,"Pros: Good hotel,  safe, rooms are clean , food not bad, good terrace restaurant 2d floor,  Cons: Traffic is the biggest Problem ..  very far from airport and city 3hrs from airport and min2 hrs to anyplace down in Lagos  Very expensive No airport transfers Also regular power outages  Not recommended at all if your business out of the island..traffic jam immediatley in front of hotel entrance..",June 2015,,,wrote a review Jul 2015,"Dubai, United Arab Emirates","['26 contributions', '7 helpful votes']",30,[]
Stay at Four points Sheraton Lagos,Stay at Four points Sheraton was good. Location of the hotel is centrally located and viable from accessibility point of view. The only issue is the traffic jam at the road in front of the entrance of the hotel.,July 2015,,,wrote a review Jul 2015,"Dubai, United Arab Emirates","['22 contributions', '5 helpful votes']",40,[]
Great business location,"This hotel is at the junction of the toll gate between the bridge and Victoria island .  Although all locations in Lagos are tricky, this is a good one to be in. Good food, good rooms , and the staff are extremely helpful.   The only disappointing thing is that all restaurants and pubs have a defined opening time. You Can't walk in after a long meeting and expect to find an open restaurant.  The restutant on the 2nd floor does some amazing grills.....absolutely loved it.  Great location for business.",July 2015,,,wrote a review Jul 2015,,"['32 contributions', '3 helpful votes']",40,[]
Good hotel for business traveller,"I stayed here for a few days on a business trip. The facilities are good with all that a traveller requires - breakfast, gym, pool. The room is comfortable but on the 4th floor the bar on the 2nd floor can be a little noisy. The staff were friendly. Thefood is good but failrly standard. The bars in the hotel are pretty good. Overall, a good place to stay for a business trip and especially if your business is on the island. Otherwise book into a hotel on the mainland because traffic can be an issue going and coming from this location.",June 2015,,,wrote a review Jun 2015,"London, United Kingdom","['278 contributions', '246 helpful votes']",40,[]
Very good accommodation!!!,"I stayed in this hotel for a few days during one of my trips to Nigeria. If your activities is within Victoria Island this is an ok place to stay as it close to shopping mall and cinema as well. The buffet there is very nice. It's always one activity or the other that takes place in the hotel, so you will see many people moving around......this depends on the angle you are looking at it. There was a life band playing one of the days but I don't know if this is a norm.",July 2014,,,wrote a review Jun 2015,"Villavicencio, Colombia","['159 contributions', '22 helpful votes']",40,[]
Good atmosphere but slow and bad service,"I have stayed recently (last week) for a full week there, the welcome experience was not as I expected at all and I have not even been treated as SPG member. The service in breakfast area is really bad you can hardly find someone around to bring you the basic stuff (I have even asked 3 people for a fork to use) I didn't find the stuff to be friendly as they supposed to be.",June 2015,,,wrote a review Jun 2015,,['1 contribution'],30,[]
"Good, efficient place","Four Points is maybe not a newest hotel, but well maintained, with friendly staff and efficiently organized. Breakfast is good, the terrace bar very nice and buffet restaurant acceptable. Somehow despite being a little more aside than International it was faster to get in. Good, reasonably priced choice for VI/Ikoiy",June 2015,,,wrote a review Jun 2015,"Warsaw, Poland","['232 contributions', '89 helpful votes']",40,[]
Good,"Stayed 2 nights during a business trip at the hotel. Really enjoyed my stay there, as it was/is centric (close to the office) - shopping mall just down the road. Friendly staff, and the breakfast was really the first highlight of the day.  only the dinner (buffet) was a bit disappointing (value for money) - but overall - recommended.",June 2015,,,wrote a review Jun 2015,"Johannesburg, South Africa","['324 contributions', '57 helpful votes']",40,[]
Birthday Visit,We stay in a lovely spacious room. The hotel has been well maintained with a lovey ambiance. The staff provided impeccable service. The wifi was relatively fast. I had a lovely birthday dinner. What else can I ask for? I will definitely be coming back for weekends with my family,May 2015,,,wrote a review Jun 2015,"Lekki, Nigeria","['23 contributions', '5 helpful votes']",50,[]
Review Title,Review Text,Stay Date,Trip Type,Room Tips,Review Date,Author Location,Author Info,Overall Rating,Specific Ratings
A spa hotel with a difference,"I spent 8 pretty comfortable nights in this hotel which has some excellent features. The room was very large and well equipped - perfect for business or pleasure. The bathroom was adequate but the hot water took a long time to come through in the shower and then wasn't blistering hot, but certainly adequate for the climate.  The air conditioning was very loud and I had to turn it off to sleep, but the bed was really comfy with large, fluffy pillows. I was disappointed that there was no decaf coffee available in the room and one day my room was nit even looked at, so I arrived back from work with no coffee or milk and an unmade bed.  The main restaurant was excellent, but was a set price for dinner so, even if you just wanted a starter salad, full price was paid. I defy anyone to",May 2015,,,wrote a review May 2015,"Nottingham, United Kingdom","['80 contributions', '33 helpful votes']",40,[]
"Beauty, trendy and quiet",I was at the Four Point hotel for a conference and stayed there for 5 night. Fantastic conference facilities and with great services. the rooms are very contemporary with tasteful artworks and soft linen in the bathrooms. The night activity within the hotel adds to the quality they offer. Breakfast was extensive both local and continental and the waiters we always at hand to help you.,October 2014,,,wrote a review May 2015,"Accra, Ghana","['306 contributions', '68 helpful votes']",50,[]
okay,"The company I work for paid for my two nights stay at the hotel before i traveled  to Dubai for my honeymoon in March 2014 There were no red roses on the bed or complimentary bottle of wine and chocolate when my wife and I came in; I learned later on from my staff that four points was expressly told that we are a couple on our honeymoon but apparently they forgot to do anything about this very important detail. Room service took forever, the wi-fi is very fast and the rooms are clean with a nice bathroom. The gym is also well equipped with instructors to help you with any queries you have. I used one of the hotel's meeting room in March 2015 for a focus group discussion and it took forever for them to give my respondents their tea break.The lady in charge of my booking for the",June 2014,,,wrote a review May 2015,"Lagos, Nigeria","['14 contributions', '15 helpful votes']",30,[]
Ambience of Peace,"The ambience of peace is what I call the coziness of the Four Points by Sheraton in Lekki, Lagos.  I have been there thrice and I felt at peace in lobby of the hotel, because of the welcoming atmosphere without fanfare. And the lobby smells nice too.",April 2015,,,wrote a review May 2015,"Lagos, Nigeria","['15 contributions', '1 helpful vote']",50,[]
Convenient an decent quality,This has become my favored place to stay in Lagos. I've been three times this year. It's a lot cheaper than the intercontinental and wheat baker for example but a good enough quality experience.   The food in the restaurant is pretty good and the coffee good in the cafeteria. There is an outside deck bar on the second floor which does excellent charcoal grilled food - I like the fish and the suya and the staff are very friendly and helpful. There is a decent gym and spa too and the rooms are quite nice. I prefer the ones higher up and facing the Oriental and the expressway rather the lower down ones on the side with the bar deck.   It's not perfect but most of its issues could be easily solved. The room service can be a bit off. We got left twice without towels and they don't,April 2015,,,wrote a review May 2015,"London, United Kingdom","['484 contributions', '181 helpful votes']",40,[]
Good option for business trip,"Been there on February. The Reception staff is polite and professional. The room is very clean, with modern fourniture, no noise from outside. Personally i don't like the floor it looks cold, but i accept it is the best solution for Hotels in Africa. Bed and pillows very, very comfortable. The public areas are well maintained, you feel good and safe there, staff always carry a smile on their face which is quite good. I've tried the restaurant and both bars, and i can say you don't have many options from the menu, the staff is kind and food is ok but the service is a little slow. In my opinion you get what you need for a business trip. You have anything you may need inside, which is very important in Lagos. I'm sure i'll be back.",February 2015,,,wrote a review Apr 2015,"Porto, Portugal","['66 contributions', '34 helpful votes']",40,[]
"Good business hotel, almost all friendly staff","Stayed for the second time at the Four Points. As a business hotel, is has got what you need. When arriving late there's a possilbilty to have a nice small diner at the roof top bar and also for classy dining there is a restaurant in the hotel (which saves you a trip on the streets of Lagos).  The hotel is centrally located, has (mostly) friendly staff and is clean. The internet connection (complimentary) isn't very stable but that's pretty common in Nigeria.",April 2015,,,wrote a review Apr 2015,"Noosa, Australia","['12 contributions', '9 helpful votes']",40,[]
"“""Always bubbling""”","I last visited here about one year ago. No doubt I enjoyed myself then as has always been the case. I have made many visits to this hotel and have utilised their facilities many times over. Their rooms are good and very spacious. Their panoramic lifts make life pleasurable. You can always have your buffet if you so desire at breakfast, lunch or dinner. Their food is good but fairly expensive. This is also applicable to their drinks; but you will never regret having had a meal or drink at this hotel. You may run into a little traffic especially if you are visiting the hotel after office hours; but once you beat pass the traffic and enter the hotel you are assured of having a good time. There are two specific segments of this hotel that would remain always on my mind: THE OFFICE",April 2015,,,wrote a review Apr 2015,,"['75 contributions', '16 helpful votes']",50,[]
My first visit to Nigeria,My stay at Four Points in Lagos was great. This was my first visit to Nigeria. I had heard thousands of horror stories none of which turned out to be true. The staff was great and assisted when needed. The room was spacious and comparable in price and size of hotels here in the US. I plan to return in a few months and look forward to staying at Four Points again.,March 2015,,,wrote a review Apr 2015,,"['2 contributions', '2 helpful votes']",50,[]
Comfortable,"I spent just one day as my trip was just a days trip.  Check in time was too long and the seats at the reception was fully occupied,  at that time we didn't know that we could sit at the bar/ dining so we sat at the empty seat and we're told to leave because it was reserved for loyalty customers.  WiFi was very poor as I could not log in at my room on the second floor.  The WiFi at the lobby could connect but this was also very poor.  Now to the good part.  The rooms were very comfortable,  spacious,  the bed was very soft.  When I got back to my room later in the evening I had complimentary apples and a hand written note from the manager.  This was so nice.  Basically apart from the bad WiFi which I think is a general problem in Nigeria the hotel is a place I would definitely",March 2015,,,wrote a review Mar 2015,,"['19 contributions', '9 helpful votes']",50,[]
Review Title,Review Text,Stay Date,Trip Type,Room Tips,Review Date,Author Location,Author Info,Overall Rating,Specific Ratings
Great facilities and care,"I had 8 nights here in February / March. During this time I fell ill and whilst recovering asked for the room cleaning to be skipped for a day. In no time the manager arrived with medical staff to attend to me. Even some of the restaurant staff showed concern and kept enquiring about my recovery. Because of the illness I didn't try the pool, but it looked lovely. Business travel from this venue was convenient due to the centrality on Victoria Island. I have learned that in spite of all the stories, I experience the people of Lagos as being very caring.",March 2015,,,wrote a review Mar 2015,"Cape Town, South Africa","['20 contributions', '7 helpful votes']",40,[]
Very good but could improve a couple of things,"As always, my review here is based on rating this hotel against others in Nigeria. The Four Points is nice and clean with friendly staff. I am sure my room had even been recently refurbed.   The buffet is one of the better I have tried in Lagos and the bar is good for watching EPL football if that's your thing.   The staff are friendly and helpful but none of them knew about the option to get Emirates miles instead of SPG points, despite a big sign in reception!! Also the outside bar plays loud music until very late  so if you have a room on the wrong side of the hotel you will have your sleep disturbed. Even on the fifth floor it was still very loud! It's for this reason I can't give more than 3 stars for my visit.",March 2015,,,wrote a review Mar 2015,"Dubai, United Arab Emirates","['56 contributions', '58 helpful votes']",30,[]
Comfortable stay,I stayed here recently for about 8 days during a business trip to Lagos.  The room was very spacious and clean.  Live music on Friday and Saturday nights are a plus after a long day.  The gym is well-equipped.  The restaurant served buffet with local dishes which was nice.  Overall I enjoyed my stay and would recommend this hotel.,March 2015,,,wrote a review Mar 2015,"Raleigh, North Carolina","['29 contributions', '21 helpful votes']",40,[]
Central Location in Victoria Island,"Stayed here for a couple of days before Christmas, wanted a place with easy access for the activities had planned for the family. (i.e. stage play at the Muson centre, cinema at the galleria, car racing at Getarena). Packaged deal came with breakfast which had a decent selection, but packing space can be a challenge and it is very nosy and busy outside. This is definitely not the place to go to relax from the hustle and bustle of Lagos, but its location is perfect and easy access to all the major business places. It's abit pricey but then hotels in Lagos usually are. Staff were courteous albeit too busy at times for the personalised feel.  Overall, stay was good and serve its purpose.",December 2014,,,wrote a review Mar 2015,"Lagos, Nigeria","['76 contributions', '26 helpful votes']",40,[]
