Review Title,Review Text,Stay Date,Trip Type,Room Tips,Review Date,Author Location,Author Info,Overall Rating,Specific Ratings
One of the best hotels in Lagos,"We stayed here for 4 nights and we absolutely loved everything about the stay except the fact that they messed up not picking us up on arrival at the airport  and the check in lady not recognizing my Hilton Honors Diamond. Both the the Front Desk Manager and General Manager reached out and owed responsibility for the mistake and sincerely apologized and I really appreciated that. I can't recommend this hotel enough to all my family and friends visiting Lagos. This hotel is very clean, quiet and peaceful. The restaurant staff members are excellent and food is amazing. I highly recommend this hotel and I will be back myself in a few months for another great stay.",June 2021,,,wrote a review Apr 2022,"Las Vegas, Nevada",['1 contribution'],40,[]
Impressive!,"Stayed here for a night due to it's proximity to the airport and having a very early flight. Was very impressed with the cleanliness, ambience, facilities and determination by staff to satisfy us as customers. Highly recommended.",April 2022,,,wrote a review Apr 2022,"Glasgow, United Kingdom",['2 contributions'],50,[]
Great place by the International Airport,The hotel is comparable to any standard hotel in the world. The facilities are good and the location is a great advantage for International travellers. The private hanger for private jets is just behind. It is a location to stay over while passing through Lagos,June 2021,,,wrote a review Apr 2022,"Ikoyi, Nigeria","['168 contributions', '45 helpful votes']",50,[]
LUXURY AND PREMIUM,"Legend Hotel is a very classy, premium and luxury hotel. Spacious room, excellent food and wine. I will pick Legend hotel over and over again. Thank you so much for your hospitality. Y’all are the best.",April 2022,,,wrote a review Apr 2022,"Lagos, Nigeria","['13 contributions', '8 helpful votes']",50,[]
Nice experience,"good, clean ,nice rooms , nice shower and excellent bed. i recomend this hotel to stay. it is near the airport. The swimming pool was not operative during the weekend , i cant understand why the hotel need to clean the swimming pool during the weekend when the week has 5 more days to do this task.",March 2022,,,wrote a review Mar 2022,,"['13 contributions', '2 helpful votes']",40,[]
Best Hotel on the mainland,"This is definitely my favourite hotel on the mainland. Nice, secure location. None of the traffic headaches. Standards have been maintained for 2/3 years I’ve been staying here. I always look forward to staying here.  The food is delightful. The rooms are big and well cooled. Sound-proofed windows ensure the flights in and out are minimal disturbances.  I can’t stop recommending this hotel. Staff are ever so pleasant.",February 2022,,,wrote a review Feb 2022,"Accra, Ghana",['4 contributions'],50,[]
Awesome Stay,I had a wonderful time at Legend. It is very close to the airport. Great customer service and security. it is also a perfect location for short trips to Nigeria that you don't want to travel deep into Lagos.,February 2022,,,wrote a review Feb 2022,,['1 contribution'],50,[]
Great experience,"Fantastic stay! Highly secured and impressive front desk customer service, neat environment and comfortable room, including a gym, poolside hangout, tasty and healthy food at the restaurant. Easily accessible to domestic and international airport terminals",January 2022,,,wrote a review Jan 2022,"Abuja, Nigeria",['2 contributions'],50,[]
Alaba,"Great hotel. Facilities, services and personnel topnotch as usual. It is a very competitive facility and comparable to top facilities globally. It is my usual first choice in Lagos but availability could be a challenge due to high level of patronage.",January 2022,,,wrote a review Jan 2022,,['1 contribution'],50,[]
Excellent all the way around!!,"This is my third time staying at Legend in the last year. Each stay has been nothing short of superb and exceptional! The rooms are identical to Hilton Hotel rooms and bathrooms are in the United States - clean, large, updated functional equipment and exquisite attention to detail.  The staff standard of service is exemplary, admirable and extremely professional. The complimentary breakfast at the in-house restaurant is another feature of Legend that keeps me coming back! They have a wide variety of buffet options every day. There’s something different every day! They have a variety of Nigerian foods and dishes from various countries.   Legend enforces strict mask wearing policy in compliance with Federal laws. The premises are cleaned frequently.  There is a security luggage",January 2022,,,wrote a review Jan 2022,,['1 contribution'],50,[]
Very Pleased,The hotel is located in very good location and the security and cleanliness is very good. I would recommend the hotel over and over again to friends and family. The staffs were very pleasant and wrlcoming,January 2022,,,wrote a review Jan 2022,,"['5 contributions', '6 helpful votes']",50,[]
Best stay ever!,"I had a really good stay at this hotel. Everything was perfect. From the moment I made my reservation to the moment I arrived and the moment I left I felt extremely cared for. All the staff were very friendly and extremely helpful. I found the level of hygiene to be quite high. The food was delicious, the service was great and the ambience was perfection. I will definitely be recommending this hotel to all my friends and family and I will definitely be back.",January 2022,,,wrote a review Jan 2022,"London, United Kingdom",['1 contribution'],50,[]
Luxurious,The  hotel leaves you feeling very luxurious. I totally enjoyed the time spent with the family. Breakfast was really good with a wide variety and in room dining was equally good. The staff are a delight to interact with.,December 2021,,,wrote a review Jan 2022,"Lagos, Nigeria","['2 contributions', '2 helpful votes']",50,[]
Excellent luxury hotel!,"The legend Hotel Lagos, met and exceeded my expectations! Clean, luxurious and classy. Easy access to the private jet terminal, from the hotel! Surrounding environment outside is a little tricky! Room was great! Excellent food and service as well. Overall this hotel is highly recommended!",October 2021,,,wrote a review Oct 2021,"Menomonee Falls, Wisconsin",['2 contributions'],50,[]
Lagos Best!,"I will be very detailed here considering I spent a lot of money and time here. 😂😉  Location to and from the Airport 10/10  Ambiance/Environment, Lobby/Security :10/10 Amenities(Pool, Gym,Terrace,Bar):10/10 Staff/Customer service:10/10 Restaurant food “De Bull”: 8/10 Room, bathroom: 9/10 Close to city (mainland): 10/10 Close to city (Island) : 6/10  Pro:  I had an amazing 2weeks stay here at the Legend. I arrived early at around 8am before check in due to early flight arrival, and was accommodated by happy front end staffs. I initially planned to stay here for a week, then go to the Island and return here on departure (very close to the airport) but; I ended up extending my stay here till I left Nigeria. I was upgraded (Hilton Honors upon request and availability) to a bigger",October 2021,,,wrote a review Oct 2021,"Los Angeles, California",['2 contributions'],50,[]
Fantastic stay at Legend hotel in 2021,"We stayed at Legend hotel for this 6 day trip to Lagos, Nigeria. Right from the check in experience with prompt and courteous service from the entrance all the way to check in to our room. The on site restaurant was top notch with the menu selection and quality of food (be it Nigerian or foreign selection).",September 2021,,,wrote a review Oct 2021,"Houston, Texas",['1 contribution'],50,[]
Excellent Stay at Legend Hotel Lagos,How excellently  I was treated at Legend Hotel Lagos from the time I checked at 11.30 pm to the time I left in the morning with a wonderful breakfast as early as 6.30 am. It was a wonderful experience.,September 2021,,,wrote a review Sep 2021,,['1 contribution'],40,[]
Excellent hotel,The hotel is a clean and luvly place to stay. The distance between the hotel to the airport is very short you can walk to the airport from the hotel. The place is very secured and all Covid 19 protocol was observed,September 2021,,,wrote a review Sep 2021,"Lagos, Nigeria",['1 contribution'],50,[]
Nice place,"Brilliant hotel, first class service , Food was very good and all ensured I was comfortable. Room stayed in was overlooking aircraft takeoff , little nephew who came to visit me was very excited about this feature as he could see at very close distance planes leaving the airport . Proximity to airport meant you would avoid traffic coming into airport to a large extent.",August 2021,,,wrote a review Aug 2021,"Wolverhampton, United Kingdom",['1 contribution'],50,[]
Best Customer Service in Nigeria,Will return back anytime am in lagos The customer service and friendliness of the staff made me enjoyed my shoe th stay. The rooms were very clean. The whole hotel environment was luxury. I have value for my money.,July 2021,,,wrote a review Jul 2021,"Dammam, Saudi Arabia","['4 contributions', '1 helpful vote']",50,[]
And breath.....,A sea of calm in an otherwise hectic ocean. Very modern and contemporary hotel. I haven't stayed but came for a meeting. Staff are very professional and efficient. Naomi in 'de Bull' was really good. Informed and friendly. Prices very good and food so far looks great. If you're waiting for a flight and want to relax there are very few options near the airport. I recommend this place,July 2021,,,wrote a review Jul 2021,"London, United Kingdom","['104 contributions', '71 helpful votes']",40,[]
Honestly hard to fault!,"LOCATION The hotel is five minutes from the airport A taxi costs 10,000 naira (£20) even though it’s a five minute drive, you could even walk to check in if you are travelling light.  It’s convenient for check-in, arrivals/departures especially considering Lagos traffic which can take up to five hours on a bad day.  It has a private immigration check in for private jet flights.  The hotel is a couple of years old so everything is in top shape. The decor is as expected of a Hilton and tasteful.  On arrival your baggage is screened and standard precautions are taken as expected during this Covid period. Expect to be scanned before entry (as in airport style) but quick and efficient service!  CHECK IN  Check in  was uneventful there was no queue the staff were lovely pleasant and",April 2021,,,wrote a review Apr 2021,"London, United Kingdom","['388 contributions', '74 helpful votes']",40,[]
Very convenient,"Excellent experience, Charles at front-desk was amazingly professional and friendly, great rooms, excellent internet, very safe, need more variety on in-room-dining, best option if looking for a hotel near the airport",March 2021,,,wrote a review Mar 2021,"Dubai, United Arab Emirates",['5 contributions'],40,[]
Nice,"Although having stayed such a short time, hotel is nicely furnished, and clean. Seems brand new, one advantage is to be closed to the airport. You don t need to be in the middle of Lagos. Breakfast is also nice. Staff is helpful and in comparison to other people working in other hotel, has a smiling face. Wi-fi is average.",February 2021,,,wrote a review Feb 2021,"Istanbul, Türkiye","['173 contributions', '88 helpful votes']",40,[]
Fantastic Experience,"I've stayed at this hotel about 3 times now. The quality of the rooms and service are CONSISTENTLY EXCELLENT! The staff's their best asset. Its proximity to the airport is fantastic if you're traveling. You can literally walk to the airport terminal from the hotel. The food from the restaurant is consistently excellent - whether you're in the mood for a local delicacy or you just want a burger! I cannot recommend this hotel highly enough. If like me you've experienced this hotel and are concerned you might not be able to book a room in the future because it'll be fully booked (because it actually will), lay your fears to rest. The hotel is expanding and adding more rooms! As Curio collection Hilton hotel, this hotel does not disappoint. Need a hotel? Go to Legend!",January 2021,,,wrote a review Jan 2021,,['1 contribution'],50,[]
Exceptional Customer's Experience,"To The Whom It May Concerned: The General Manager of legendary Hotel Ikeja.  My family with my office colleagues  really want to appreciate you on the basis of the great quality of services we got two days back at flight lounge by OSCAR's.Oscar was extremely professional,and this is  the second time we are being satisfied with his body language of friendliness and warm smiles during our full dinning.  The young man made our day great ,that boy is exceptional.He was very communicating when suggesting for us through menus,including our drinks.God!all my team colleagues were extremely happy because of that young man Oscar.  He Offers great recommendations of dishes to us,repeated each of the food and drink orders without formal mistakes.My kids were happy too.  The waiter was able",December 2020,,,wrote a review Dec 2020,,['2 contributions'],50,[]
High Standard Hotel But Room For Improvement,"The legend hotel is a branch by Curio Collection, Hilton located in Lagos mainland.  Having stayed in over 30 hotels in Lagos state I rated it a 3/5 and here's why...  PROS:  - Right by the international airport and is less than 5 mins drive to the local airport for domestic flights.  - Rooms are a good size, well furnished (to international standard) and include all the necessary mod cons and more.  - The water in the shower is hot and very good pressure. You can run a hot bath is you wish - The hotel has a nice pool on the second floor, but the water is cold. You can also make use of the steam room.   - Breakfast is included  - Breakfast choices are very good and meet all dietary needs.  Full English, choice of cereals, yogurts, smoked meats and cheeses are available. There is",October 2020,,,wrote a review Nov 2020,"London, United Kingdom","['154 contributions', '40 helpful votes']",30,[]
Highly Recommended,"A beautiful and well located hotel,and just a few minutes away from the airport, about 5minutes. And the ambience is at par with Hilton known standard. In a quiet and secluded spot but also a central location.",February 2020,,,wrote a review Apr 2020,,"['15 contributions', '1 helpful vote']",50,[]
Good service,"What I love most about the hotel is their splendid service. It makes your money worth every penny, the food is great too,if your looking for a place to stay close to the airport then I recommend it as your first choice.",February 2020,,,wrote a review Mar 2020,"Lagos, Nigeria","['10 contributions', '2 helpful votes']",40,[]
excellent hotel,"great value, clean , peaceful, all facilities perfect. Professional attentive staff and very good conference facilities. Food and restaurant very good, interesting hotel with quirky  innovative airy architecture. Hope the 5 star standards are maintained.",February 2020,,,wrote a review Mar 2020,"cambridge, United Kingdom",['2 contributions'],50,[]
Probably best high-quality hotel nearest to airport for short stay,"3rd time I have stayed here for 1 night and it is extremely convenient, modern, clean and comfortable.  I think it is a bit on the high side price-wise given a breakfast is not included with a $270/night cost and the restaurant is extremely expensive for avg. to less than avg. food with a very defensive restaurant staff.  There is not alot of lounge or public space so you will spend most of your time in the room. Those would be my only not-so-great points to note.  Other than that it is a lovely hotel and ultra convenient given the location.",March 2020,,,wrote a review Mar 2020,"Milan, Italy","['99 contributions', '57 helpful votes']",40,[]
Gem show in the Lagos airport zone.,"This hotel is a gem in the airport zone. The facility, staff and amenities are top notch. I also loved the restaurant. The food quality and service are amazing. I am glad that I discovered it. Hilton should do a better job advertising it.",February 2020,,,wrote a review Mar 2020,,['1 contribution'],50,[]
A new gem in Lagos,This is a hidden world class hotel with great view. It is right by the International hotel. Very secure and neat. The staff are very courteous and the room very comfortable. It is worth the money; believe me,February 2020,,,wrote a review Feb 2020,"Ikoyi, Nigeria","['168 contributions', '45 helpful votes']",50,[]
Brands beware of Nigeria,"Companies need to audit their brands in these regions. The level of upkeep and service will affect their business in the future. Was not treated like a Hilton member, expats in management might be the answer.",February 2020,,,wrote a review Feb 2020,,"['1 contribution', '1 helpful vote']",30,[]
Excellent location,"Good located if your flight arrived late into Lagos. The staff was excellent and room service was food and food was good. However, I believe the room staff did not change the sheets I slept on because I could smell the previous users body odour, which was a huge put off.",February 2020,,,wrote a review Feb 2020,"Lagos, Nigeria",['1 contribution'],40,[]
Hidden gem close to Lagos international airport,"The discovery of this hotel was a pleasant surprise. Beautiful, modern, and very close to the airport. Amazing staff who pay attention to details in every sense of the word. I had a very nice experience and will definitely recommend it. Breakfast selection was diverse, both local dishes and international cuisine was available. My only complaint would be the connectivity issues.",January 2020,,,wrote a review Feb 2020,"Hamilton, Canada","['80 contributions', '65 helpful votes']",40,[]
Final mother/daughter hotel bonding,"I ordinarily live in Lagos, and pride myself on being widely travelled. On checking into this hotel I got the most pleasant shock of my life. Tucked away in the airport is this better home away from home. It might be pricey for the average Nigerian but you get hilton standard and Hilton service. As you wait to check in you are offered a drink of choice. The bell boys take up your luggage with a smile asking if there is anything more to make you comfortable.  The information form was already printed and all I needed to do was sign.  The rooms sparkling clean and wonder of wonders  molton brown toiletries. The pool was infinity design and had a water fall bordering it, wonderful for photo ops. The lobbies fronted on the tarmac and you could plane gaze as you sip your very chilled",January 2020,,,wrote a review Jan 2020,"Lagos, Nigeria","['15 contributions', '33 helpful votes']",50,[]
"Worth the price, won't last long!","Beautiful hotel exactly like the pictures. Less than 5 minutes taxi drive to the international airport. Not too far from Yaba market (about 15 minutes taxi). No need to leave for breakfast, lunch or dinner. No gift shop though which is kind of a let down. Also no nightlife, club or casino attached. The area is not a walking area either.",December 2019,,,wrote a review Jan 2020,"Houston, United States","['8 contributions', '1 helpful vote']",50,[]
My Lagos Curio experience,"My Lagos Curio experience was good. Hilton has a way of honoring their own. Safety of the customers is a priority for this Hilton location. From the airport to departure, they were equal to the task. I thank them very much. Would stay here whenever I travel to Nigeria",December 2019,,,wrote a review Jan 2020,,"['5 contributions', '1 helpful vote']",50,[]
Perfect for solo stay,"The location of this hotel makes it a perfect place for travelers to stay. Good for people on business people. The whole environment is calm and neat, bar is exquisite, pool is nice, restaurant is also very nice and has continental dishes",December 2019,,,wrote a review Dec 2019,,"['1 contribution', '1 helpful vote']",50,[]
It's my home away from home...,"I was told about this hotel by colleague and I looked forward to experiencing it. From the moment they handled my reservations professionally, responded promptly to every enquiry, I knew I had made the right decision. Check in was stress-free and my room was just as it was promised on the website. Looking forward to my next visit...",December 2019,,,wrote a review Dec 2019,"Abuja, Nigeria","['1 contribution', '1 helpful vote']",50,[]
Sola,The customer service from the staff is second to none. Very courteous and professional and they all seem happy doing what they love doing. Very helpful staff. The food is very nice and the location is great,November 2019,,,wrote a review Nov 2019,,"['1 contribution', '1 helpful vote']",50,[]
Seminar and business trip,"Hotel is great, beautiful rooms and amenities.  Certainly a great hotel and close to airport Seminar area was great although they could use larger and better screens as well as newer HDMI projectors Food was not bad at hotel although waiter service distracts totally from what hotel offers.  Manager however did address the issue.",November 2019,,,wrote a review Nov 2019,"Centurion, South Africa","['45 contributions', '3 helpful votes']",40,[]
An Oasis in a Hectic City,"This is one of the best cleanest and best serviced hotels I have visited.  Right from the start we were greeted with a warm welcome, shown to our room and provided with everything that we asked for.  The staff always goes out of their way to ensure that you are well taken care of.   The rooms were exceptionally clean and cared for.  The beds and pillows are very good.  The black out curtains do a fantastic job.  We landed, jet lagged and tired after 24 plus hours of travel.  Our room was dark, quiet and so comfortable we slept well into the next day.   The food in the restaurant is quite good and the service is fantastic.  At the pool, drinks are always ready and towels are provided. I can't say enough good things about this hotel, it is literally one of the best I have visited.",July 2019,,,wrote a review Nov 2019,"Ontario, Canada","['31 contributions', '28 helpful votes']",50,[]
Best Airport Hotel in Lagos,"Used to stay at the Sheraton Ikeja every time I visited Lagos and this time I thought we’d give the Legend a try.  What a breath of fresh air !! The hotel is very clean, the food is great and the staff could not be more helpful.  Large rooms fully equipped, and always clean.  The Bull restaurant menu is great and the food just as good.  The staff from the start of our stay have been amazing.  If it’s the airport hotel you need, the Legend couldn’t be a better place to stay.  Needless to say, next time I’m back, I’ll be at the Legend!!! And I don’t even leave until Saturday morning in 3 days.  Love the Legend.",November 2019,,,wrote a review Nov 2019,"Haywards Heath, United Kingdom","['21 contributions', '27 helpful votes']",50,[]
Excellent,"A full five stars for the hotel. The location is close to both internal and local airports. The hotel is clean, quiet, the rooms are big beds cozy and the staff friendly.  It has a fully equipped gym, pool and pretty good restaurant. The only down side is the price of the food at the restaurant but their breakfast is fully stocked",November 2019,,,wrote a review Nov 2019,"Johannesburg, South Africa","['1112 contributions', '213 helpful votes']",50,[]
Legend Hotel Lagos Airport - another Hilton brand quality you can trust!,"This is your hotel if you're traveling to Lagos and you need a secure, immaculate, good food, excellent customer service and very quiet place to stay. I'm a Hilton Diamond member (for 10+ yrs) and I can confidently say the Legend Lagos Airport Hotel is on par with the other Hilton Hotel brands worldwide. Kudos to the Management!",October 2019,,,wrote a review Oct 2019,Arizona,"['2 contributions', '1 helpful vote']",50,[]
Fun and work,The food was great and the view from the pool side was amazing. Plus the customer service was very good. peaceful and family friendly. also you can erijoy and an over view of the private jet terminal with executive Access to the main airport.,October 2019,,,wrote a review Oct 2019,"Lagos, Nigeria","['73 contributions', '66 helpful votes']",50,[]
My experience at Curio,"For my business trip, it was pleasant; however, there should be pastry shops and perfumery to serve the tourists. I also thin that Hilton Honors guests should receive fresher fruits than was served last week",October 2019,,,wrote a review Oct 2019,,['1 contribution'],40,[]
First truly 5 star hotel in Lagos,"A true 5 star, modern and upscale new hotel in Lagos. The facilities (rooms, bathrooms, etc.) are large, comfortable and clean. It is in a quiet environment and very close to both the domestic and international terminals",October 2019,,,wrote a review Oct 2019,"Abuja, Abuja Capital Territory, Nigeria",['1 contribution'],50,[]
A beautiful twist to an Airport Hotel type,"This beautiful Hotel is ensconced in and integral to a Private Aviation facility. near both the International and Local Airports. The Private Jets taxiing to parking  outside your window add an additional spectacle; my daughters when they stayed here earlier were quite excited about this and , of course, the sort of a hanging pool on the 2nd floor.. The dark steel and glass, pagoda roof style design is well coordinated throughout. Rooms are very clean and well provisioned with a Safe, Ironing table, Electric Kettle and a selection of Coffees and Teas. Bed was very comfortable; I'd not slept better in while. Service was welcoming, helpful and courteous. Service at the restaurant was prompt . The food, Lamb Ribs, was ok but not fantastic. All told, This is a hotel I will certainly",October 2019,,,wrote a review Oct 2019,"Kaduna State, Nigeria","['35 contributions', '37 helpful votes']",50,[]
