Review Title,Review Text,Stay Date,Trip Type,Room Tips,Review Date,Author Location,Author Info,Overall Rating,Specific Ratings
Bness,"The stuff are super nice. Rarely u can see such hospitable crew. I appreciate a lot their service. Inspire of the fact that internet or electricity goes down sometimes, these people made their best so I enjoy my stay.  The food is yummi. Rooms are nice n clean.  Bravo!  :*",December 2015,,,wrote a review Dec 2015,"Dubai, United Arab Emirates",['4 contributions'],50,[]
Absolutely loved this place....,"The hotel is a small boutique property, elegant and quiet whose staff can't do enough to make your stay comfortable and enjoyable.Rooms are beautifully furnished and clean. The quality overall was excellent (I LOVED the bathroom fixtures), and everything was clean and spotless. The bed linens after a long flight were an absolute delight. Pure comfort and great amenities. The breakfast was excellent with a wide selection of hot and cold offerings .Enjoyed the time spend by the pool on the beautiful terrace .The ride to and from the airport worked out great. Highly recommended!!!!!!",December 2015,,,wrote a review Dec 2015,"Abu Dhabi, United Arab Emirates",['1 contribution'],50,[]
An excellent choice,"Lagos generally has a price / quality problem, where to get anything decent you pay a fortune and then still find issues. On a recommendation from some cabin crew I tried Protea Leadway and what a pleasant surprise. The rooms were above average, had all the facilities, good a/c, good water temp and pressure, nice beds, clean towels etc and a decent wifi service. What really set it apart was the staff. Big ups to the management for the training done, every staff member was polite, greeted me with a smile and seemed genuinely pleased to help - what a pleasure for Lagos.  The airport collection was easy to find and on time, check in was done by name and was very efficient and the breakfast service was a highlight - a good, comprehensive, fresh choice of food. Dinner was more of the",November 2015,,,wrote a review Nov 2015,"Cape Town Central, South Africa","['52 contributions', '56 helpful votes']",40,[]
Nice hotel,"The hotel was actually up to standard. I give it a solid B. So I'd stay again biggest put off was the smell of smoking coming from someone's room. The outside is a little deceiving but the inside is up to your the US Courtyard Marriott standard. The only real big issue with this hotel is the cost of the hotel. If it was ~$75-85 less it would get 5 stars. At their rate id expect a Hyatt Regency type hotel.  But for Lagos I will say it's good, strong B grading. Maybe some perks they can add is free hotel pick up and drop off and local rate for food for hotel guest. This would make it an A hotel.   Pro:  Staff awesome (A+) Bed is decent (B+) Shower works good (A+) Sink works good (A+) Pool is nice Gym is small but seems functional  Cons: Smoking rooms near nonsmoking rooms; greater",November 2015,,,wrote a review Nov 2015,"Seattle, United States","['9 contributions', '1 helpful vote']",40,[]
"Wonderful Place, excellent staff, very comfortable rooms","This is a mid-sized hotel which shouldn't be compared with the huge chains. However, it is a wonderful place to stay. The rooms are cosy, very well designed. The staff are extraordinarily helpful.  The gym is small (probably get around 4 people in it at a time). The pool is 'OK' not very big, so if this is a big issue, look elsewhere.  There is free wifi throughout the hotel. Unlike other places it does seem to hold up (and not keep disconnecting). The food is decent  Overall a very satisfactory experience!",November 2015,,,wrote a review Nov 2015,,"['119 contributions', '53 helpful votes']",50,[]
Always good to be back,"This is my second trip back to the property this year and it was so nice to be greeted by friendly staff who remembered my name. Since it was my second trip I noticed things differently this time. The location is an ideal distance from the Airport--not too close and not too far away. Additionally, we made a trip to the Island and it seemed easy for my driver to get to.   The breakfast buffet is really good and the ambience is comparable to some of the nicest hotels I've stayed at in the USA.  This trip I had a meeting with a tribal ruler from another state who seemed more than happy to join me at this property with his entourage. They were taking many selfies by the beautiful pool deck and seemed impressed.  I always appreciate the security personnel as well. Never felt in any",October 2015,,,wrote a review Nov 2015,"Park City, Utah",['2 contributions'],50,[]
Bad check-out & irresponsible staff,"The interiors are great, the bed is really cozy, the bathrooms are nice and clean. Most of the staff are helpful and customer friendly.   The food is not all that great and as a vegetarian, no much options available.   I'd ordered food to the room & after tasting the food, I realized, it wasn't well made and lodged a complaint. The gentleman said, he would take care of it. While checking out I was billed for it. The duty manager was more keen on attending to new guests than attend to my complaint. Waited for sometime to get the issue resolved, finally I paid up for the bills and rushed, to get to the airport on time.   I liked the hotel but this incident put me off.",October 2015,,,wrote a review Oct 2015,"Dubai, United Arab Emirates","['36 contributions', '41 helpful votes']",20,[]
Review Title,Review Text,Stay Date,Trip Type,Room Tips,Review Date,Author Location,Author Info,Overall Rating,Specific Ratings
Great stay and support,"It's often difficult travelling to Lagos , Nigeria. Getting from the Airport to your hotel and finding a welcome haven to start your business trip. Dean and his team at the Protea Leadway , took care of all of those concerns. We were met at the Airport, ferried quickly to the hotel and there met by his efficient team. check in was seamless and in no time at all , we were enjoying a quite beer in the lounge ! What a pleasure ! Thanks to Dean and the team !",September 2015,,,wrote a review Sep 2015,"Lagos, Nigeria",['1 contribution'],50,[]
Mr,"This is the second time I have stayed at the Leadway Protea Hotel and it was wonderful. Close to the Airport. You cannot believe that you in Lagos when you sitting in the lounge, it reminds me of when I am sitting in a hotel in South Africa. The GM Dean was very accommodating making sure that your every need is taken care of. The chef Wayne is always willing to bend over backwards for you in the kitchen with his culinary skills. A home away from home. A great hotel, great service, clean and safe. Keep up the great service. I can recommend the Leadway Hotel to anyone that travels to Lagos.",September 2015,,,wrote a review Sep 2015,,['23 contributions'],50,[]
A comfortable stay with great service.,"This is my favorite hotel in Lagos. It is professional, very clean and the staff is extremely helpful and friendly. Facilities are well taken care off and management is always available to assist with any queries.",September 2015,,,wrote a review Sep 2015,"Lagos, Nigeria",['1 contribution'],50,[]
The only place to stay when in Lagos,"I have stayed at many different hotels in and around Nigeria, but the Leadway Protea Hotel in Maryland is the best Hotel I have visited in a long time, regardless of country. The hospitality and professional service is world class. The food is excellent and when I come to Lagos again, this will be the only Hotel for me to stay! Thank you guys for making my trip enjoyable and keep up the great work!",September 2015,,,wrote a review Sep 2015,"Lagos, Nigeria",['3 contributions'],50,[]
All class,I travel often and this hotel is my choice when I'm in Lagos.Well run hotel. Friendly and professional staff. The social area is always clean and well maintained. Rooms are clean and well equipped. The décor ranks up there with the best of them. Staying in hotels is not always about appearances and although it plays a big roll. It's the way the staff attends to the guests. I can honestly say that the staff and management has always made me feel at home.,August 2015,,,wrote a review Sep 2015,,['1 contribution'],50,[]
Nice,I liked the hotel it's soo nice I wish to b here again it's feels like home . Nice rooms clean the the stuff are so friendly and open the have fitness centre and a very pool and the prices are so good . There buffet is cool a lot of food . U can relax very well there,September 2015,,,wrote a review Sep 2015,,['3 contributions'],50,[]
Excellent place to stay in Lagos,"Excellent friendly staff. Double bedroom was clean with good layout. Very courteous staff helpful at all times. Excellent air conditioning, bath and shower in very good condition. Restaurant staff courteous. Very good food served for breakfast and dinner. I would recommend the hotel to anybody coming in to Lagos from abroad.",June 2015,,,wrote a review Jul 2015,"Greater London, United Kingdom","['5 contributions', '5 helpful votes']",40,[]
"Exquisite, cosy and serene hotel","If you want to hide from the hustle and bustle of Lagos, this is the hotel to be. Tucked in a side street off ikeja, the hotel, though medium sized is well designed. I loved the brick wall that separated the bathroom from the main room, I love hotels that pay attention to details and they definitely did with a bar of chocolate waiting on my bed and a personal note with my name on it. The only minus was that the electric socket on the walls was south African, which we don't use in Nigeria. Luckily, I had recently returned from joburg so I used one of the adaptors I bought. I enjoyed every bit of the money I spent for my one night stay.",June 2015,,,wrote a review Jun 2015,"Bonn, Germany","['68 contributions', '15 helpful votes']",40,[]
Nigerian Excellence,"From pre-arrival to post-departure my team and I were very well-treated in this comfortable, secure, and pleasant environment. We felt very valued and this property has become our ""go-to"" hotel in Lagos from here on out.",May 2015,,,wrote a review May 2015,"Park City, Utah",['2 contributions'],50,[]
general review of the place and service,"The hotel is rather small but cozy. The staff is very kind and friendly. Always ready to assist in a professional manner. ( Kingsley was very nice, approachable, smiley and easy to talk to. He has demonstrated a very good customer service) I recommend this hotel who look for a intimate atmosphere .  Ps.The place is very safe.",May 2015,,,wrote a review May 2015,,['1 contribution'],40,[]
Review Title,Review Text,Stay Date,Trip Type,Room Tips,Review Date,Author Location,Author Info,Overall Rating,Specific Ratings
Nice surprise,"In over 25 years of my traveling experience I can say, I have seen most of it. This hotel was booked for me by 3rd party and I did not have any expectation whatsoever. But I must say, beyond my dreams I was surprised in positive way. Room was excellent, equipped both with shower and bath tub. Whole room was nice and clean. Restaurant works late in the night and opens 5 AM so if you need to go for early flight you are still able to have some food before you leave. Wi-Fi was actually available as they said so, all around. If I must to point at something, this would be service in restaurant, I came late and there was not so many people at all, but service was slow, though food was nice. I will definetelly recommend this hotel to everyone coming to Lagos",April 2015,,,wrote a review Apr 2015,"Split, Croatia","['1694 contributions', '232 helpful votes']",40,[]
Beware the front desk!,"I agree with the consensus sentiment: this hotel generally exceeds expectations. It's not a five-star, to be sure, but the facilities are surprisingly good. The standard King I stayed in was clean and well laid out. The location, for a business hotel, was good: close to the airport in busy Ikeja but nestled in a quiet street off the main road. But first you have to make it past the front desk, and be advised to hold on to your wallet!   In the worst Nigerian fashion (I am Nigerian, by the way) the front desk staff attempted to profit off me. At check-in on late evening of Apr 16, they tried to renounce a confirmed booking I made on a third-party website, claiming they were fully booked -- even though I'd called an hour prior to arrival to confirm availability. When I resolutely",April 2015,,,wrote a review Apr 2015,"Washington DC, District of Columbia","['57 contributions', '5 helpful votes']",20,[]
Grate hotel in lagos,"Overall my experians and stay at protea leadway has been an delight and will recommend other trafelars to  stay over at this hotel , at any time you will be received with an friendly face , and assisted withe any request . The services is good withe grate food . I will advise trafelars to enjoy the comfort of protea hotel ( leadway )",April 2015,,,wrote a review Apr 2015,,['1 contribution'],50,[]
home from home ...,"I travel frequently on business, necessity dictates that often it is to stressful locations. When I am in Lagos it is comforting to be greeted with a smile (sometimes by name), in a safe, secure environment with all the comforts of home. The Staff are awesome, led by a strong Management team that personally talks to guest. I strongly recommend the Protea Hotel Leadway as a base for your business dealings in Nigeria.",March 2015,,,wrote a review Apr 2015,"Johannesburg, South Africa",['1 contribution'],50,[]
I was pleasantly surprised with the amount of attention from staff and management!,"Employees of our company constantly travel to Lagos and stay at this hotel. Yes you can see it's not a brand new property, but the hardworking and creative staff make up for that big time! As it was our anniversary stay, they organized an amazing party with barbecue, Nigerian style performance and goody bags which made this hotel unforgettable for us! The general manager is very approachable and spends a lot of time with the guests, and the other staff are extremely friendly, genuine, helpful and ready to go beyond their job responsibilities. Also the poolside area is very nice and cosy. I am definitely looking forward to coming back to this place, big thank you. Maria",May 2014,,,wrote a review Apr 2015,"Dubai, United Arab Emirates",['1 contribution'],50,[]
friendly staff,"very friendly and professional staff who made the stay relaxing and pleasant. attentive to our needs and caring for our comfort. the hotel offer a nice outside pool, the gym is very very small, almost impossible to use it. the food is delicious and well presented. the rooms are big and full selection of tea coffee is offered. definately worth it to try for the hospitality of the staff",April 2015,,,wrote a review Apr 2015,"Lagos, Nigeria","['1 contribution', '1 helpful vote']",30,[]
In need of a deep refurbishnent,"Maybe this hotel was good when just built. Now it needs heavy work. My room was big but was way run down. I couldnt close the bathroom door. Furniture and bed linens were old. There is a very small pool. Most staff are not friendly aka rude for western standards. Breakfast was a joke, with the smallest selection of food I ever saw in my life.  And the smell in the lobby was awful.",March 2015,,,wrote a review Apr 2015,,"['82 contributions', '64 helpful votes']",20,[]
Amazing Staff and comfortable hotel,"The best thing about this hotel is the Staff. So friendly and approachable at all the time from the minute u arrive till the time u will leave. They will make u feel at home. Nice hotel you will find whatever u need pool, gym and comfortable rooms with lovely bath ;)",April 2015,,,wrote a review Apr 2015,"Dubai, United Arab Emirates","['17 contributions', '5 helpful votes']",40,[]
Secluded Oasis with Great Kitchen,"This hotel is not far from the Sheraton Hotel, Ikeja. It's in a very secure compound, and inward checks of cars and people is re-assuring. I have stayed here three times.  It's a small hotel, with a small lobby. It's a place to stay if you enjoy quiet and privacy. Its not a place to be loud and be seen. Its all very understated but in a classy way. The rooms are modern, clean, well air-conditioned and never far from the lobby. Service is excellent, and within hours the staff seems to know who you are, and helpful.  The Restaurant is excellent, with a good choice of seafood and meat dishes, all to South African standards. The Tiger Prawns with sesame as starter,  and Ribs or T-bone for mains. The breakfast buffet is huge, and again well presented.  The senior managers are present",February 2015,,,wrote a review Mar 2015,"Accra, Ghana","['36 contributions', '31 helpful votes']",50,[]
Mr van Rensburg,"A group of friends and myself decided to have breakfast at the hotel this morning. It was excellent. There was not one thing that was missing from the variety. I enjoyed the salmon, it was so fresh. Bacon, chicken livers, a selection of cheeses and imported meats. The staff were excellent, the chef Wayne took the time sit with us and enjoy a cup of coffee. The manager Dean was on top of his game ensuring that we were being looked after. The hotel makes me feel that I am not in Lagos, a nice change. Well done to the Protea Team, keep up the great service.  Regards  Dave",March 2015,,,wrote a review Mar 2015,,['23 contributions'],50,[]
Review Title,Review Text,Stay Date,Trip Type,Room Tips,Review Date,Author Location,Author Info,Overall Rating,Specific Ratings
Lovely hotel at amazing location!,On my first time to Nigeria I couldnt have asked for a better place to stay! The Rooms are modern and clean! The tiger prawns at their restaurant are THE BOMB!   Friendly and attentive staff.  Cant wait to be back!,March 2015,,,wrote a review Mar 2015,,"['3 contributions', '2 helpful votes']",50,[]
Cozy hotel,Very cozy hotel! Excellent staff and great food!!!! I definitely recommend Tiger prawns!   I loved them! Hotel is small and does not accommodate a lot of people but it better if u need to relax and want some peace and quite! Would recommend it to everyone!,March 2015,,,wrote a review Mar 2015,"Dubai, United Arab Emirates","['86 contributions', '24 helpful votes']",50,[]
Nothing better,"This was my second stay at the Leadway hotel and it just gets better. On arrival, i was warmly greeted by the porters, the concierge right through to the receptionist staff. Even Dean the general manager came from his office to welcome me. It really felt like i was part of 'the family' for many years even though it was only my second visit. A letter congratulating me on my revisit to the hotel and also an invitation to join the 'guest appreciation' function that the hotel was hosting in the evening was placed in my room. The sweeties and ice cold heineken was a well appreciated bonus aswell. The event in the evening proved to be a huge hit as not only was it a great networking opportunity for me but an awesome party as well.  I was advised that these functions were held to thank",March 2015,,,wrote a review Mar 2015,,"['6 contributions', '2 helpful votes']",50,[]
Friendly staff,This hotel has quite good rooms nice seafood try tiger prawns .. in the restaurant down and breakfat is nice also  and specially the staff is amazing meet kingsley the porter of the hotel he is the best man in the hotel and even in lagos !!,March 2015,,,wrote a review Mar 2015,,"['9 contributions', '12 helpful votes']",50,[]
Recomended,"Extremly friendly staff. Good room layout. Exellent tigers prawns on the menue, which is a must try if you visit thesr hotel. Nice guest house size atmosphear.  Beatifuf small restaurant were u can eat next to the pool",March 2015,,,wrote a review Mar 2015,,['1 contribution'],50,[]
"Small, friendly hotel.  Great Service","Lovely hotel, clean and friendly.  Limited menu for dinner but breakfast buffet is very good.  I had an issue with my room which was sorted very quickly and very efficiently.  Staff are very attentive and friendly.  Will always stay here when on business in Lagos.",March 2015,,,wrote a review Mar 2015,"Reading, United Kingdom","['5 contributions', '2 helpful votes']",50,[]
Home from home,"Really enjoy my stay each time.   Great service and always with a smile. Large variety of food served in a spectacular fashion.   Staff always friendly,  polite and go out of their way to help.  I will always come back.",February 2015,,,wrote a review Mar 2015,,['2 contributions'],50,[]
Artist Designed Hotel Rooms,"That hotel has a soul. And its shown in every corner. Old books are placed on high shelves reaching up to the ceiling. Books are different and depending on your interests, select what you're interested in and read it while lying on a lounger by the pool. On Valentine's Day I got a red rose. So lovely gift! Thank you! The service is friendly and always ready to help.",February 2015,,,wrote a review Feb 2015,"Seville, Spain","['101 contributions', '17 helpful votes']",40,[]
Best Business Hotel in Lagos,"I've been traveling to Lagos for 15 years and nothing can beat the Protea Leadway in Ikeja for personalised service, excellent food and location. All guaranteed by the personal attention to detail that the GM Dean Ogilvy and his team give. Don't bother trying anything else, but book early.",February 2015,,,wrote a review Feb 2015,"Dubai, Dubai, United Arab Emirates","['5 contributions', '1 helpful vote']",40,[]
One of best Hotels in Ikeja,"staying since more than 5 years at this hotel , for me ine of best in Ikeja Quit Place, good for relaxing, small but nice hotel. Very good Food at restaurant and staff is tranig their best service, if you have any complains they will help you, what ist Not Standard in something other hotels. I still like to come again to this Place  Who Looks for good and save Place downtown in Ikeja will find here in Maryland good hotel, also Roms are nice.  Everybody who likes it not too crowdy will like it",February 2015,,,wrote a review Feb 2015,"Norderstedt, Germany","['236 contributions', '127 helpful votes']",40,[]
Review Title,Review Text,Stay Date,Trip Type,Room Tips,Review Date,Author Location,Author Info,Overall Rating,Specific Ratings
Little bubble of peace,"I stayed here in January 2015 while I was in Lagos on business. This is a great little hotel, cool, calm, peaceful. Has everything you'd want. Really relaxing if you've been out in the city all day. All very clean and safe. Staff are friendly but not OTT. The lady who'd handled my booking came out from the office to meet me when I checked in, it felt like a little family run place where all the guests are really appreciated.    The only thing I'd mention - and it's not a negative at all, just something I hadn't realised - is how very small the hotel is. There's only one restaurant, which serves the same menu for lunch and dinner, so the food can get a bit monotonous if you're there for a few days. The food is very good though. There's also a snack bar menu with pizza etc which",January 2015,,,wrote a review Jan 2015,"Newcastle, United Kingdom","['77 contributions', '60 helpful votes']",50,[]
Complete spot,"I spent a night here in December 2014. I have done so before but didn't bother to review this place. The serene is ok, the room is nice. I love the vent spreading noiseless cold air into the room. The bed is soft and makes sleeping a paradise for dreamers......",December 2014,,,wrote a review Jan 2015,"Lagos, Nigeria","['41 contributions', '12 helpful votes']",40,[]
Friendly staffs,It's a nice and cozy hotel with friendly and helpful staffs.. Room was quite big and clean.. Small size pool and restaurant.  The breakfast was not bad..   I would come back because of the hospitality of the hotel's staffs.  xx,January 2015,,,wrote a review Jan 2015,"Dubai, United Arab Emirates","['43 contributions', '19 helpful votes']",40,[]
V.good service,"Very very nice service, always polite and helpful. Delicious food in the hotel restaurant.. Although, internet connection in the room is reconnecting very often. But they do apologise for inconvenience and try to repair it.",December 2014,,,wrote a review Dec 2014,"Emirate of Dubai, United Arab Emirates","['2 contributions', '1 helpful vote']",30,[]
Probably The Best Protea Hotel  in Lagos,"8.00pm Wednesday 17th December 2014  This is about my fourth visit to this hotel. One word to describe them 'impeccable'. I observed  the Emirates airline crew as they arrived from the airport and they were checked in. They kept saying 'Wao' as they took in the surroundings.  Obviously,  it was their first time of lodging there.  You cannot miss the impressive bookshelf at the Check-In counter. I have not seen it's kind in Nigeria. The room is spacious and the bath tub and bathroom area is unique. It was my first time of visiting the pool area. The ambience in the evening is cool and calm. The hotel has ample parking space and effective security.   We ordered a plate of goat-meat peppersoup,  chicken salad and jolly rice with goat meat in stew. Everyone seems satisfied. I think",December 2014,,,wrote a review Dec 2014,"Lagos, Nigeria","['42 contributions', '16 helpful votes']",50,[]
"nice concept of rooms, nice staff","Rooms are very nicely designed, although a small upgrade woudn't harm anybody. just one thing, I coudlnt find trash basket anywhere in the room just in the toilet, which was quite weird and didng make much sense. Anyway, hotel is clean and staff very nice and polite. Outside pool is gorgeous and food there is fantastic!! Try the speciality - peri peri king prawns. They are huge and taste like piece of heaven.",December 2014,,,wrote a review Dec 2014,Slovakia,"['238 contributions', '75 helpful votes']",40,[]
