Review Title,Review Text,Stay Date,Trip Type,Room Tips,Review Date,Author Location,Author Info,Overall Rating,Specific Ratings
A Day from Home,Good breakfast. Nice bed but the hotel was still then Protea. It will definitely make do with some overhauling. Great staffs...and ever smiling manager who takes time to say hi with her beautiful smile.,October 2018,,,wrote a review Sep 2019,"Lagos, Nigeria","['8 contributions', '17 helpful votes']",30,[]
Review Title,Review Text,Stay Date,Trip Type,Room Tips,Review Date,Author Location,Author Info,Overall Rating,Specific Ratings
Flourish Africa Masterclass,Beautiful and clean serene. The food is awesome.  One of the best I have had in hotels.    The hospitality is top notch and the staff are dedicated to their job and very friendly.  I enjoyed my stay.I am planning to go again😊,September 2019,,,wrote a review Sep 2019,,['4 contributions'],50,[]
Quiet hotel in Victoria Island,"The rooms are well laid out and are quiet and comfortable. The staff are very friendly and helpful. The breakfast menu offers a good variety, and the dinner is well prepared with a good selection. My meals were all excellently prepared and was exceptional. The pool outside is relaxing after a days work. Overall good value for money, definitely will visit again when I return to Nigeria.",August 2019,,,wrote a review Aug 2019,,"['32 contributions', '2 helpful votes']",50,[]
3 months looong stay,Good hotel with friendly staff. Food is good though I couldn't get Indian food as menue is restricted to continental or local. But they prepare good and keep on taking feedback. Rooms are good. Only grudge is that Gym is not properly equipped,May 2019,,,wrote a review Aug 2019,,"['35 contributions', '6 helpful votes']",40,[]
My review,"Upon arrival at the hotel, I was told the type of room I booked wasn't available even though I completed the booking online. Parking was also a challenge, so I initially had to park outside the hotel premises.",July 2019,,,wrote a review Jul 2019,,['1 contribution'],20,[]
A Good Place for Relaxation and Work,"I have always seen this hotel as ""home away from home"" simply because of the tranquility in the hotel, the facilities available and the good food.  Staff members are very friendly and the hotel is generally clean and peaceful.",July 2019,,,wrote a review Jul 2019,,['2 contributions'],40,[]
Comment on Stay on Park Inn by Radisson Serviced Apartments V. I.,"The room facilities need urgent upgrade. The toilet on the first room signed to me (main block) did not flush. The public places in the rugs, chairs, etc., in the annex where I was relocated are old, collapsed, and worn out, and the alternative room assigned to me ther had a stale odour, because the windows are permanently sealed with no opportunity for natural ventilation. The hot-water shower in one of the two newly-renovated rooms (again assigned to me in the main block did not work. The wall by th head of the head of the bed dripped water, and the room had odour. It was difficult to achieve optimal regulation of the air-conditioning. The TV has very only one international and one local news channel; this is too poor.",July 2019,,,wrote a review Jul 2019,,['1 contribution'],20,[]
Good Hotel,"Very nice and clear hotel.  Upon arrival, we were warmly welcomed and they were honest about the problem with our room booking.  We were upgraded to a suite without incurring extra charges.  The  hotel is clean and provides us with great hospitality.   I can’t fault any of the staff but special thank you to Rita(Manager). who was very accommodating to our needs and made us feel welcome and valued.  Rooms were cleaned daily.",June 2019,,,wrote a review Jul 2019,"London, United Kingdom","['3 contributions', '4 helpful votes']",50,[]
Review of Park Inn by Radisson 4/07/2019,"Great hotel, good services, lovely and professional personnel. I enjoyed my second stay and I look forward to another wonderful experience of great hospitality. I came on a work training and also used the conference facility as well as the bar and pool side relaxation areas.",July 2019,,,wrote a review Jul 2019,"Port Harcourt, Nigeria",['1 contribution'],40,[]
Excellent,"Excellent service delivery, adequate security, friendly, smart and dedicated staff, serene environment, nice, tasty and good breakfast, clean and neat toilet tools and facilities, good location. Excellent service delivery",July 2019,,,wrote a review Jul 2019,,['1 contribution'],50,[]
Professional and friendly staffs,"Staffs are very friendly and exceptionally professional. I enjoyed my night at the hotel. The room was large, though the bathroom was a little bit small but it was okay. The restaurant was OK. Overall, it was a good experience. I will definitely come back.",June 2019,,,wrote a review Jun 2019,"Lagos, Nigeria","['1 contribution', '1 helpful vote']",40,[]
Review Title,Review Text,Stay Date,Trip Type,Room Tips,Review Date,Author Location,Author Info,Overall Rating,Specific Ratings
Business visit to ParkInn,"Thw facilities are awesome and the serenity was great. The room facilities are fantastic and highly roomy.  Car park was not good enough, it needs urgent improvement. The experience was generally pleasant.",June 2019,,,wrote a review Jun 2019,,"['1 contribution', '1 helpful vote']",40,[]
Great hotel. Great service,"After a very long journey from Benin City to Lagos and the Park inn we were greeted by friendly reception staff. As I had contacted the hotel prior our arrival Rita the general manager greeted us. As we had to go road instead of air we were given a complementary drink and upgraded to a deluxe suite. What a great gesture thank you;o)  The suite was perfect. Once settled in we ordered room service, which was promptly delivered. Breakfast wide range of choice. Selection of traditional Nigerian dishes and continental. Served with the best tasting coffee!!! Evening menu again selection of traditional Nigerian and continental dishes, which all tasted amazing. If it was Egusi Soup with Yam or a burger........ Rooms, grounds, all in perfect condition. I would like to thank Rita,",June 2019,,,wrote a review Jun 2019,"London, United Kingdom","['39 contributions', '19 helpful votes']",50,[]
Nice ambience and friendly staff . Food was great and hotel felt very safe and secure . Overall great experience .,Nice hotel . Clean and friendly staff . Nice complimentary breakfast . Great room service . Hotel is near a lot of restaurants . Place felt very secure and safe . Only slight improvement needed to restroom /bathroom for maintenance and cleanliness . Overall very pleasant stay . Staff were very pleasant and accommodating . Will definitely book again .,June 2019,,,wrote a review Jun 2019,"Houston, Texas","['1 contribution', '1 helpful vote']",30,[]
Simon - LONDON,"Great service, very friendly staff, I enjoyed my stay at this hotel. Going through an upgrade at the moment, but did not interfere with my stay. Just needs the finishing touches. Will stay there again next time.",May 2019,,,wrote a review May 2019,"London, United Kingdom",['1 contribution'],40,[]
Fun at Radisson  Service Apartments.,"Over all, I would say it memorable. Staff I encountered were honestly down to earth, friendly and willing to be of assistance. There was only a limitation of food options during all the meals..........more of Nigerian options is advised.",May 2019,,,wrote a review May 2019,"Makurdi, Nigeria",['1 contribution'],40,[]
Fair,there was no switch above the headboard.  So being lying I could not turn off the light.  the lamp above the tv did not go off despite the fact that I reported to the reception.  Frequent power cuts that did not last long but rather unpleasant.,April 2019,,,wrote a review Apr 2019,,['3 contributions'],30,[]
Nice little hotel,Uthe hotel is under renovation .rooms have been and are being upgraded.  It's cosy and friendly.  The food was very good as we had dinner there. Nice breakfast too. Convenient location  for us as very close by.,April 2019,,,wrote a review Apr 2019,"London, United Kingdom","['96 contributions', '57 helpful votes']",40,[]
A good and convenient location,A good and convenient location for our hospital appointment. Breakfast arrangement could be more flexible and less costly. Housekeeping needs to be more detailed. Curtains and windows should be dust free to prevent dust allergens. Pleasant enough staff. Lack of follow through on requests.,March 2019,,,wrote a review Apr 2019,,['1 contribution'],40,[]
Service well beyond expectations! Good food and ambiance....,"At check-in it was found that there was an issue with the online booking but the Operations Manager (Rita) and the Reservations department (Endurance) went out of their way to address the issues.  The rooms are very comfortable with excellent bathrooms (walk in shower) and a standalone desk to work at.   We very much enjoyed the food, in addition to the service. The team goes out of their way to make you feel welcome and it is therefore that we can highly recommend the Park Inn VI.  Since we were on a long stay, we have taken the time to look around and compare rates vs. quality cleanliness and general ambiance. Of course, we have not seen every hotel in VI but we rated Park Inn highest without a doubt.  The following is highly subjective but could be of interest to some: the",March 2019,,,wrote a review Mar 2019,"Doha, Qatar",['5 contributions'],40,[]
Excellent service,"Arriving for family funeral with all the stress and emotions that accompany such trip, we were welcomed Very warmly even when the staff did not know why we came. To me,that says it all. Throughout our stay, any tiny issue was resolved within minutes, not hours. The staff were very friendly and professional at the same time, that makes it so good. The atmosphere of the hotel was warm, the breakfast and the evening meals we enjoyed was good. Any problem was resolved by staff and their Manger Rita, I would recommend her highly for her competency and professionalism which transcends to her staff. I shall be recommending this hotel to family and friends .",January 2019,,,wrote a review Jan 2019,,['1 contribution'],50,[]
Review Title,Review Text,Stay Date,Trip Type,Room Tips,Review Date,Author Location,Author Info,Overall Rating,Specific Ratings
"Peaceful, friendly and affordable",Great room for leisure and business with a nice swimming pool and a free complimentary buffet breakfast in the morning to kick off the day. The warm friendly staff are at your beck and call for movement advise if you are new to Lagos. The only disadvantage is the limited parking space.,August 2018,,,wrote a review Dec 2018,"Eket, Nigeria",['2 contributions'],40,[]
best Prawns in Lagos,"great hotel with options of pools and restaurant , welcoming  and friendly staff one of the most flexible hotel I have visited in terms of customers choice and personalized service and simply but nice decoration a total definition of simplicity . my personal and most of my friends view the best place to have jumbo prawns in Lagos .",November 2017,,,wrote a review Oct 2018,"Lagos, Nigeria","['44 contributions', '15 helpful votes']",40,[]
A Home Getaway,The feel of the luxurious Protea Hotel. Friendly staff. The facility could do with some upgrades in interior decoration to measure up with the ever changing trend in hospitality industry. The bed is very comfortable.,September 2018,,,wrote a review Oct 2018,"Lagos, Nigeria","['37 contributions', '8 helpful votes']",30,[]
Central quiet and classy,Spent a few nights here and loved the simplicity of the room and the prompt service. Two pools and their BBQ'S are great. My favourite was the club sandwich and the deconstructed salmon salad.  When the wifi works it's great but can be a pain when it goes off. The power went off a few times but general the genset kicked in swiftly.,September 2018,,,wrote a review Sep 2018,"Accra, Ghana","['306 contributions', '68 helpful votes']",40,[]
Great Hotel,"Great Hotel, rooms modern and clean, with good views of the water. Great location. Great food and restaurants - on water. Service outstanding and food good. Has all facilities Gym, Spa - although seems to be construction work going on in gym area. Only complaint would be the bathroom in the room - lacks extraction fan - so would be weary of mold if not aired properly",August 2018,,,wrote a review Sep 2018,,"['67 contributions', '36 helpful votes']",40,[]
Wonderful and attentive staff,"I often have to travel for work and I usually stay in the Protea in VI. The staff is simply amazing. Very attentive, they always greet me warmly and go above and beyond their call of duty. Rita, the manager is also exceptional. She always greets me with a warm hug and checks in to make sure my stay is going well. I can't say enough about the staff at this hotel. I would highly recommend it.   Anuli",April 2018,,,wrote a review Apr 2018,,['1 contribution'],50,[]
Like home,"Great service and hospitality, friendly staff, and a bit of South Africa in the big city of Lagos.  The hotel is intimate and cozy. The food is great - whether its breakfast or dinner. There is Nigerian for those  who are daring (or local) and South African favorites for those that are longing for home. Quality great. Rooms and facilities not flashy but more than adequate! Lekker!",April 2018,,,wrote a review Apr 2018,Paarl,"['30 contributions', '6 helpful votes']",40,[]
Hidden Gem!,"The Protea Hotel Victoria Island has a lot of amazing attributes to it - contemporary, comfortable, clean and a phenomenal staff. I stayed in the hotel for almost two weeks. I must say, my stay was quite pleasant, and the staff was second to none. The hotel staff are polite and exude the real Nigerian warmth and friendliness. Check in went fast with friendly staff that assisted me to my room. Everyone that worked in the hotel from the desk staff to the GM is inviting and very helpful. The rooms are modern, clean, and the hotel was always in excellent condition.   Situated in the heart of Victoria Island Protea Hotel is a suitable place to go out from and get back to quickly.  Location is safe and gives you easy access around Lagos. The hotel is within walking distance of",February 2018,,,wrote a review Apr 2018,"Belize City, Belize","['2 contributions', '2 helpful votes']",40,[]
satisfactory all round service,"Excellent room service, staff are very friendly too. Rates are very reasonable for a hotel in Victoria Island. The building may be a bit old fashioned but overall basic amenities are available  and functional. This is a great choice anytime.",March 2018,,,wrote a review Mar 2018,"Lagos, Nigeria",['1 contribution'],40,[]
Nice but need a serious refresh,"Protea has a lot of good points and on top of them is probably the staff. Everyone here from the front office to the GM is nice and very helpful, the restaurant is ok too, food is good and well cooked, breakfast is coming with a large choose of pretty good food.  However the place need a complete renovation. Apparently this is scheduled for this year so let’s be patient",February 2018,,,wrote a review Feb 2018,,['1 contribution'],40,[]
Review Title,Review Text,Stay Date,Trip Type,Room Tips,Review Date,Author Location,Author Info,Overall Rating,Specific Ratings
"Very nice, above-basic place","A comfortable bed, a *very nice* pepper soup for dinner, and consistently excellent service from the staff at every level. The rooms are a bit bland and the hall isn't air conditioned, and the view isn't much, so this is not a super fancy hotel, but it is a genuinely comfortable and welcoming one, with everything clean and easy. I'm not entirely easy to please, and my first impression is quite positive.",January 2018,,,wrote a review Jan 2018,"Washington, DC","['12 contributions', '2 helpful votes']",40,[]
Solid Good Value Business Hotel,"I have been doing business in Nigeria for many years and have stayed at this Protea at least 10 times since 2005.   The rooms are modern and clean. The staff are friendly and helpful. The prices are reasonable (consider a protea Card if you go often for further discounts)   It is well placed on Victoria Island. They have backup power for the regular power cuts. Internet speed is ok. There is a gym and quite a useful business centre.  The breakfasts consist of a selection of fruits, yoghurts, pastries and then some hot foods. There is a chef who will make you an omelette etc. It’s a decent breakfast.   Overall it’s a good value hotel, well situated, with modern rooms and very good service.",November 2017,,,wrote a review Jan 2018,"Sandton, South Africa","['40 contributions', '11 helpful votes']",40,[]
Fine Stay,Overall very happy with the service and quality of stay.  Check in went fast with very friendly staff that assisted me to my room. Curtain in room peels off as it uses sticky strip to hang.. Not good. Room linen was clean and fresh. Shower had difficulties as it changes between extreme cold and hot.. Struggled to just get the balance. Breakfast was good. Variety not so great but enough to fill you. Room Service was great with delicious servings except for the lamb chops that was awful. Restaurant menu and room service menu are the same thus can enjoy full service in my room. Check out was quick and efficient.  Keep up the good work.,November 2017,,,wrote a review Nov 2017,"Cape Town, South Africa","['110 contributions', '37 helpful votes']",40,[]
Great experience.,"I have stayed at this spot over the years and met the same attention to customer service and attention to detail as always. The hotel is a 55 room hotel with all the facilities you need on a trip to lagos. Situated in the heart of Victoria Island it's a great place to go out from and get back to quickly. The staff are very helpful and go out of their way to ensure you have a good experience. Rooms are comfortable, clean and showers are strong. Altogether a nice experience as always, I seem to think they are getting even better and standing out which is tough in a place like lagos that is packed with Hotels. Breakfast buffet was simple and nice not too elaborate but very functional. No down points at all. Suleiman at the restaurant was  very helpful, my compliments to him. Look",November 2017,,,wrote a review Nov 2017,"Dubai, United Arab Emirates","['12 contributions', '15 helpful votes']",50,[]
Old Glory - needs a face lift of the rooms,"I changed rooms and each of the rooms had serious issues of aging and dilapidated furniture and flooring.  My impression is that the hotel management is sucking out all the revenue they can extract from the establishment and will probably abandon ship at the end of the lease which could be imminent.  Else, how could i understand the total lack of reinvestment into maintenance and upgrade of the facility.  it is a disgrace to the name and standard of Protea Hotels.  Everything was problematic....from the desk chairs that were crooked in both rooms, the veneer on the furniture was peeling off as are the ones on the floor.  the bath towels are old and faded; the shower door does not close snugly; so, water splashes into the bathroom space. the hand towel hook on the wall is broken",October 2017,,,wrote a review Oct 2017,"Decatur, Georgia","['57 contributions', '14 helpful votes']",30,[]
"wonderful rest, excellent breakfast","I stayed at the facility in April.  I was there for the funeral of a family friend.  The staff of the hotel was extremely accommodating and kind.  They were very professional in their delivery.  Additionally, the food served at breakfast was extremely good and of incredible quality.  Their chef knows his onions.",April 2017,,,wrote a review Oct 2017,"Ibadan, Nigeria","['11 contributions', '2 helpful votes']",50,[]
Nice hotel for business trips,"Very comfortable, good security. The rooms were well appointed, water worked and hot water dependable! The restaurant's food was good and service friendly and helpful. In a quiet area for Lagos. I would stay there again.",April 2017,,,wrote a review Aug 2017,"Melrose, Massachusetts","['24 contributions', '8 helpful votes']",50,[]
"Overall good value, nice room","Nice hotel for the price, but not as close to the airport as I expected and kind of hard to find.. The restaurant was nice and the room was very cozy.I would stay there again, especially for an overnight layover.",November 2016,,,wrote a review Aug 2017,"Macae, RJ","['6 contributions', '6 helpful votes']",40,[]
Business in Lagos,Always a pleasure staying here. The staff welcoming. The manager a star. The chef superb.  A home from home. A typical old style Protea hotel and How a hotel should be run.   The wifi now fixed and superb.,July 2017,,,wrote a review Jul 2017,"Johannesburg, South Africa","['350 contributions', '119 helpful votes']",40,[]
"Clean, Private and Good Food!","For a hotel in the middle of V.I. it really has a feel of tranquility witch can be a real blessing when you get back from the office. Swimming pool areas are perfect for a relaxing evening. Best breakfast in Lagos and apparently a secret spot for good Burgers! The rooms are neat, clean and spacious. Everything up to standard with very professional and attentive staff. Keep it up!",June 2017,,,wrote a review Jul 2017,"Lagos, Nigeria",['3 contributions'],50,[]
Review Title,Review Text,Stay Date,Trip Type,Room Tips,Review Date,Author Location,Author Info,Overall Rating,Specific Ratings
"Great, friendly hotel with best hamburgers in Lagos","Best hamburgers in town! The prawns is another favourite as well as the T-bone steak. Good, comfortable accommodation with functional rooms and great, large showers and good water pressure. Staff were very friendly with the breakfast chef remembering my egg order the next day.",February 2017,,,wrote a review Jun 2017,"Lagos, Nigeria","['117 contributions', '50 helpful votes']",50,[]
"Great, affordable find on VI for business","Just back from a 9-night stay here. Was impressed at the location, room was big, internet was very very fast for Nigeria, bed was very very comfy and shower was great too.  Staff were exceptionally friendly and helpful - very accommodating and even let me check out a little later as well, as my flight wasn't until much later on.  Breakfast was a bit basic- nothing to write home about, but the omelettes were exceptional and again, the waiting staff were lovely  Only thing I would say is that the rooms weren't made up that well - on a couple of occasions the old towels were taken but not replaced. But they did send up towels immediately when I asked for them, so that's fine  A good, cost-conscious stay in a good, solid location",May 2017,,,wrote a review May 2017,London,"['24 contributions', '13 helpful votes']",40,[]
Nice Secure Hotel But Could Do Better,"Stayed at this hotel for a week on business and felt very secure whilst staying as well as enjoying the very comfortable room. Hotel is quiet and staff tend to leave you alone which is nice. Rate was fairly good (€140 per night) so it reasonably priced.  Bed is very comfortable with nice fittings within the room. Bathroom has a great shower and separate bath which was much appreciated. Wireless was good and fairly quick.  A few areas it could improve on is with the choice of food and how expensive it is to get food within the hotel. Breakfast is about €18 and a simple burger is about €25. As per the previous review, choice is fairly limited for dinner with burgers and steak covering most of the menu. Some other dishes would give people staying long term something to interest",May 2017,,,wrote a review May 2017,"Manchester, United Kingdom","['58 contributions', '24 helpful votes']",40,[]
Business Trip to Lagos,"Booked into this hotel by my local Agent and staying here for 18 days. Have found the hotel very good, staff more than helpful and always with a smile. Room and services are good. Internet access is excellent as is the selection of TV channels. For a long stay I find the menu selection quite limited, but all selecting I have had were good. Breakfast buffet is excellent and always open on time at 06:30 each morning. Perfect for business time requirements. I use the fitness centre each day, its small but well equiped. Only very slight complaint is the laundry facility which struggles to meet the promised and listed return delivery time. In one instance my laundry was not returned until the next day. Would I stay here again - Yes I would.",April 2017,,,wrote a review Apr 2017,"Gosport, United Kingdom","['665 contributions', '75 helpful votes']",40,[]
Near one of the biggest hotels in Nigeria but holding it's own!,"Where to start? Champagne welcome, great food, clean rooms. Friendly staff, clean pools, great proximity to everything. This hotel is my favourite on the Island now! Only thing that sucked was the gym, too tiny and rusty.",April 2017,,,wrote a review Apr 2017,"Abuja, Nigeria",['20 contributions'],40,[]
Great place on VI,I stay here quite often. The staff are very friendly and helpful in the bar and dining hall. Breakfast is great and dinner is first class. The food quality is always great. We'll done to the Protea VI team. See you in a few weeks.,January 2017,,,wrote a review Feb 2017,"Accra, Ghana","['67 contributions', '23 helpful votes']",40,[]
