Review Title,Review Text,Stay Date,Trip Type,Room Tips,Review Date,Author Location,Author Info,Overall Rating,Specific Ratings
Closing Down?,This review was written throughout my two night stay in the hotel on 3-5 February.  Possibly the strangest hotel experience of 20 years in Africa.  I checked in yesterday to find the air conditioner in my room wasn't working. The engineer came and said he had fixed it. 30 minutes later it clearly wasn't working so I went to reception. They said they would arrange a new room. Four rooms and about 2 hours later we had finally found a room where most things function (air conditioner/shower/tv. Nothing fancy!). So I settle in and just rest.  Today I went to meetings in the area. I get a call at 3pm asking me to come back to the hotel for an emergency. Apparently they had decided to immediately close for emergency refurbishment and we're moving me out! I called the booking agent to,February 2016,Traveled on business,,wrote a review Feb 2016,"Ikoyi, Nigeria","['21 contributions', '20 helpful votes']",10,[]
WOW!,"What a place to be. I and my husband had the beautiful bar to ourselves. It's a top top for romance.  There's a champagne room where friends and couples could have a quiet great time, watch musical videos and eat good food. What an exotic design. The whole decor is elegant and exotic. We were there twice and we will not miss it, next time we are in Lagos.  AWESOME ATMOSPHERE! Great service!",January 2016,Traveled as a couple,,wrote a review Jan 2016,"Lagos, Nigeria",['3 contributions'],50,[]
Quiet place and cozy rooms,"I have stayed here four times. The rooms are quite colorful...some of the rooms are equipped with Jacuzzi. I recommend the hotel restaurant when you need quality food, you can be rest assured your weekend won't be a dull one with some activities lined up at the Planet One.",December 2014,Traveled on business,,wrote a review Sep 2015,Abuja,"['13 contributions', '11 helpful votes']",40,"['Rooms bubble_40', 'Service bubble_40', 'Sleep Quality bubble_40']"
Very close to the airport,"I have stayed in here twice. The first time I was there, I was given a room I didnt like so well. the floor was pretty sandy and the bathroom also was not just ok. I didnt like the towel too... Didnt look all that neat to me.  The second time I was there, I got a good room with even a mini-Jacuzzi. I didnt know they had that stuff in that hotel.  I enjoyed the their meals. The food was good.  I enjoyed the gym and the instructor there was really friendly. They got very friendly staff also. I like the location of the hotel because it is pretty close to the airport. I usually use the hotel if I'll have to catch an early flight.",July 2014,Traveled on business,,wrote a review Feb 2015,"Bayelsa State, Nigeria","['12 contributions', '7 helpful votes']",30,"['Rooms bubble_30', 'Service bubble_40', 'Sleep Quality bubble_40']"
"Fantastic venue, amazing staff",I had an event in Jiko hall and the staff went to unbelievable lengths to maje sure everything turned out right. Mr Moses was particularly impressive!  Never met staff so wonderful in all my years of planning events for my clients.   Please keep up the good work and don't let Mr Moses and the team go!,November 2014,Traveled on business,,wrote a review Dec 2014,,"['29 contributions', '11 helpful votes']",50,[]
Cool place;nice staff!!,"I've stayed at Planet One three times in the last couple of months and always found the service pretty good and the staff cool and helpful  The hotel is in a great location for Ikeja and well timed runs to the island........it is nicely decorated and reflects the style of the owners who have put their individual stamp on the rooms and common areas ( the charcoal prints are amazing)  A few niggles on the always closed safe,flaky wifi in certain rooms and the idiosyncratic shower..........I thought the staff were very nice and always did their best......it's not easy running a hotel and venue in Nigeria......folk who are used to western standards should not harshly judge.....it's clean and neat and comfortable and sure beats those overpriced places like its neighbour the Sheraton",October 2014,Traveled on business,Front facing can get some late night music from time to time!,wrote a review Nov 2014,"Nottingham, United Kingdom","['9 contributions', '5 helpful votes']",40,"['Rooms bubble_30', 'Service bubble_40', 'Sleep Quality bubble_30']"
It was fun here.....,"I and my team were privileged to do a home coming and get-together in planet one Maryland Lagos it was like every other get-together.. you know, some sort of mixed feelings and unsure expectation....My experience, i mean our experience at the end of the day was like wow....we were blown out of expectation by the warm and wonderful service we got....the well grilled Mongolian-menus took my breath away... the staff were excellent and cautious...... I think i,ll be there pretty soon at least, for some pampered experience..",September 2014,Traveled with friends,rooms facing the main entrance...kind of nice..,wrote a review Oct 2014,"Lagos, Lagos, Nigeria",['2 contributions'],50,"['Value bubble_50', 'Location bubble_50', 'Service bubble_50']"
Hospitality Horror,"If you ever have the opportunity to stay over- or have a Conference in Lagos Maryland I would sincerely advise you not to make use of this Hotel for anything.  As a General Manager for a Tourism Company we've booked with them after their Sales team begged me to bring my business to them, but it all ended up in a horror situation where we had to arrange the venues ourselves and the Management were so rude with derogatory remarks and foul language that I have decided never to return again... I am so sorry that my innocent Nigerian colleagues had to see this as some of the Ladies were very upset with what happened. My advise is to stick to a Brand that works in Africa - Protea Hotels, great people who still understand the meaning of Hospitality!",September 2014,Traveled on business,,wrote a review Oct 2014,"Accra, Ghana","['1 contribution', '6 helpful votes']",10,['Service bubble_10']
Nightmare from Hell,"I would like to firstly say My company will never return again. We were asked to make use of there facilities, so we did,  however when we asked for things to get sorted out without being unreasonable.  The GM used foul language and refused to assist after we paid for services.  We then had to set up the hall on our own. I would advise not to use them at all as there is no client service where you feel bad to ask for anything even though you have paid.  I will continue using the services of the protea goup in the area.",September 2014,Traveled on business,,wrote a review Sep 2014,,"['6 contributions', '2 helpful votes']",10,[]
Interesting,"well, where do i start. rooms are nice. there were a few issues though, jacuzzi not working, pool closed etc, but overall, it was a good stay. Girls at the desk was pleasant. When my partner and i returned from the trip Bisola who works at the front desk sent my husband a whatsapp message to ask how he was doing. she told him how much she would love to see him again and was asking when he would return to Lagos. Now, im not sure if all the girls at the desk are like this, but ladies watch out. She even started to send pictures of her self. i will attach it to so that everyone can see.  the housemen(cleaners) are really pleasant and well mannered and the bellmen are welcoming. overall (except for the surprise messages from Bisola trying to get too acquainted with my man)",May 2014,Traveled as a couple,choose an executive room,wrote a review Jun 2014,,"['5 contributions', '12 helpful votes']",30,"['Value bubble_40', 'Rooms bubble_40', 'Location bubble_40', 'Cleanliness bubble_40', 'Service bubble_40', 'Sleep Quality bubble_40']"
Review Title,Review Text,Stay Date,Trip Type,Room Tips,Review Date,Author Location,Author Info,Overall Rating,Specific Ratings
Hmmmmmmmm,"I echo the previous poster's comment about having mixed feelings for the place. Planet one sooo gets it right in some places but then manages to get it awfully wrong in other departments. My partner and I found the rooms to be of a decent size with very fine fittings and air-conditioning but that was about it. The breakfast buffet is basic at most, we had the same issue with toast that wasn't toast and very bad coffee, it is worth ordering hot food direct from the menu whilst there is little in the sense of continental choices, we were pleasantly surprised with our lunch and dinner. The swimming pool was out of order throughout our stay and we were promised it would be fixed, it wasn't!.The changeover from NEPA to the generator's is quick but not particularly fluid, this got in",May 2014,,,wrote a review May 2014,"Los Angeles, California","['1 contribution', '1 helpful vote']",30,[]
Mixed feelings,"Once I realised that the location on my mapping programme, just after the police college, is wrong and I found the hotel on the other side of the road close to the Lagos-Ikorodu Express, I was greeted by a friendly Cross Riverian named Bassey, like the majority of people in Calabar, who actually comes from a compound in walking distance (5-10 minutes) from my office. The room was very spacious, so was the bathroom with walk-in shower and jacuzzi, and, best of all, the first bidet I saw in Nigeria! The room temperature was an unbearable and humid 28 degrees, it came down to 24 (still not acceptable) degrees by the following morning (14 hours?). Has anybody thought about turning on the AC prior to my arrival? Obviously NOT! I had dinner in the bar, the 2 staff were very friendly,",May 2014,,,wrote a review May 2014,"Kampala, Uganda","['533 contributions', '128 helpful votes']",40,[]
Fairly Nice,Not a bad place to stay for business. Staff is very good and accommodating. Your probably only going to find  a few as good of a hotel in Lagos. Really expensive. Lot's of choices for food without leaving the compound. Recommend Chinese restaurant.,June 2013,,,wrote a review May 2014,"Bismarck, North Dakota","['33 contributions', '38 helpful votes']",40,[]
Quite Impressive,"Planet One impressed me because it doesn't try to be like the identikit Sheratons or Eko Hotels. The decor gave it the feel of a boutique hotel although the rooms and en suite bathrooms were massive. The bellboys are extremely good although I did have to carry my bag to the reception desk when I came in. Breakfast was nice, I ordered a fry up which was excellent although having to pay for water was bizarre given that juice was free. The location is perfect - it's not too far from the airport, it's ideal for the Lagos-Ibadan expressway and in terms of safety there's a police command and army Cantonment just up the road. Planet One unfortunately falls down on several aspects - firstly the bathrooms - the bath floors and jacuzzi tubs need to be sparkling clean if they wish to",March 2014,,,wrote a review Mar 2014,"London, United Kingdom",['1 contribution'],40,[]
Would definitely return to this hotel: Excellent,"Stayed in Planet 1 Hotel 20-28 February 2014. I observed the performance of the hotel from my arrival at the gate, the security were prompt, and they checked our car.  At the Reception, as soon as I mentioned my name my reservation was retrieved promptly and was taken to d executive room.  After the first night, I wasn't pleased with d shower in the room, I was promptly moved to another beautiful, comfortable and bright room.  Their attention to detail and promptness was second to none that I have experienced in other world class hotel.  having chosen this hotel on the web with comments from trip advisor & other guests who have been in the hotel.  The staff were very polite and courteous.  The porters, housekeepers, laundry, electricians,receptionists, restaurant and general",February 2014,,,wrote a review Mar 2014,"London, United Kingdom","['3 contributions', '3 helpful votes']",50,[]
Will come back,Great location. Food was reasonably priced and was good. The staff are very helpful and I be pleased to return. The rooms are comfortable and the hotel is well situated. The bamboo bar is a great spot for a beer after a long day in the Lagos traffic,February 2014,,,wrote a review Feb 2014,"Fourways, South Africa","['41 contributions', '4 helpful votes']",40,[]
Home from home.,"This s like my 5th stay in the hotel and have always feel at home with every thing in the hotel.wonderful services,highly decorated rooms with good facilities.friendly staffs around and always willing to assist.is just a place to be.",December 2013,,,wrote a review Dec 2013,UK,['1 contribution'],50,[]
Second good trip,"Fore my second business trip in Lagos, I return to the Planet One Hotel. This is Very nice hotel in very bad place :(... but the Room are very spacious and the staff very helpful. The food & breakfast was very nice with great variety . Big thanks to all Staff team for Their hospitality. The next time, I return with a big pleasure . Thx for all !!",December 2013,,,wrote a review Dec 2013,"Yverdon-les-Bains, Switzerland","['80 contributions', '42 helpful votes']",40,[]
A Really very nice hotel.,"I stayed in this hotel during the month of November. The hotel is renovated and up to international standards. Staff were helpful and well trained. Prices were affordable and food was excellent. Wi-Fi worked excellent in the room and on Mobile.  Location is great, safe and away from the traffic.",November 2013,,,wrote a review Dec 2013,"Beirut, Lebanon","['6 contributions', '8 helpful votes']",50,[]
Very Old Hotel,"I was booked in this hotel by our travel department, and once in the hotel, it was a real disaster. Rooms are very old, the area Ikeja is not good at all, bathroom is broken, bath tub without a curtain, the bed is not comfortable at all, breakfast is very minimal, the poor staff they will do whatever it takes to help, but their resiurces are limited. I wonder how it got good reviews from other travellers, I don't recommend it at all, will never sleep there again, if ever in Lagos,",November 2013,,,wrote a review Dec 2013,"Beirut, Lebanon","['285 contributions', '127 helpful votes']",10,[]
Review Title,Review Text,Stay Date,Trip Type,Room Tips,Review Date,Author Location,Author Info,Overall Rating,Specific Ratings
Good value and a pleasant stay,"Much cheaper than other 'high end' places close by and perfectly adequate. Staff helpful, especially in the restaurant. Standard breakfast buffet with eggs cooked to order. For dinner if you want to try local style cooking just ask. Wi Fi worked well, room spacious and quiet with good lighting. The safe didn't work which wasn't a problem for me on this trip but ought to have been fixed (the technican thought flat battery). Didn't have time to try the pool/spa.",October 2013,,,wrote a review Nov 2013,London,"['259 contributions', '51 helpful votes']",40,[]
NICE STATEMENT,I have to say that is a fantastic Hotel nice Statement the staff are very Friendly and helpfull.I come many Times for Buisness trips to nigeria and its everytime a pleassure to be a Guest of this fantastic Hotel   I will recoment it to my Friends and family,September 2013,,,wrote a review Nov 2013,,"['5 contributions', '9 helpful votes']",40,[]
Decent Choice in Lagos,"There are a lot of improvement in all department from my experience last time I stayed in this hotel. The staff are very helpful, friendly and gracious. The introduction of some social events at the week end is an added advantage to fun loving guest.",November 2013,,,wrote a review Nov 2013,"Durban, South Africa","['43 contributions', '56 helpful votes']",50,[]
Good Value in Maryland,"Stayed at Planet One for a night in Oct. 2013. The price was pretty decent compared to other hotels in the same area and I was curious about it after seeing it from the outside several times while in Lagos on business. Overall, I was pleased with the experience: the staff were warm and friendly, service in the restaurant was fairly good and, while the breakfast was limited in selection, it got extra points from me for having made-to-order omelets. The rooms were good as well, with plenty of space and modern decor. The building is a bit old, but it seems well kept and we were comfortable throughout. I would recommend this hotel for short stays in and around Ikeja as it's a good value for the money compared to competitors in the same area.",October 2013,,,wrote a review Oct 2013,"Lagos, Nigeria","['29 contributions', '46 helpful votes']",40,[]
People are nice...that's all,"I stayed here from 29-Sep'13 to 04-Oct'13. The people are very nice, co-operative and very friendly. Its a spacious property but with very basic in room amenities. The toiletries provided in the room are minimal. The tea bags, etc. are just good for one or if you are lucky two cups of tea. Only one bottle of 500ml. water (per day) is complimentary. Anything more is chargeable. They will not provide you drinking water in a jug too.The AC was good. The internet gave me a problem one evening. Worked well the other days. The breakfast is fine but meals are only continental and Chinese. You have to buy water even if your breakfast is complimentary. Water is not ! Security though is good. The bar was also fine.The hotel is not at all a value for money. Please do not get carried by",October 2013,,,wrote a review Oct 2013,"Mumbai, India","['2094 contributions', '119 helpful votes']",30,[]
Very nice stay,"I stayed at this hotel for 3 days as I attended a wedding which was at a venue nearby. During the stay the staff was really nice, polite and helped me with everything I asked for. In addition, the room was clean and tidy as well as comfortable. The kitchen was good with a wide variety of different cuisines. Highly recommend this one.",September 2013,,,wrote a review Oct 2013,Zürich,['1 contribution'],50,[]
My shocking experience at Planet One Hotel and Wellness. A must read for every visitor!,"I traveled from Ekpoma in Edo State on the 1st of sept. 2013 to lagos for a week long training programme and pondered on were to lodge at. Though familiar with some old Hotel names, I later decided to lodge at Planet One Hotels, and was easily located by my cab man. From the moment i highlighted with my luggage at the Hotel premises i witnessed a shocking experience of my life! Not only was i given a homely welcome at the reception, their numerous rooms and choice of facilities were very classy and were offered at an affordable rate to meet the needs of people of different taste and class. It also have a good lighting system. Their meals are very delicious too. I took out time to observe the various workers on a daily bases and they all seem to be very good at what they do and",September 2013,,,wrote a review Sep 2013,,['1 contribution'],50,[]
A lovely safe haven,"This is a small well run/looked after hotel, staff are excellent and very friendly they know how to look after you, The room I was in was excellent, spacious/clean and had the most wonderful shower/sauna all in one enjoyed that, also had a large balcony very good, a plus point for me was it was a smoking room, not many around now,(I still enjoy a cig )security was good no problems, If your ever in Lagos I recommend this hotel, a very peaceful nice place.",August 2013,,,wrote a review Sep 2013,San Carlos City  (iam from Scotland moved here 5 years ago),"['42 contributions', '21 helpful votes']",50,[]
Another planet on its own!,"I spent the weekend in lagos on the mainland, where I stayed at planet one! Their rooms and interior takes you out of nigeria, very classy and traditional. The value and quality of the food both chinese and indian was superb! The room was well funished and beutiful. I would recommend this hotel to anyone looking to have a well relaxing and stress free stay.",October 2012,,,wrote a review Aug 2013,,['1 contribution'],50,[]
Good value and nice service,"Have been staying at an other hotel in Ikeja before. The Planet One has proofed to be a clean, friendly and quiet place to stay. I would recommend it to all that have to stay in this area. Given the context and the quality and prices of other hotels, this is the place to stay.",August 2013,,,wrote a review Aug 2013,"Zurich, Switzerland",['2 contributions'],40,[]
Review Title,Review Text,Stay Date,Trip Type,Room Tips,Review Date,Author Location,Author Info,Overall Rating,Specific Ratings
"Good , but leaves much to be desired.","Was here for almost 2 weeks for my wedding, even in the executive rooms, plumbing for bathroom heater and refrigerator was very poor. sometimes the toilet wouldn't flush, we kept changing rooms due to flooding. i was amazed that throughout the 2 weeks of my stay non of the top managers found the time to even come apologize or give us a concession, when i used the gym we had to pay for water.   Another very embarrassing situation was how me and my wife kept getting embarrassed at breakfast, when one of the staff shows and says ""food is only free for one"" , then when i complained it was a double occupancy room they came back and apologised. only for the whole drama to play out again the next day. i had to personlly request the food manager, he grudgingly came and affirmed, but it",July 2013,,,wrote a review Aug 2013,"Richmond, Texas",['1 contribution'],30,[]
Planet-1 Amazing Place to Stay in Lagos Nigeria,"Hi friends and my travel mates, I am back with my Nigeria experience. I came for Nigeria for the first time in life. And was too scared after reading the blogs on various travel forums and the bad experience mentioned on those forums. PLEASE BELIEVE ME IT’S A LIE.  I had never seen such a beautiful place like Lagos-Nigeria. I was on a business trip. I stayed in Nigeria for more than a month. Choosing a hotel was the most difficult thing. Because I wanted a decent, safe and very good place after having a negative mindset about Nigeria review by others on various forums.  But I am surprised to have  found happiness in its true form at Planet-1 Hospitality. I strongly recommend it to every one who wish to visit Lagos-Nigeria (be for business, family, or short term",June 2013,,,wrote a review Jul 2013,"Mumbai, India","['29 contributions', '7 helpful votes']",50,[]
Best hotel experience in Nigeria so far,"This hotel has very spacious rooms and, even though there are obvious mistakes such as use stained bed linens, overall I felt alright staying there. I did not feel satisfied with the AC as it was underdimensioned for the room size and a bit noisy. Food tasted good for dinner but breakfast could easily be improved. Spa services are very expensive in my opinion. In sum, overall the best experience in Nigertia.",June 2013,,,wrote a review Jun 2013,"Katy, Texas","['425 contributions', '205 helpful votes']",40,[]
Business trip stay,"The hotel over all was very good. The people are super friendly and try to help all the time. The bar was good as well as the chinese restaurant. The breakfast buffet is acceptable. The rooms are well equipped and clean, only some minor detials could be refurbished.",June 2013,,,wrote a review Jun 2013,Olching,['1 contribution'],40,[]
This hotel has come along way,Stayed only one night between stop over for travelling on.  I had stayed 3 years prior and the hotel was a mess and dirty.  They have made major upgrades and as far as hotels in Nigeria go I found Planet One to be very nice.  The staff was very courtiess and helpful.  The room was large (studio living area and bed) with a seperate bath that had a shower and jacuzzi tub.  The room was clean and the linens crisp.  I ate at the Bamboo Resturant (Chineese) and was moderate and I enjoyed the spicy nature of some of the dishes.  I hope that my next trip through Lagos will allow me to stay at this location again.   Please note that 3 star rating is based on comparison to all international stays but for Nigeria this is a very nice hotel.,May 2013,,,wrote a review May 2013,"Brookside Village, Texas","['66 contributions', '38 helpful votes']",30,[]
A place to be,"Planet one hotel has really made a lot of changes. Infact, i see changes almost everytime i visit. most of the rooms are amazing (spacious and equiped with jacuzzi), they have a fully fuctional Elevator for ease of moving your luggages,  the new bamboo bar is awesome, the gymnasium is well equipped, they have  professional staffs, melody from the piano, warm reception from the doorman and receptionist etc. I am so happy with all the changes made and I will definitely continue visiting planet one whenever am in Lagos because you can't get ALL these facilities in any hotel around Ikeja area for their price.",April 2013,,,wrote a review Apr 2013,"Sapele, Delta, Nigeria",['1 contribution'],50,[]
Simply the best!!!,"Planet one has really made some changes since the last time I visited. 3years ago I wasn't pleased when I stayed here but planet one really wowed me when I checked in early this month after a friend of mine recommended I visit again due to the huge changes the hotel had man. The rooms in the new wing are really amazing, my room was very spacious and had a jacuzzi which you will barely see in hotels area ikeja for 40,000NGN. Breakfast was very good, a lot of varieties to choose from compared to what I met the last time I came. The new bar bamboo is simply unique, I can say there is no bar that beats that in Lagos, the view from the terrace is amazing. The gym to my surprise was fully equipped and there was a gym instructor to assist u all through your gyming session. Am so happy",March 2013,,,wrote a review Mar 2013,Nigeria,['1 contribution'],50,[]
