Review Title,Review Text,Stay Date,Trip Type,Room Tips,Review Date,Author Location,Author Info,Overall Rating,Specific Ratings
A Home Away From Home,"I come over to Planet One Hotel and Wellness every time i am in Lagos.The serene environment i must say, connects me to my world of creative intuition in my digital Darkroom as a Professional Photographer. You know, the inter-play of the work of art, the natural ambiance, homely but professional staff, the melody from the piano etc just gives me a perfect mix of peace that helps my creative prowess. However, i think they should add more African dish to their menu.",February 2013,,,wrote a review Mar 2013,"Lagos, Nigeria",['3 contributions'],50,[]
DEFINITION OF AN AWESOME EXPERIENCE,"I checked into this lovely hotel with my boyfriend on the 2nd of March and we stayed for 2nights. I had a lovely time at the bar bamboo VIP lounge with some of our friends. The art work in room 105 gave my boyfriend funny ideas the moment we stepped into the room, the jacuzzi was a must use for us. Fisherman soup in the continental restaurant was out of this world. We had an amazing experience and the staff where so friendly and helpful. I will definitely recommend this hotel for anyone coming into lagos. Make sure you ask for the rooms with exotic artworks if your coming for a romantic stay!!!",March 2013,,,wrote a review Mar 2013,,['1 contribution'],50,[]
Very pleasing,"Planet 1 put a smile on my face, as I missed my flight and had to check into a hotel, and due to the fact I have heard so much about planet 1 , I decided to try it out and was amazed and excited as I never knew this kind of place existed as I was blinded by the hype of sheraton. I highly suggest people should try out this hotel and not base their decisions on some of these comments. I enjoyed the ambiance in planet one as it posed as a home away from home enviroment. The staffs were so friendly and I was treated like a King, I had so much attention from all departments in this hotel from the restaurant, to the front office, to the guest relations and even up to the senior management. I enjoyed my stay here and I advise you try out this hotel and make your own decision. There is",February 2013,,,wrote a review Mar 2013,,['1 contribution'],40,[]
Review Title,Review Text,Stay Date,Trip Type,Room Tips,Review Date,Author Location,Author Info,Overall Rating,Specific Ratings
Trying so so hard to be 4-star!,"I paid $222 per night for three nights in late Feb / early March. On arrival the receptionists were excited saying ""Oh you are from TripAdvisor! Welcome!"" (a false claim which I did not, I should mention, deny). I was shown up to my room (143) which was a decent size. There was one half-liter bottle of water. And one teabag. My colleague and his wife were staying in another room and had the same portions.   The day we arrived there was a blackout for ten seconds, another one or two, and then a complete blackout for over an hour. Fun! We wanted to have dinner and the staff said that they cook with gas so we can order. I had a stomach upset so ordered plain rice, which took the waiter three or four attempts to understand (""You mean rice with stew, sir?""). When I and my three",March 2013,,,wrote a review Mar 2013,"London, United Kingdom","['85 contributions', '21 helpful votes']",20,[]
wonderful,"When planning my trip to Lagos, my only concern was the accommodation because I was worried since ‎it was my first trip to the country. Shockingly, the saff were wonderful and very helpful. Very good ‎location. And the whole hotel with nice decoration. Beautiful lobby. Big, clean and comfortable room. ‎Everything was perfect!”‎",February 2013,,,wrote a review Feb 2013,"Abu Dhabi, United Arab Emirates",['2 contributions'],50,[]
amazing hotel,"We stayed 2 nights in January 2013 and found this a very clean, well run hotel located in the heart of lagos. The rooms were in excellent shape and quite roomy. Breakfast was included and was very good. We had our 2 small children with us and were quite satisfied with the accommodation.",January 2013,,,wrote a review Feb 2013,"Beirut, Lebanon","['2 contributions', '1 helpful vote']",50,[]
Amazing stay,"this hotel is one of the most amazing hotel i ever visited and loved to stay in. Rooms very clean, staff very friendly and helpful and delicious food. really so professional in every thing. service were great. i was so satisfied and i highly recommend the hotel and i ill go back and stay in the hotel.",February 2013,,,wrote a review Feb 2013,"Freetown, Sierra Leone",['1 contribution'],50,[]
Top-Class,"Perhaps my judgement is impaired by my previous night's stay in the Sheraton but I thought the Planet One was truly excellent and it;s my preferred choice for Lagos from now on.  Everything you;d expect plus a few welcome embellishments. I stayed in an Exec room with lounge access which was worth every penny and included nice touches such as two shirts ironed for free on arrival.  Food was good, tasty burgers at the Fusion Restaurant served by smiley waiters . The Hotel staff was very welcoming, service was always reached in a timely manner. , internet access was better than other hotels I have stayed in at Lagos. The location is great 15 mins maybe less from the airport so no worries about long tired drives its also right in the heart of the city where majority of the",December 2012,,,wrote a review Feb 2013,"Durban, South Africa","['43 contributions', '56 helpful votes']",50,[]
amazing service,"rooms very spacious, pillows fluffy, very clean linen and well detailed, very clean wash rooms, they have a very professional warm greeting, quick WIFI internet, i enjoyed the most the beautiful lobby, room service prompt",February 2013,,,wrote a review Feb 2013,"Beirut, Lebanon","['4 contributions', '4 helpful votes']",50,[]
Amazing stay,"this hotel is one of the most amazing hotel i ever visited and loved to stay in. Rooms very clean, staff very friendly and helpful and delicious food. really so professional in every thing. service were great. i was so satisfied and i highly recommend the hotel and i ill go back and stay in the hotel.",January 2013,,,wrote a review Feb 2013,"Jounieh, Lebanon","['8 contributions', '6 helpful votes']",50,[]
most fab stay at Planet One Hotel lagos Nigeria,"checked into this hotel cos i found them on hotels.com and wow, it was one of the most beautiful boutique hotels i have ever stayed in throughout the west africa region.nice rooms, nice ambiance, newly installed ACs and lift, plus the bar bamboo decked out to warm every tired traveler. it is one nice and cool place to chill out, shut away from the buzz and hustle of lagos city life.check this place out...you wont regret.",October 2012,,,wrote a review Oct 2012,"Milan, Italy","['1 contribution', '1 helpful vote']",50,[]
i remember this nice place planet one hotel!,"i came to this planet one hotel in lagos nigeria.it was a nice place to stay.real powerful interior decor, with good ambience. there was a corporate event then, and i had a presentation in their hall cafe.i remember it was a quiet place to stay away from the buzz of lagos city , really nice rooms.the service was good, and they was construction work going on at the back rooms plus renovating their lift system. i was told would be done in four weeks time.i would definitely stay here again if i come to nigeria again.",September 2012,,,wrote a review Oct 2012,"New Delhi, India","['1 contribution', '1 helpful vote']",30,[]
"beware of mere spiteful comments, still a nice experience @planet one!","i was supposed to have stayed in one of the nearby motels but eventually got to this planet one hotel.it is really a breathtakin place, with classy interior.but i guess if you want to be spiteful you can say foul things about the good experience others have had in this place.i did see a lot of renovation work going on, especially on the first floor and the warm and respectful service staff reassured me that all the work going on is just to make things better, which i did witness.there is a lift in the hotel, you really was never in this hotel if you failed to see the new beautiful lift they put up.i ended up staying 2 more nights than i had planned anyway...n i have absolutely no regrets whatsoever!",October 2012,,,wrote a review Oct 2012,"Richmond, Virginia","['3 contributions', '2 helpful votes']",30,[]
Review Title,Review Text,Stay Date,Trip Type,Room Tips,Review Date,Author Location,Author Info,Overall Rating,Specific Ratings
"Amazing experience απϑ loving staff,always ready 2 assist απϑ make sure guests are well taken care of.","1st of all the location is †Φ die for esp 4 some of us that travel a lot. It is so close 2 the airport. Then the environment is peaceful απϑ beautiful, I cldnt ve but walk arnd απϑ I loved it. I loved my room απϑ the colour theme απϑ ofcus the bathroom is reli breathe taking. I recommend planet one 4 any1 that wants 2 relax in a beautiful απϑ peaceful environment wiv their ever smiling staff. Whether you are in lagos 4 business or pleasure, this is the place 2 be.",October 2012,,,wrote a review Oct 2012,,"['1 contribution', '2 helpful votes']",50,[]
they said it was good to stay at planet one hotel...it is,"whenever she travels to nigeria my friend used to hang out at this planet one hotels bar bamboo, and with its all africa theme and ambience, i used to hear a lot from sally that it is a nice place to stay, recreate, and catch some african vibe fun.the world is full of such stories from hotels, especially when those lagos hotels that are not international brands used to have such low service quality in lagos but when i got to this planet one hotel place it was everything i have heard and more.nice location, just a couple of minutes from the international airport, good security, with army and police stations across the road in case of dire emergency, even though they still have good internal security on their own.the rooms are classy, n the food service is nice.you should try this",September 2012,,,wrote a review Sep 2012,"Sicili, Italy","['1 contribution', '1 helpful vote']",50,[]
"classy service, warmest reception, check out planet one hotel","this classy and nicely located hotel lies just 10 minutes from the international airport, even if you are going anywhere else in the hinterlands of nigeria you could make this cozy haven your stop over to and from your location, which is what i did.a friend from one of the oil companies who use the hotel as their corporate short let introduced me to the place and i had no single regret.the food is good, especially their african cuisine, and the bar bamboo has everything you need to set your nerves straight after a tough one on the front. oh there is the security.they got some real police outpost just nearby to compliment their in house security.this is really a nice place to stay it doesnt matter if you traveling for pleasure or for business. i tried it, and so should you.no",August 2012,,,wrote a review Sep 2012,"Dubai, United Arab Emirates","['1 contribution', '1 helpful vote']",50,[]
"good rooms, good relaxation @ planet one!","this planet one hotel was a good place to chill out for me after the rigors of a hectic business trip to port harcourt.its got wonderful color themed rooms.good restaurants.good bars to hang out in.and it is just 10 minutes drive away from the international airport.the security is good, and there is no absence of excitement at their theme events of their bar bamboo.check this nice africa vibe decor bar out on wednesdays, fridays and saturdays.it is certainly worth the fun!nice one planet one!",August 2012,,,wrote a review Sep 2012,"Ghizo Island, Solomon Islands","['1 contribution', '1 helpful vote']",40,[]
"good service, warm reception and nice location planet one hotel","i was in lagos nigeria briefly for a business meeting and stayed in this planet hotel place.nice location, just 10 minutes from the international airport in lagos.good security, they have a police post and army station just nearby.good food, they have a lot african delicacies on their african kitchen menu.restaurant named african trybes restaurant.bed rest value is premium, and i really had a nice rest in one of their color themed rooms.nice place to stay and recreate in lagos nigeria!",August 2012,,,wrote a review Sep 2012,"Dublin, California","['1 contribution', '1 helpful vote']",40,[]
the most pleasant place to stay in lagos nigeria!,"i forgot to write this review until a friend called me to ask me where he can find an exclusive hotel to stay in lagos nigeria. and i knew that i had to do this to help other people lookin too. this planet one place is too good to be true!they have the best rooms i have ever stayed in in west africa.i actually got there from ghana where i had my business workshop, and just decided to hop over to lagos see a couple of friends working with the state government in lagos. the security is tight and the planet one hotel is located just within 10 yards of the police station nearby. they also have ample facility security well trained and organised. the food is good, ask for the african trybes restaurant and enjoy the best cuisine africa has got to offer. the pool is indoors but it is",August 2012,,,wrote a review Sep 2012,"Melbourne, Australia","['1 contribution', '2 helpful votes']",50,[]
"if you staying in Lagos, try Planet One hotel aimiede!","i came with a focus group to do some research work in lagos and i got to find this planet hotel.it is just 5 minutes from the airport, and at most 5 more if there is traffic. and it is really a wonderful place to stay if you are visiting for both business or pleasure. they have this breathtaking bar, africa themed and everything, like a jungle rennaissance joint or somthin. it is the greatest place to unwind in the whole of the hotels i have ever stayed in my life, with over thirty years of traveling.the new wings of the hotel have got nice interior, and the service if great. you would find great culinary experience in their african trybes kitchen, it was a big deal for me to find most of the african delicacies i am familiar with on their menu.they also have great continental",September 2012,,,wrote a review Sep 2012,"Johannesburg, South Africa","['1 contribution', '2 helpful votes']",50,[]
a touch of class with excellent happy services = planet one hotel aimiede!,"m girlfriend dragged me to this hotel last month and it was like alice wandering into wonderland. the soft glow of the night lights in this cozy and exquisite luxury called planet one could never really expose the total happiness ambiance that this place provides. the rooms are clean, fresh and invigorating. i came to this place not knowing what to expect but i left with the conviction that some really still CARE about the values of real hospitality. the ACs were newly installed on my wing (if you get to this cozy happiness haven ask for the new wing rooms) and they have 50% discount around festive periods.i went during ramadan, and was told the same thing goes for easter and xmas! the guest relations manager is a smiling goddess who made sure we lacked for nothing. the new lift",August 2012,,,wrote a review Sep 2012,"accra, ghana","['1 contribution', '2 helpful votes']",40,[]
Poor service,"I stayed in this ""hotel"" last December and i experienced the poorest service I have ever got in an hotel. The AC didnt work in my room, the room was dirty and when i asked to move the another room it took them too many hours to do so. The other room was better but still far from being a glam. The food was very basic, no meat at all during all my stay, same dishes were served differently every time. I will not go back to this place!!!",December 2011,,,wrote a review Dec 2011,"Abuja, Nigeria","['1 contribution', '10 helpful votes']",10,[]
Appalling,"We travelled to Lagos to attend a wedding and were originally lodged at Protea in Ikeja where the service was courteous and professional, however as we were with the bridal party the standard rooms were too small for the bride and bridesmaids to change in. They were also admittedly quite expensive. We therefore moved to Planet One were, as it was a weekend we were given a 50% discount for what they called the Regency suites. We booked two and a bridal suite for 3 nights. My suite which I booked with my sister and which was supposed to be an upgrade on an executive suite did not have a single mirror in it and only one window which was within touching distance of a grey block, so no light there.  The bathroom had a Jacuzzi however the water was tepid so it wasn’t worth using. When",September 2010,,,wrote a review Oct 2010,"London, United Kingdom","['109 contributions', '38 helpful votes']",20,[]
