Review Title,Review Text,Stay Date,Trip Type,Room Tips,Review Date,Author Location,Author Info,Overall Rating,Specific Ratings
I want to live at the Federal Palace!,"And to sit with my laptop on the terrace watching a constant parade of ships into Lagos port. And eat Chef Morne Carelse's cuisine and sous-chef Shawn's malva pudding and the overnight bakers' whole-grain bread at the sumptuous breakfast spread. And jog around the gardens and circle the fitness path for fresh-air exercise (though the small gym is a light and airy alternative during rainstorms). There's also miniature golf and tennis and one of the largest and most beautiful set of swimming pools I've ever seen in a hotel or resort - but, hey, I was working from dawn till late every day, so alas, they weren't for me.  I spent three weeks at a friend's apartment in Abuja, and for this side trip to Lagos, I needed fast, reliable connectivity - my work with allAfrica.com requires it",June 2013,,,wrote a review Jun 2013,"Washington DC, District of Columbia","['2 contributions', '1 helpful vote']",50,[]
Safe option,"Safe option in Lagos for business travel.  The rooms are spacious, waterfront views, great garden and pool, very helpful and expedient staff.  Got a very late checkout which was great.  More or less unlimited water in the room makes for additional comfort.  To improve: gym area and food.  The Nigerian dishes are good; others taste a bit off, I suspect an ingredients issue.  Dining room can use some warmth, especially the breakfast buffet tables in the middle of the room don't help.  I was missing a mini bar in the room and some other 5 star comforts.  Probably needs to stretch a little further to deserve full 5 stars, but for a week's business travel, this hotel is an excellent option in Lagos.",June 2013,,,wrote a review Jun 2013,London,"['22 contributions', '5 helpful votes']",40,[]
couple of things to improve on,"Great hotel, great staff.   Some suggestions to help. Add a sauna or  steam room to the GYM area. Invest in IPTV system to make DStv at lot clearer in the rooms. Add an HD PVR especially to the Bar area or add in a dedicated sports bar. Have some smoking rooms (just a few)",June 2013,,,wrote a review Jun 2013,"Johannesburg, South Africa","['2 contributions', '1 helpful vote']",50,[]
Peaceful surroundings,"I stayed here for the first time recently for a few days whilst on business.    Check-in / check out was smooth and my room was very pleasant, well- appointed and maintained.   Breakfast and dinner in the restaurant were both excellent ( the food aspect of room service less so)  The decoration and ambience in the public areas is very good, too, with plenty of carefully planned seating enabling business and pleasure to be conducted non intrusively.    I found that without exception the staff were friendly and courteous and all of my needs were attended to in a prompt and efficient manner.    The highlight of the stay for me however were the gardens at the rear.   Here some lovely planting has been landscaped around the outdoor gym and tennis court area.     The wide expanse of",May 2013,,,wrote a review Jun 2013,"Porthcawl, United Kingdom","['3 contributions', '7 helpful votes']",40,[]
Lagos best hotel,I have been using this Hotel since it opened. Service is good and attentive and Management take an active interest in the welfare of guests. Rooms are good with all the amenities you would expect from a top rated hotel. Breakfasts are very good and provide you with a great start to the day. Lovely and spacious,June 2013,,,wrote a review Jun 2013,"Sunninghill, South Africa","['20 contributions', '34 helpful votes']",50,[]
Review Title,Review Text,Stay Date,Trip Type,Room Tips,Review Date,Author Location,Author Info,Overall Rating,Specific Ratings
The best hotel for business travellers in Lagos,"I have stayed at this hotel maybe 15 times in the last 3 years and always look forward to coming back. The staff and management are, without exception, warm, friendly and attentive, welcoming me back each time as though I have come home! The hotel is far more spacious than many hotels in Lagos and the large lobby area is ideal for informal meetings, enhanced by the sense of calm around the place. The location is ideal for the VI business district. Breakfast, in particular, is good with a wide range of food and the service on the bar and terrace has improved considerably recently. I find there is nothing more relaxing in Lagos than sitting on the bar terrace in the evening watching the cargo ships go by... Rooms are good with very comfortable beds. I could give 5 stars if perhaps",June 2013,,,wrote a review Jun 2013,"London, United Kingdom","['1 contribution', '1 helpful vote']",40,[]
"Very average, even by Lagos standards","This hotel should be better frankly but seems to lacks strong management, despite being managed by the Sun International hotel group. Renovated and re-opened a few years ago, the rooms are already looking tired. Food is average at best and pretty awful at times. Room service one night took about 50 minutes.  Like all hotels in Lagos, it is significantly over-priced but seems to get a lot of South African business, perhaos because of the brand. I suspect that there is too much concentration/focus on the Casino - you certainly don't see active hands-on management in the hotel. Service standards were very mixed - pretty good at the over-priced bar but awful at check-in. Reasonably convenient for the business districts on Victoria Island.",June 2013,,,wrote a review Jun 2013,"Grantham, United Kingdom","['239 contributions', '176 helpful votes']",30,[]
"Reasonable for Lagos, pretty average and ridiculously overpriced by international standards","Stayed here recently on a short business trip to Lagos. The hotel is well located for the Victoria Island business district with easy access to most major corporate HQs. Also excellent proximity to Lagos nightlife, restaurants etc . Impressively decorated lobby area and a rather nice bar and lagoon front terrace. Which makes the tiny, rather average rooms a bit of a disappointment. Service is extremely slow- it took ages to check in, I waited 45mins and 1 hour respectively for room service and over 40 mins for an adapter to be brought up to my room. On one occasion the kitchen called me after having waited over 30 mins to tell me what I had ordered wasn't available! Bathrooms could be cleaner and more luxurious for the price. Tiles need regrouting and hardware is almost retro.",March 2013,,,wrote a review Jun 2013,"Johannesburg, South Africa","['34 contributions', '70 helpful votes']",30,[]
Tranquility amid chaos,"This was my first trip to Lagos and after my airport experience and security escort, arrived here with a sense of dread. The architecture of the hotel is very old school, echoing its 1960 establishment and the former visions of pan-African glory - it was here that the country's declaration of independnece from Britain was signed. The grounds are pretty on the back, waterfront-facing side and quite lush, but the front is partly ruined by the now seemingly empty shell of the local secratariat tower that housed government officials before the capital moved to Abuja. Meticulous security at the gates does provide a sense of safety however.  The staff was extremely welcoming and check in while immediate, required the usual local formalities which took time. My room, a 'junior suite'",May 2013,,,wrote a review Jun 2013,"New York City, New York","['49 contributions', '62 helpful votes']",40,[]
Nice for a short stay - Good terrace view,"I stayed in the Federal Palace for a few days on a business trip. Check-in was extremely slow, and they mixed up the rooms for myself and  my colleague. They took her to the room that was under my name and vice versa. The lock on my door was broken and i requested to change it as soon as i was in the room - no one came to fix it for the whole day, after i came back to the room i had to come back down to request someone change it asap. The terrace though is amazing - the views of the garden are so beautiful and relaxing. Enjoyed a lovely drink there with my colleagues - very pleasant. Breakfast was also delicious - the f/b generally were very good.",May 2013,,,wrote a review May 2013,Dubai,"['21 contributions', '12 helpful votes']",30,[]
Oasis,"Stayed for 4 nights while in Lagos on business. The hotel is immaculate. Very clean and modern. The room was medium large with new bathroom and comfortable king bed. Only complaint was the difficulty finding outlets for my business electronics.   Large comfortable lobby that was great for business meetings. A/C was strong...almost too much for locals. The bar was spacious with a nice buffet for lunch. The breakfast buffet was among the best I've had at any hotel, but not cheap... $30.  The pool was exceptional by Western standards. Probably the nicest in Nigeria. The gym was tucked away under the lobby. Equipment was new but limited.   I've stayed at the Radisson Blu and Eko in Lagos. Federal Palace is by far the best of the three.",April 2013,,,wrote a review May 2013,"Wilmington, North Carolina","['117 contributions', '42 helpful votes']",40,[]
A Good Experience,"I enjoyed a recent weekend booked in at the Federal Palace. I found when staying at the Federal Place it is as if you are far away from the hectic city life you experience in Lagos . The picturesque gardens, lovely terrace and magnificant pool area and all this overlooking the Lagos Lagoon and Harbour. The service is good, the food is very good and the staff on the whole are service orientated and friendly. The rooms are well furnished with everything in working order and the beds are so comfortable. The heavy curtains in the room boded well for late morning sleep ins. The casino is a great place with very friendly and professional staff.",May 2013,,,wrote a review May 2013,"Lagos, Nigeria","['2 contributions', '1 helpful vote']",50,[]
Very expensive for value of money,My stay was ok. No complaints so far. Food was very very good actually. My only problem is the price. This is the most expensive hotel ive ever been too !! Price vs. Value is unacceptable to me. Why should I pay 400 usd per night. Any how I was informed that it is the best in nigeria. And the safest too.,April 2013,,,wrote a review May 2013,"Dubai, United Arab Emirates","['15 contributions', '6 helpful votes']",30,[]
Very disappointing Hotel,"It was recommended as the best Hotel in Lagos for our meeting and stay. The only impressive thing was the view of the Sea. However even this is taken away by dark heavy curtains covering the windows in the lobby. The service received was terrible. The restaurant used for dinner should not bother offering anything al a Carte. The salad ordered did not contain the items stated on the actual menu and came without dressing. We waited for nearly an hour to be served. The guest rooms smell damp as the AC is turned off completely when not occupied. The water in the wash hand basin, shower and bath is a muddy brown.",April 2013,,,wrote a review Apr 2013,"London, United Kingdom","['163 contributions', '145 helpful votes']",30,[]
A homelike atmosphere and truly fantastic staff,"I have stayed in this place quite a few times during numerous business trips to Lagos in the past three years. The hospitable staff, nicely decorated rooms,a wonderful terrace, picturesque garden overlooking the Lagos lagoon and the magnificent pool - these are all the elements of a quality hotel, which is quite hard to find in a place like Lagos. The rooms are quite spacious, and be sure to book one overlooking the garden and the waterfront - every now and then a grand ship would pass to and from the Lagos port, a scene, which proves to be quite spectacular for those who don't live on the seashores. For food lovers, breakfasts as well any other meal of the day are very thought-through, and, compared to other hotels in the city, offer food for every taste, ranging from",February 2013,,,wrote a review Apr 2013,"Moscow, Russia","['51 contributions', '7 helpful votes']",50,[]
Review Title,Review Text,Stay Date,Trip Type,Room Tips,Review Date,Author Location,Author Info,Overall Rating,Specific Ratings
Lagos oasis,"The Federal Palace has always been my top choice of places to stay in Lagos due to great facilities especially gym and pool. However the hotel is in need of refurbishment and there are several maintenance issues - air cons leaking, broken bathroom fittings and pool was very green. I hope management gets on top of these issues soon.",April 2013,,,wrote a review Apr 2013,"Johannesburg, South Africa","['6 contributions', '1 helpful vote']",30,[]
a fantastic place to stay in Lagos,"I really enjoyed my stay at this hotel.  It is an oasis of calm in the middle of a very busy, security conscious city.  The hotel is set within a wonderful area where you feel totally safe and can enjoy the amazing facilities - the garden is on the water and has a gentle breeze and there is a large clean pool to swim in.  The rooms are comfortable and the beds are fantastic - The bathrooms are nothing to write home about and are spotlessly clean.  Mine looked a little 'tired'.  One of my things disappeared from the room which I found very surprising. The bar is nice, the staff are friendly.  We organised an event there that went very well.  Food is good.",April 2013,,,wrote a review Apr 2013,"London, United Kingdom","['33 contributions', '16 helpful votes']",40,[]
Good choice for business and leisure,"It was my first stay at this hotel in Lagos and definitely it will become by first choice for coming trips, better than  the previously one tried in the city. The hotel is In Victoria Island and although is completely secure, you do not have the sense of being inside a prison as you do at other Lagos hotels. The hotel is surronded by large green extensions both  at back and front sides. The back one  gets to the water, so from the bar, restaurant or your room if you are lucky ( and I was!), you can see the ships permaently passing in both directions. The hotel has a fitness center adn a swimming that I did not try, but they looked good and well equiped. The hotel makes you feel confortable from check in moment, all is easy. The rooms have a reasonable size, simple decoration,",March 2013,,,wrote a review Mar 2013,"Madrid, Spain","['55 contributions', '81 helpful votes']",50,[]
"A coincidental stay, but a pleasant one.","Got to stay in this hotel not by choice but because the hotel I booked 'ran out of space' and arranged for this alternative which turned out to be a pleasant one. The hotel is located on Victoria Island on a very sizable plot, good entrance security. Check-in friendly and efficient, room just great with a very comfortable feel. Good bathroom with strong shower and warm water as soon as one opens the tap. The staff, at all levels very friendly and efficient; the ambiance of the hotel traditional, very well maintained and spotless. The breakfast buffet offered everything I need and lots more; the business lunch very good and quick. Only had dinner once but enjoyed the quality, presentation and service. The hotel grounds are very spacious and give a good view of Lagos and the",February 2013,,,wrote a review Mar 2013,johannesburg,"['61 contributions', '17 helpful votes']",50,[]
Friendly,"I stayed three nights and it was a serene hotel with friendly and courteous staff. And the food was good too. The staff were very professional and willing to serve. I will stay there again. However, the room rate are quite expensive.  Sam Y",March 2013,,,wrote a review Mar 2013,"Johannesburg, Gauteng, South Africa",['4 contributions'],40,[]
Holiday/Business in Lagos,"I travelled on my own, and met up with my husband, who was already in Lagos on business. From the moment I arrived, I was treated like a queen! The Federal Palace had organised someone to meet me as I got off the plane, to see me through Customs and into a waiting vehicle to the hotel. Once I arrived, I was met by people intent on making my stay memorable! Overall, it is the warmest, most hospitable hotels I have stayed in. From the driver through to the top management, people were superb, food was divine, and I would go back for a holiday and take my kids in a heartbeat! I would highly recommend this hotel for both business and leisure travel.",April 2012,,,wrote a review Mar 2013,Johannesburg,['1 contribution'],50,[]
Functional business hotel,"Huge hotel on sprawling grounds. While it's a ""5"" star hotel, it has no frills; no gowns or sleepers in roomsunless requested.The beds are not turned down as staff is not allowed into the guests' rooms unless the guest is in the room, as a result requests take long to be resolved. I would give it a 4 star rating. Rooms are of a decent size and the air conditioning worked well which is a necessity as it's hot and humid. Very expensive for what it offers. Food was surprisingly good at the restaurant.",December 2012,,,wrote a review Mar 2013,"Johannesburg, South Africa","['10 contributions', '17 helpful votes']",30,[]
Excellent hotel,"Stayed here December 2010 and am only just getting round to writing a review. It was my first visit to Lagos after 20 years and I was pleasantly surprised. It's a great hotel if you want a quiet safe location. The food was excellent as we're the drinks. But it's certainly not a "" party "" hotel !! I will certainly stay here again on my next visit to Lagos.",December 2012,,,wrote a review Mar 2013,london,"['47 contributions', '8 helpful votes']",50,[]
"Peaceful,","Beautiful, I fact homely lobby.  Well kept rooms and fantastic sleep quality.  It wasn't funny though that they refused me entry to the swimming pool area because I had one child mre than the 3 I filled into their check in form.  I wasn't even given a chance to explain.  I had to sacrifice myself.  The food is tasteless and actually worthless. I would eat them free.  I spent 3 nights but ate only one breakfast at their restaurant.  Overall, it's a cool environment but lacks those factors that make a hotel a star.",February 2013,,,wrote a review Feb 2013,"Lagos, Lagos, Nigeria","['85 contributions', '54 helpful votes']",30,[]
Not worth the money,"Really expensive, over-priced place. Nice lobby, friendly staff and reasonable rooms. Nothing too special except for the size - inside looks pretty grandiose and all.  Food and beverage took forever on so many instances. Room service does not answer the phone call for orders (took 20 minutes and mine was not an isolated experience). Even ordering from the Bar late at night took at least 30 minutes for 2 sandwiches.",February 2013,,,wrote a review Feb 2013,Manila,"['39 contributions', '52 helpful votes']",30,[]
Review Title,Review Text,Stay Date,Trip Type,Room Tips,Review Date,Author Location,Author Info,Overall Rating,Specific Ratings
"AMEX CARD ACCEPTED, Good Environment and Avg Food.",-> One of the Good Hotel of Lagos where American Cards are Accepted. None of the other Hotels accept AMEX Cards.  -> Stayed 4 - 5 Weeks here and have noticed that the Hotel is good for Staying in place such as Lagos where there is too much Security issues.   -> Its too costly comparatively to other Hotels.   -> Staff Behaviour is good and in house food service is Average. Breakfast served is good but the Hotel is avg. Need to precisely tell what we want otherwise they bring whats available :)  -> Cleaning is Good.   -> Water rides and Swimming Pool is awesome and worth a try.  -> Hotel also has a very good Gym and Casino.,October 2012,,,wrote a review Jan 2013,"Mumbai, Maharashtra, India","['7 contributions', '2 helpful votes']",40,[]
Clean top class excellent hotel,The best swimming pool . Great food. Excellent rooms . Very expensive but the best you can get. Would stay there more often but cost to much for me. Only stay as a treat before my daughter got married. But would stay every time out visiting if I could. Great place,February 2012,,,wrote a review Dec 2012,,"['5 contributions', '4 helpful votes']",50,[]
expensive compared with room level,"located along sea so you can have nice view and also you can enjoy in the pool. breakfast is so nice.you have a lot of choice. however the most important item, room level is not enough compared with room tariff. we want hotel to spend more money to improve equipment of room,especially of toilet. when i press the button in my frist use, suddenly cover around the button came off from the wall so every time i have to press button very carefully...",December 2012,,,wrote a review Dec 2012,"Urayasu, Japan","['610 contributions', '146 helpful votes']",30,[]
Nice Stay at extreme cost,"have stayed 3 nights at Hotel on a business trip..Its really seems to be best hotel in Lagos..nice location, attractive premises, decor & friendly staff.  have booked hotel via Octopus.com with complementary Breakfast which cost me USD1356 for 3 nights..its really ridiculous.... The check in was fast but i is my advise to travelers who usually books hotels via travel sites to confirm your reservations from hotel on mail/phone before leaving your country..in my case octopus.com had not paid to hotel till my check in ,even had taken money via from credit card in its own A/c 10 days before but i managed to convince the manager about it.    The hotel is in heart of Victoria island & at very secured location. However it is far from airport(around 22 K.M) & taxi can cost you 5000 to",November 2012,,,wrote a review Dec 2012,"Ahmedabad, Gujarat, India","['21 contributions', '6 helpful votes']",40,[]
"Average, but probably one of the best in Lagos","I travelled to Lagos on business and stayed at the Federal Palace. Being from South Africa the Sun International brand is all to familiar.  I arrived late in the evening after a rather bumpy ride from the airport and it was great to arrive in a cool hotel. The reception staff were friendly and had no issues checking in.  The actual rooms when you think about how much you pay are average at best. I tried to grab some food and drink from the restaurant which left a lot to be desired - I could only eat the fries. The drinks are very expensive and the service exceptionally slow.  The breakfast is pretty good so I would give them a tick for that.  The overall hotel is quite quiet, not much of a vibe, which is fine if you are there for just business. If you need a bit of a vibe when",July 2012,,,wrote a review Dec 2012,"Johannesburg, South Africa","['62 contributions', '37 helpful votes']",30,[]
Far too expensive for what you get,"Federal palace hotel has the feel of a large property but in reality isn't that large. A lot of detail is paid to security in terms of access from the main entrance, but is weaker after that compared to other African hotels I have stayed in. The large lobby houses a bar and plenty of areas to sit but other than that its limited. Rooms are a good size with a wooden floor and rugs and reasonably well furnished with a king Size bed that was very comfortable. Flat screen tv with a good range of English international channels. I had checked in late and therefore missed the restaurant so I took to room service which was was poor and took an hour to get the order delivered after follow up phone calls. When it finally arrived it was poor quality and only luke warm. The hotel only has",November 2012,,,wrote a review Nov 2012,"Desborough, United Kingdom","['198 contributions', '107 helpful votes']",30,[]
Event,"The External Boardroom at Federal Palace Hotel was used for our event.  The level of understanding of what we wanted was great, as well as the quality of the food, set-up and the speed of service.  The support, flexibility and promptness of the hotel staff was excellent.  Overall, we were all impressed and will definitely use Federal Palace again for future events and recommend  to friends and family.",November 2012,,,wrote a review Nov 2012,Lagos,['1 contribution'],40,[]
Best Hotel in Lagos,"The Federal Palace is a genuinely good hotel. For Lagos, and for the majority of Africa in fact, it is a tremendous hotel.  As with all hotels in this part of the world the price tag is rather steep, but the Federal Palace can get away with it as it is in my opinion the best Hotel in Lagos, with the Radisson closely behind.  The food was very good (a friend claimed to get food poisoning from the Dinner Buffet but it could have been from a multitude of sources).  The rooms were what you would expect from any global 'business-focused' hotel.  The service desk was as more efficient than most (but beware that relative to the rest of west Africa).  If you going to Lagos then stay here, you will be hard pressed to find somewhere better.",November 2012,,,wrote a review Nov 2012,Johannesburg,"['20 contributions', '9 helpful votes']",40,[]
"Overpriced, but this is Lagos","Second trip to Nigeria, staying at Federal Place for the first time. Location is great (VI) . Check-in process was really good - super fast and strangely enough they did not hold any money on the credit card or seek per-authorisation, which is what every other hotel I have stayed at does. The rooms are standard, I didn't have soap in my room on check-in. Additionally there was a major issue with hot water which sputtered out of the shower. Other than that its an OK hotel, with overpriced rooms, but this is Lagos so we deal with it. I would probably stay here again seeing as its a walking distance from my office.",November 2012,,,wrote a review Nov 2012,"Nairobi, Nairobi, Kenya","['20 contributions', '17 helpful votes']",30,[]
