Review Title,Review Text,Stay Date,Trip Type,Room Tips,Review Date,Author Location,Author Info,Overall Rating,Specific Ratings
Room booking,"Terrible room reservation service, booking a room takes hours. And their front office call center staff are very unprofessional.   No response from only booking option which is Email   No open media or quick response support, while most  lagos hotels offering friendly and convenience services   Not booking rooms again with all those  difficult procedures",November 2023,Traveled on business,,wrote a review Nov 13,,['2 contributions'],20,[]
Very Good Event Center,Had a wedding reception at the Bimoral Hall Located at the Federal Palace Hotel and Casino. The staff were very professional and ensured all our needs were met. The halls were kept cool thought out the function and the power didn’t fail at any point in time. The management team were always an email way for any questions. Highly recommended!,September 2023,Traveled with family,"For hotel reservations, make sure you have your NIN available prior to check in. For...",wrote a review Oct 2023,,['5 contributions'],50,[]
Zero value for money!,"Totally outdated, room stinks, stained towels & carpets, food not great and premium charges for ironing, as they wouldn’t supply iron & the board for free.",June 2023,Traveled as a couple,,wrote a review Jun 2023,,"['3 contributions', '1 helpful vote']",10,[]
I travelled there for a business and needed a cool place to stay for a while and someone referred me to the hotel truth,"A very serene hotel with well trained staffs that renders quality services to thier customers. A very clean environment, quite and peaceful. It's very cool for different purposes. If you're looking for a good place to stay if you find yourself around this location, this hotel is the best .",April 2023,Traveled on business,,wrote a review May 2023,,['2 contributions'],50,"['Value bubble_40', 'Location bubble_40', 'Service bubble_40']"
Outdoor Running Facility - Do able but could be better.,Lovely Hotel - But needs and proper outdoor running track around the surrounds of the hotel.  Hotel could use the most of the lovely scenic views for hotel guests who want to walk or run or even both around the perimeter of the hotel. Loops!!  Staff are nice and professional. Hotel is clean and lots of pool area over looking the Atlantic.,February 2023,Traveled with friends,,wrote a review Feb 2023,"Surrey, United Kingdom","['2 contributions', '3 helpful votes']",40,[]
Federal Palace Lagos The People make the visit.,"Monday January 30, 2023  The General Manager Federal Palace Hotel 6-8 Ahmadu Bello Way Victoria Island, Lagos  Dear Sir,  I write to you today to express my gratitude for a very relaxing weekend spent at Federal Palace.  My husband and I checked in on Friday January 27, 2023 and left Sunday January 29th, 2023. We were attending the Small World function hosted by Federal Palace on Saturday January, 2023. We were in room 419.  I wanted to bring to your attention the outstanding attitude, friendliness and professionalism of all the staff we encountered from security, to cleaning staff, waiters and waitresses, front desk individuals and those we had the opportunity to interact with,  Your staff are truly your best feature. They",January 2023,Traveled as a couple,"Things take a bt of time but the staff is brilliant, friendly, hardworking and personable.",wrote a review Jan 2023,,[],50,"['Value bubble_50', 'Location bubble_50', 'Service bubble_50']"
Would never stay here again,"Very poor service on everything. Staff appear sad and unmotivated. Only the concierge staff were professional and friendly. Even with a handful of people in bar area, one always had to go up and ask for a menu otherwise ignored. A colleague also staying at the hotel was physicaly assaulted by a police officer working on security as she re-entered hotel when her driver had a puncture at the gate. Duty Manager didn't seem particularly concerned, offered no apology and it took some doing for a report to be filed and culprit produced by hotel. Couldn't wait to get out. Stick to being a casino.",November 2022,Traveled on business,,wrote a review Dec 2022,"London, United Kingdom","['5 contributions', '1 helpful vote']",10,[]
In need of a total retrofit,"This hotel was recommended by several people who had previously stayed at the hotel. Sadly, the lobby was the best feature. Rooms were very out of date and in need or repair and updating. The beds were clean and comfortable but electrical outlets (there were only 2) did not work - just one. Showers need to be refilled, floors need to be replaced, etc. strangely the hotel is used by many conventions and meetings - and the crowd is nice",November 2022,Traveled on business,Avoid this hotel until they update the property.,wrote a review Nov 2022,"British Columbia, Canada","['1577 contributions', '195 helpful votes']",30,[]
Bad service,I am a regular guest at the federal palace but my last visit wasn't impressive. I got bad service from the big waitress at the breakfast restaurant. Thanks to Micheal the waiter is more professional..,November 2022,Traveled on business,,wrote a review Nov 2022,,['2 contributions'],20,[]
Would not stay here again.,"Stayed a week during a business trip and it was really not enjoyable. No separate showers, shower head in the bath and water was only lukewarm despite asking them to turn it up. Waited 2 hours for room service after I was told that it will be 30-35 minutes when I ordered. Luckily the food was good but after 2 hours of waiting it was not worth it. Experience in the restaurant during the evenings was similar.  Food orders took forever. Gym well equipped and clean - a pity the air conditioners did not work which made it almost unbearable as there are no opening windows. Most of the staff was friendly and helpful but there is definitely something wrong with housekeeping and the kitchen.  I am sure you can find better service and quality at a similar rate on Victoria Island",June 2022,Traveled on business,City Facing rooms were relatively quiet but it could be because it was during the week with very...,wrote a review Jun 2022,,['1 contribution'],10,"['Cleanliness bubble_30', 'Service bubble_10', 'Sleep Quality bubble_40']"
Review Title,Review Text,Stay Date,Trip Type,Room Tips,Review Date,Author Location,Author Info,Overall Rating,Specific Ratings
The best hotel in Lagos.,"I have returned to this hotel since 2006. Its a beautiful place and most importantly the team or people who have continued to make my stay memorable. Ekene at the concierge is a dream, very polite, welcoming and helpful. Mathew and Andrew at the check in desk makes our check-in smooth and easy. Peace at the pool wearing a huge smile, polite and playful. Bukola knows everyone at breakfast. She is very friendly, knows her returning guests and still extends the same courtesy to new guests. The cleaners do an amazing job with cleaning the rooms. Flower pots well tendered to. You have the best team and a lot of them have been working here for years, tells a lot about the management. A good job and the best hotel in Lagos. Don't stay anywhere else.",May 2022,,,wrote a review May 2022,"Lagos, Nigeria","['25 contributions', '25 helpful votes']",50,[]
Dr Leonard,"The hotel is very neat and clean both outside and in the rooms. The whole place is full of ambience.  I've stayed in this hotel a couple of times, mostly for business visits and everytime it has been a marvelous experience.  The food is good, the staff are friendly but very business like. The front desk is very professional in the way they handle issues.   However, there are few low points. 1. The containers from which food is served in the kitchen are very old and would require urgent replacement.  Seeing such old utensils puts me off.",May 2022,,,wrote a review May 2022,"Lagos, Nigeria",['3 contributions'],40,[]
Loud Music at Midnight,The iconic hotel is an enduring testament to Lagos' entertainment industry and the facility remains well maintained. The hotel hosts one of the city's most popular event venues -the Balmoral. The downside though is that it is not soundproof.  I was kept wide awake as loud music blared all night and I wondered if the hotel was bothered at all. It seems they make more money from events than the hotel lodgings.,December 2021,,,wrote a review Jan 2022,"Berlin, Germany","['357 contributions', '28 helpful votes']",30,[]
Fun family day day out,"Went for a day out with the family at the pool club at Federal Palace. The pool side and surrounding lawn was kept to a good standard. The toilets though were shocking! They actually need to be closed, and we had to change pool side or go into the main hotel to use the facilities after the trauma of the first visit. FP management, please sort this out!",November 2021,,,wrote a review Nov 2021,"Lagos, Nigeria","['7 contributions', '2 helpful votes']",20,[]
Celebration Night!,"It was a lovely experience after all and we will come back with the children. We have learnt our lessons though.... The breakfast was just on point although i had to break my diet plan.....sshhh....it was worth it. Very comfortable bed, nicely lit rooms and great ambiance - a lovely blend of nature and beauty expressed in art.",October 2021,,,wrote a review Oct 2021,"Lagos, Nigeria","['97 contributions', '39 helpful votes']",40,[]
Poolside extravaganza for children,"We had a pool party for my daughter but it turned out to be a destination experience for them. They had so much to do between the pool and slides, football pitch, trampoline, play ground it was worth every penny. The meal plan we chose was so apt for the children and occasion, it is an experience they would not forget in a hurry. It also was very relaxing for me as I didn't have to run around much to engage them much, the event centre already does that. The staff were also very helpful, patient and kind. I plan to visit again with the children, probably spend a few nights.",August 2021,,,wrote a review Sep 2021,"Lagos State, Nigeria","['5 contributions', '2 helpful votes']",50,[]
Golden Awards,"Federal Palace Hotel has amazing facilities. Their attention to Covid prevention and safety is impressive. Ayo and George were super helpful and very professional. I enjoyed working with them as they made things easy for me. Great customer service, fantastic food and a flexible/understanding team.",August 2021,,,wrote a review Aug 2021,,['1 contribution'],50,[]
My Federal palace experience,"Thank you for the quality of service you offered us during Darasimi@10 birthday at the lower pool deck.  Despite the many offers I received from other hotels and event place, I decided for you because of the unbeatable deal you offered me.  It was a good decision; I enjoyed the peace and quiet I needed, offered in all the facilities of your hotel. This definitely added to the excellent service of the staff, The kids had So much fun at the pool side, game arena, football pitch e.t.c We really enjoyed everything that was served, from the kiddies menu to the yummy Adult menu .  I will definitely recommend your hotel to friends and family, and I’m sure I’ll be back on my next event. I hope to get the same quality of service when I return. Thanks again, see you soon.",July 2021,,,wrote a review Jul 2021,,['1 contribution'],50,[]
Fantastic location for a small party,We had my mum’s birthday event here. The staff were so help and kind. And Mr Billy was so helpful. The Chef was kind enough to give us a complimentary cake. The chocolate cake was oh-so-amazing.We will definitely comeback for more family events.,May 2021,,,wrote a review May 2021,,['1 contribution'],50,[]
Staycation.,"Some of the best things about our staycation- Seaview from my room was fantastic, quality of bed was very good and comfortable. However, I'd say room and bathroom needs a facelift, it's good for the past standard, but definitely needs a bit of an upgrade. Food definitely needs to be improved upon, there should be more variety and it should be more tasteful, I had higher expectations due to hotel's reputation. Music live band was pretty good, they improved our experience. The porter that assisted us with our luggage upon arrival was very helpful,courteous and professional. Generally, I had a good experience, a few glitches that upset me, I wish we got more value for the money. I'd recommend a stay at the hotel anyways, depending on your needs.",April 2021,,,wrote a review Apr 2021,Nigeria,['1 contribution'],30,[]
Review Title,Review Text,Stay Date,Trip Type,Room Tips,Review Date,Author Location,Author Info,Overall Rating,Specific Ratings
Team Building,"Personalised service, small challenge when the power went off and we waited over 15 minutes to resume the presentation in the meeting room .Otherwise the team was attentive to our needs.We will definitely be back",December 2020,,,wrote a review Dec 2020,,['1 contribution'],50,[]
Team Bonding,"The relaxed ambience of the hotel is comforting.  The swimminp pools are amazing especially the slide.  The Hotel is very clean  and quiet, just the kind of place for a gateaway.  Above all it is a Fantastic place for a vacation.",December 2020,,,wrote a review Dec 2020,,['1 contribution'],40,[]
big 5 stars with a 2 stars service,"I made my reservation by Booking, but when I arrived there they don't accept American Express, so I had to pay with ATM card. They also blocked a big amount on the card, but at the check out they were unable to refound it, so they had to give me cash, even if I don't need cash back. They don't have any fresch juice at the bar and restaurant. In the room there is no bathrobe and no slippers. Minibar is empty. The bathroom is very old.  I was not allowed to have a late check out.  AC too strong in lobby.",February 2020,,,wrote a review Feb 2020,,"['56 contributions', '83 helpful votes']",20,[]
Federal Palace 3.5/5,"This hotel is acceptable all things considered. It is located in VI, a nice place to be in and the security is second to none. It is also very spacious if that's your thing and the staff are great. I am very objective in my reviews and this one is no different. I hope the management will take some of my points highlighted below to improve their services. It is a pitty to see a grand hotel in such a state. The Hotel firstly needs a bit of a face lift. And I don't just mean aesthetics. I also mean on the social front. It was built in the 1950s through 60s as a grand establishment and no doubt was glamorous back then, however today it is less than a shadow of its former self.  I stayed in a sea facing room. Certainly not as great as it sounds. It is not worth paying extra for. The",February 2020,,,wrote a review Feb 2020,"London, United Kingdom","['233 contributions', '68 helpful votes']",30,[]
Decent Lagos Hotel,Stayed here for almost a month a few years back and have been back a few times not to stay in the hotel but for the dinner buffet they offer.  The property is nice and they also do alot of events here also during the year.  I prefer this hotel over Eko Hotel because its quite and not as busy.,September 2019,,,wrote a review Feb 2020,"Vancouver, Canada","['1041 contributions', '961 helpful votes']",40,[]
Dinner at Federal Palace hotel,"The food was fantastic!! should have done 7 days fating before going for the dinner so I would have had more spaces to fill. The Ambiance was great, the environment was quite relaxing and very serene. All my guest love the different varieties of Coffee they ordered. Well done guys, keep the flag flying.",January 2020,,,wrote a review Jan 2020,,['1 contribution'],50,[]
"The Fed Palace remains a good hotel, but ...","During a recent visit to Lagos did my hosts book me at the Federal Palace Hotel.  While check in was swift did logging on to WiFi take a bit of time which however was soon resolved. My room presented itself generally clean and maintained but - like the entire hotel, especially the second wing which is closed - requires a major refurbishment to bring it back to its former glory.  Staff, wherever I encountered them, from housekeeping to security, were friendly and cheerful. I enjoyed daily breakfasts with a good spread of choices on the cold and hot buffet though would not recommend to try the Eggs Benedict. My first server on the first morning's breakfast was slow and dour so I changed to a different section of the restaurant the next day and the problem was solved as the staff",November 2019,,,wrote a review Dec 2019,"Kampala, Uganda","['3105 contributions', '496 helpful votes']",40,[]
BREAKFAST BUFFET FEDERAL PALACE HOTEL LAGOS,"I approached the breakfast buffet with no preconceptions. I was therefore pleasant surprised at the quality of the food. It was a good spread of food which for the most part tasted very nice. There were two disappointments to the food. The first was my omelette. It was terribly done. The chef burned the omelette, how do you burn eggs? The second were the pancakes which looked anaemic and thus very uninviting. Other than those the food was very good. The whole wheat bread served is possibly the best whole wheat bread i have ever eaten, please do not toast the bread to eat. Eat it plain. A word of advice for the hotel, they should have a bakery that sells the bread.   The service of the servers was below average. Unfortunately they were not very attentive and responsive to",December 2019,,,wrote a review Dec 2019,"Lagos, Nigeria","['3 contributions', '2 helpful votes']",30,[]
Laughable claim to 5 Star Rating,"This is possibly the worst hotel I have ever stayed jn over many years in Africa.  How can this less than 2 star old hotel claim a 5 star rating?  The rooms are dated and smell of mould, diesel and must.  Even in higher class rooms the mini bar fridges barely work and just 2 bottles of water are left inside.  The bathrooms are dirty and the water from the showers is dark:  The air-conditioning system didnt work for more than 2 days and despite repeatedly being told it would be fixed (more lying than trying) it remained off.  The food is bordering on outright junk but at least the beer is cold in the bar.  All this i suppose is bad enough but the worst point about this hotel is the ridiculous attitude of the management who cant be bothered to assist with anything and are",December 2019,,,wrote a review Dec 2019,"Dubai, United Arab Emirates","['48 contributions', '31 helpful votes']",10,[]
Service Levels have gone downhill-terrible wi-fi access,"Use to offer excellent customer service, but levels have gone downhill. Bar and restaurant staff seem surprised you want to order anything and you have to work hard to get their attention. The wi-fi system has changed and now you need to provide codes which never work. I had to go to reception about 10 times to have them reset my wi-fi. Eventully they just gave me a pass which then worked, why they could not do this the first time, I do not know. I was not the only guest to had this issue. Other hotels such as Radisson Blu Ikeja offer open wi-fi. Hotel is in a good location and rooms are clean, but they need to work on some staffs customer service and fix the wi-fi issue.",November 2019,,,wrote a review Dec 2019,"Burnaby, Canada","['5 contributions', '1 helpful vote']",30,[]
Review Title,Review Text,Stay Date,Trip Type,Room Tips,Review Date,Author Location,Author Info,Overall Rating,Specific Ratings
Very Comfortable Stay,"My husband and I stayed 2 nights in November 2019 during Art X Lagos which was held conveniently on site. The standard room was a bit small but clean and well maintained. The bed was comfortable.Daily buffet breakfast for two was included in the price of the room. The buffet was great with many local and international selections which were continuously replenished. Staff was friendly and welcoming. Drinks at the bar were a bit expensive and bartender had limited knowledge of mixed drinks. Keep your drink orders basic. Pool and surroundings were very nice, clean and well staffed. Overall I would highly recommend a stay here.",November 2019,,,wrote a review Nov 2019,"Los Angeles, California",['4 contributions'],50,[]
Best Swimming Pool in any hotel in Lagos,"I stay regularly in this hotel because of the great pool and friendly staff.   On the down side : The rooms are just ok and their wifi system is very inconvenient to login and the pillows are too big/hard.   The lobby is very good for business meetings.   Very nice breakfast and welcome drink.   Ah ! And they serve the best Club Sandwich ever, hands down !",November 2019,,,wrote a review Nov 2019,,"['142 contributions', '114 helpful votes']",50,[]
Clean and spacious,"Hotel is not the fanciest in Lagos, but it is safe, clean, spacious & quiet. Swimming pool is awesome, super tube is fun after a day working in Lagos. Gym is good too. Restaurant is super slow..... buffet is best option if you are wanting a quick meal WiFi is painful to log into... so check it is sorted when you check in.",November 2019,,,wrote a review Nov 2019,"Johannesburg, South Africa","['22 contributions', '3 helpful votes']",30,[]
Nice place to stay,"Federal Palace hotel is an awesome place to stay, been here with colleagues for business meetings, retreats and just for general chill out or wait out traffic while drinking something and viewing the lagos lagoon. When you go in, you are off the hustle and bustle of Lagos city.  However the security guys are saucy and messing up the good work by the guys at the restaurant, front desk reception area, the guys at the bar.   My incident with ‘Friday’ a certain security man was stupid and uncalled for. If there was an event in the hotel premises and the parking space for cars are limited, there are better ways to convey the message to hotel guests and visitors. I’m not his boss so I can’t fire Friday, but dropping reviews like this will sure let other visitors/guests to be careful",October 2019,,,wrote a review Oct 2019,"Lagos, Nigeria","['8 contributions', '3 helpful votes']",30,[]
Nice Hotel,It is one of the good hotels in Lagos. It has a magnificient garden where you can walk around. It is located near the sea side but sea is polluted because of the commercial port. Food is good and staff is helpful.,July 2019,,,wrote a review Sep 2019,"Istanbul, Türkiye","['66 contributions', '25 helpful votes']",40,[]
First time staying here,"Impressive hotel as you drive in, reception were efficient. The room was spacious and the air conditioning was working well. It was disappointing to find no room safe in my room to secure valuables. Dinner in the restaurant was excellent, way better than the breakfast. Coffee was very poor. Would be happy to stay again but will have to amend my expectations.",August 2019,,,wrote a review Aug 2019,"Castle Hedingham, United Kingdom","['221 contributions', '161 helpful votes']",40,[]
Good value but getting tired,"In the context of $400 a night Lagos hotels, the Federal Palace offers good value at roughly half that. It’s well located on Victoria Island and is very secure. Breakfasts are good, service levels are generally high and the wifi works well (once you manage to log on). The rooms are starting to get a little tired though, the bathrooms in particular; and the lifts weren’t working as well as all that. The coffee at breakfast was dreadful and there was only one bottle of water in the room – which doesn’t quite work if you can’t even brush your teeth with the tap water.",August 2019,,,wrote a review Aug 2019,"Accra, Ghana","['370 contributions', '114 helpful votes']",30,[]
Definitely NOT a five star hotel!. Do not stay in room 208.,"Nice ambience in reception area with marbled floor. Check in was slow and cumbersome. Staff were sat and made the whole process tedious and it appeared that navigation on their pc desk was longwinded. Despite the fact that I had requested a twin bed room, and also made sure that this information was confirmed at check-in, to my suprise, our room did not have a twin bed. We informed the staff and we were then relocated from room 508 to room 208.  Next morning to our shock, the photo attached shows the water from the bath tap. A health harzard!! This was reported to staff and we were told that it  could be that some work some was being done on the main drain. A  member of the estate came to check the issue. We informed them that if this was the case, why were we not informed. The",June 2019,,,wrote a review Jul 2019,"manchester, United Kingdom","['54 contributions', '41 helpful votes']",20,[]
Dinner,"I had a good time with my family. It was an awesome ambience, staff were professional in there dealings, nice meal and good value for your money. i will always recommend this place for anyone. Thank you.",June 2019,,,wrote a review Jun 2019,,['1 contribution'],50,[]
"Different rooms, different qualities","I was here for a business trip and stayed for 5 days. 4 days I stayed in room 511 and 1 day in room 309. The room with number 511 was very good for Nigerya but other room was terrible. The room was not clean at all, smelled of damp and there were insects in the room.   Personnel was polite and helpful. The restaurant was good enough.",April 2019,,,wrote a review Apr 2019,,"['5 contributions', '7 helpful votes']",30,[]
Review Title,Review Text,Stay Date,Trip Type,Room Tips,Review Date,Author Location,Author Info,Overall Rating,Specific Ratings
