Review Title,Review Text,Stay Date,Trip Type,Room Tips,Review Date,Author Location,Author Info,Overall Rating,Specific Ratings
Not impressive,"Large hotel, decent sized conference facility, good pool and water slides, massive lawns and water side garden. rooms were average sized, reception staff were not warm, i was the only person at check out at 8 am and still took 20 minutes, massive property, but not being effectively used. doors were pretty sound proofed. breakfast priced at 8100, ie some 2.5 times in other hotels.",June 2015,,,wrote a review Jun 2015,"Kochi (Cochin), India","['364 contributions', '113 helpful votes']",30,[]
Better  options in Lagos,"Prefer Wheatbaker and Intercontinental. Better food options, nicer gym with better rooms at these other hotels. FP does have a quick and painless check in. Expensive which is the norm in Lagos. Would stay here if i had kids though as it has a good pool with slides.",May 2015,,,wrote a review May 2015,"Johannesburg, South Africa","['8 contributions', '5 helpful votes']",30,[]
Exceeded My Expectation,There kitchen doesn't close and the chef was so friendly. The outdoor exercise area and the clean pool make my stay even more enjoyable. The wifi works all over the expansive ground and in the rooms. The beautiful rooms with great river views adds to the reasons i will go back there again. On a hot day ask for a Chapman at the pool.,December 2014,,,wrote a review May 2015,"Accra, Ghana","['306 contributions', '68 helpful votes']",50,[]
Ideal business stay...,"Exceptional good from the room, food, environment and staff.. Room was cozy, just the  want I need rest after business meetings, arguably the best breakfast I had in Nigeria, facilities was good, name it.. casino, bar and my favorite 'The Peacock'..",May 2015,,,wrote a review May 2015,Oman,"['88 contributions', '23 helpful votes']",50,[]
Review Title,Review Text,Stay Date,Trip Type,Room Tips,Review Date,Author Location,Author Info,Overall Rating,Specific Ratings
Still one of the better hotels in Nigeria...,"I have visited the Federal Palace hotel many times since the reopening and at one time basically lived there...this is the very best with customer service. The staff are extremely friendly and have been target for poaching by most of the hotels in Lagos. It has a superb foyer, casino and pool club that can compete with the best standards. Located right on the Marina waters...the views are breathtaking. My negatives are with maintenance and lack of a loyalty membership program.",May 2015,,,wrote a review May 2015,"Abuja, Nigeria","['291 contributions', '74 helpful votes']",40,[]
an awesome experience,The hotel is in good shape and has an excellent view of the Atlantic Ocean; this can be savoured from the well-kept courtyard; though the peacocks at the courtyard seem to give a better welcoming smile than the reception staffs.,April 2015,,,wrote a review May 2015,"Lagos State, Nigeria",['4 contributions'],40,[]
Very nice property and location,"I like big hotels, but often find you can sort of get ignored in ne. But that isn't the case with Federal Palace. The service is great, the rooms are clean, and the have an awesome buffet lunch. Our room wasn't the biggest, but it was comfortable and perfectly adequate. There is a nice family pool on property and the staff are pretty honest. We left some valuables when we left the hotel and they were handed back to me when we went back the next day.",October 2014,,,wrote a review Apr 2015,"Lagos State, Nigeria","['74 contributions', '26 helpful votes']",50,[]
Still the Best,"I went back to the Federal Palace after a few stays in other hotels and I still think it's the best option for Lagos. Easy check in, friendly staff, good food and lovely grounds. The Wi-Fi works much better now as well.",March 2015,,,wrote a review Mar 2015,"Accra, Ghana","['370 contributions', '114 helpful votes']",50,[]
Surprisingly good hotel,"A great hotel that offers a calm and tranquil atmosphere. It has an excellent pool complex with slide. Shade was in short supply around the pool as the sun parasols were ineffective. The free crazy golf looks great fun but it was too hot for us in the sun. Also the out door fitness stations were well maintained.   The hotel food and drink was of the usual Nigerian standard, mixed. Some was excellent, the breakfast for instance was fantastic with so much choice. The Friday evening buffet in the restaurant was the best I have ever had in Nigeria. So much choice and such good quality food. However the USUAL buffet served in the bar area was the worst I have ever encountered. We were told this was the normal buffet available most days as the restaurant doesn't open most days!   This",March 2015,,,wrote a review Mar 2015,"Southport, United Kingdom","['30 contributions', '26 helpful votes']",40,[]
"""Before 30"" at Federal Palace Hotel","The first time i walked into Federal Palace Hotel, I thought, this simply has to be the most beautiful hotel in Lagos and I MUST shoot here! Being a film maker I always have my eyes peeled for great locations. We approached the General Manager, Mr David Kliegl with a full on presentation and shaking in our boots because we were certain he would say no!  He turned out to be a really cool guy with a great sense of humour and he agreed to give us a generous amount of days to shoot. Let's just say that we have to convince everyone who watches the show that i wasn't shot in some exotic overseas location but right here in Lagos!  The rooms are spacious, the sea views are lovely and the views are lovely. The terrace restaurant at night gives the best view of the Marina that i have ever",March 2014,,,wrote a review Feb 2015,,"['13 contributions', '3 helpful votes']",50,[]
Very Wonderful Ambience& Serenity,"The hotel has a wonderful ambience and serenity. In a city that is characterised by lots of noise, you'll wonder about the quiet environment at the hotel. The service was excellent. I enjoyed the fine dining. I'm going back soon to enjoy those steaks again.",January 2015,,,wrote a review Feb 2015,"Abuja, Nigeria","['39 contributions', '5 helpful votes']",50,[]
Nice hotel,"The Federal Palace Hotel is one of the oldest luxury hotels in Lagos (probably in Nigeria). Refurbished in recent times, it is now a cool & calm oasis in the midst of this hustling & bustling city. Great swimming pool area, nice rooms, good restaurants and onsite casino and a whole lot more.",February 2015,,,wrote a review Feb 2015,"Nairobi, Kenya","['6153 contributions', '1054 helpful votes']",40,[]
Very secure hotel in Lagos,Very secure and peaceful hotel in the busyness of Lagos. Everything you need done is taken care of by friendly staff. Casino and gym available. The view from the rooms of harbour from the island it's unbelievable that one is in Lagos.,December 2014,,,wrote a review Jan 2015,"Johannesburg, South Africa","['307 contributions', '86 helpful votes']",40,[]
Regal Ambience,Sun International has hidden a wonderful casino in the old wing of Federal Palace Hotel and have a kitchen and restaurant befitting of royalty.   The compliment breakfast is really worth coming down for in morning.,January 2015,,,wrote a review Jan 2015,"The Hague, The Netherlands","['18 contributions', '8 helpful votes']",40,[]
Review Title,Review Text,Stay Date,Trip Type,Room Tips,Review Date,Author Location,Author Info,Overall Rating,Specific Ratings
Greate Hotel,"I stayed in the Federal palace hotel for a week on business trip, the hotel is huge with an ancient design It has a small nice gym a big swimming pool and a casino. The Rooms are quite big, clean with TV and AC. Breakfast (included ) was really good and delicious , but dinner is very expensive not delicious and it takes time to be ready (more than 30 minutes). The stuff is very friendly and helpful. Defiantly a good stay but an expensive one (but I think all the hotels in Lagos are expensive).",November 2014,,,wrote a review Dec 2014,"Amsterdam, The Netherlands","['73 contributions', '59 helpful votes']",50,[]
A mix of old charm and new glamour.,"This is one of the oldest established hotels on the Island. It still retains this old charm and character. There is a recent addition to one part of it that gives it a new and modern ambience.   We checked a colleague into the room. It was clean, spacious and comfortable. It costs about $500 USD per night. We made use of their business centre to print and scan a document. They were a bit slow but we got there in the end.  The restaurant is at the basement. The peppersoup was hot and spicy. Just as we like it. But I observed that both the peppersoup and the vegetable soup I ordered to go with the pounded yam was heavily laced with thyme and curry. That was a disappointment.  That's an absolute 'No' when making African soups.   Apart from this disappointment, the hotel has a good",January 2014,,,wrote a review Dec 2014,"Lagos, Nigeria","['42 contributions', '16 helpful votes']",40,[]
My Accident,I was in rush to enter my car after the driver came up the car port. This was precisely at 9:55 a.m. Local time (GMT +1) on the 8th of December 2014.   I suddenly went down on my back and buttocks as my legs suddenly slipped forward. I took stock of what happened and observed a bevel on the tarmacadam at precisely the center of the car port.   I ensured that I put my experience into writing to the hotel for corrections and prevent future occurance to others.,December 2014,,,wrote a review Dec 2014,"Federal Capital Territory, Nigeria","['10 contributions', '5 helpful votes']",40,[]
"Great hotel, very helpful staff","I stayed at the Federal Palace on business from Nov. 9th to 14th and had a fantastic stay. Great room, great swimming pool, great service from all staff in all areas, housekeeping, reservations, car booking, restaurants etc.   The location is also ideal.  There was only a slight misstep when I settled my bill. My card was rejected due to a connection error in the reader which took a while to be identified, but other than that everything was very efficient and professional.  I'll definitely stay there again when I'mn back in Lagos.",November 2014,,,wrote a review Nov 2014,"Singapore, Singapore","['3 contributions', '1 helpful vote']",50,[]
Excellent,I am in Lagos conducting customer service training and happened to stay in the Federal Palace Hotel.  My staff made the right decision.  We have stayed in a number of Lagos hotels and have to say FP is the best so far.  The customer service in FP far exceeds what we usually receive.  The Internet was not as strong as I like in my room but other than that hiccup everything was great.,November 2014,,,wrote a review Nov 2014,"Washington DC, District of Columbia","['12 contributions', '18 helpful votes']",40,[]
Overpced poor service,"Dont stay here, Was first down for breakfast buffet, everything was cold When I complained I was advised it had only just been put out & food warmeres take time to heat food - Nice  Rooms very average, dirty, furniture worn out Matress good if you like a stone floor to sleep   Staye 1 night out of 4 booked elsewhere",May 2014,,,wrote a review Nov 2014,"Port Harcourt, Nigeria","['94 contributions', '65 helpful votes']",20,[]
"Great place, great food and great bedding","Amongst all the good hotels and places to stay in Lagos, this is by far one of my favorites. The bedding is very confortable and the rooms are quite spacious, the lobby área is vast and very welcoming as well as the check-in facilities (no a counter but rather a private desk), then the food at the restaurant is great and a special mention to the breakfast buffet (you can eat a full meal in the morning which is quite handy when you have to work far from the hotel and finding a restaurant can be quite a problema outside VI or Ikoyi). The staff is always very helpuf and ready to help and for the Casino lovers, there is one in-house, so no need to go around at night. As for families, there is an outside pool and some slides for the better enjoyement of the smaller ones... So whether",May 2014,,,wrote a review Nov 2014,"Barcelona, Spain","['150 contributions', '70 helpful votes']",40,[]
Home sweet home,I would like to say big thank you to the whole staff working there. My experience in this hotel are hard to express in words. The worm and welcome which me and my boyfriend recived from everyone in hotel was amazing. They made us feel like home. Staff always smiling at you greeting you every time see you is just beyond 5 start hotel expectations. Room on highest level. Food amazing. I can strongly recomend anyone to forget eating outside cause restaurant delivers amazing food not only local but European as well. Every single penny was worth it to spend cause food was just beautiful. What else can I say if you are looking for second home in Lagos go for Federal Palace cause they will always look after you. I hope i will be able to visit them once again in future.,October 2014,,,wrote a review Oct 2014,,"['1 contribution', '1 helpful vote']",50,[]
Stunning sunsets!,The staff at the palace went above and beyond to best accommodate my needs during my stay. They even took additional measures to protect all hotels guest from ebola. The leadership team at the palace are truly sincere and tried their best to make me feel at home. The amenities along with the garden views create a serene and enjoying experience. The palace is a top notch hotel and I highly recommend staying here if you are visiting Lagos.,August 2014,,,wrote a review Sep 2014,,['2 contributions'],50,[]
Felt like Home,"I was very pleased with all the staff and management.  Everyone was very kind, pleasant, and helped me to feel at home.  The food was very good at all meals, and if I ever desired something that was not on the menu they were eager to accommodate.  I was very impressed with the chicken curry, and asked the chef for the recipe, and he was kind enough to comply.  This is just an example of the Federal Palace having a family atmosphere.  I felt very safe and comfortable at all times while staying with the Federal Palace.  Thank you Dave, George, and the rest of the staff for making my stay a wonderful experience.  I will come again.  Warmest Regards, Chad",June 2014,,,wrote a review Sep 2014,,"['1 contribution', '1 helpful vote']",50,[]
Review Title,Review Text,Stay Date,Trip Type,Room Tips,Review Date,Author Location,Author Info,Overall Rating,Specific Ratings
Beautiful view,"I've stayed at the Palace several times. The rooms are good. Water view (request it) is great. Breakfast is incredible but pricey -$35. Wonderful pool - huge, water slide. Kids love it. Good gym and game room for kids. And the view from the balcony on the back side of the restaurant is gorgeous. Apapa ports, container ships sliding past the hotel. Wonderful. The casino - possibly the only one in the city - is fun. Slow during the day but crowds come in evenings and weekends. In all a great place to stay.",February 2014,,,wrote a review Sep 2014,"Clearwater, Florida","['19 contributions', '12 helpful votes']",40,[]
Fabulous all round!,"Fabulous views, friendly staff and good food! Every time we have been there we have been welcomed and recognised by well the friendly staff. Sunday Buffet is to die for! The views across the harbour from Upper deck are amazing!",August 2014,,,wrote a review Sep 2014,,"['3 contributions', '2 helpful votes']",50,[]
"Very impressive, once again","I would like to congratulate the Federal Palace hotel and staff for keeping their high standard. this was my 3rd visit in as many years to this hotel, as the leader of a South African business delegation of 30 companies. we went to Lagos to forge business relations between South African and Nigerian businesses, and Federal palace was the perfect place to stay at. The rooms are extremely beautiful, the lobby spacious and luxurious, ideal for our delegation to have business discussions both in groups and in private. The conference rooms are ideal for business events, and most importantly the standard of service is very impressive. special thanks to David the GM of the hotel for his care and hands on professionalism,  special thanks to Nena Okeke the event coordinator for being on",August 2014,,,wrote a review Aug 2014,"Cape Town Central, South Africa","['8 contributions', '4 helpful votes']",50,[]
Very nice hotel,"Stayed only one night in this beautiful hotel, but enjoyed it a lot. Staff is very welcoming and friendly, that aspect is really perfect. The lobby is impressive with a warm atmosphere. The rooms are luxureous, excellent bathroom also. I have one comment/suggestion. Make it a bit less cold in rooms and lobby and restaurants. Both my colleagues and myself came back with a cold from this trip. By the way the food I had on this trip in the hotel was also great. On the terrace the sandwich I ate was really great, although it took a while before it arrived. Breakfast was super!",July 2014,,,wrote a review Aug 2014,"Oss, The Netherlands","['160 contributions', '28 helpful votes']",40,[]
Best sleep I've had in ages,"I'm not sure what exactly it was, but My husband and I agree that we had THE MOST RESTFUL weekend ever!  The staff was great - polite, helpful and friendly. It was my husband's birthday, and the staff helped make it truly special for us. The food was great. The room was very neat and cozy. I have a thing about bathrooms and the bathroom at the hotel did NOT disappoint. Great view (ask for a sea facing room!). There is sooooo much to do at the hotel. I loved the pool. If you just wanna go for a walk… DO IT - lots of beautiful grounds to cover! Will definitely be returning and this time I hope to win big at the casino :)",July 2014,,,wrote a review Jul 2014,"Lagos State, Nigeria","['1 contribution', '2 helpful votes']",50,[]
"Not just a hotel, its a Palace!","The Federal Palace Hotel has a nice and calm ambience, its a wonderful get-away spot. The food was quite tasty, their staff are very accommodating and courteous. the hotel is very quiet, its a great place to get a quick holiday and rest properly. Business meetings can be conducted with ease, and the hotel management always find a way to work around your needs, even if their policies are against them.",July 2014,,,wrote a review Jul 2014,,['1 contribution'],40,[]
Solid,"A solid hotel, some of the rooms and especially the bathrooms are dated but everything else works well, the food is acceptable but not startling and the communal areas all are well maintained. You won't be amazed but unless unrealistic won't be shocked either",June 2014,,,wrote a review Jul 2014,"Northallerton, United Kingdom","['363 contributions', '171 helpful votes']",30,[]
Federal Palace Hotel...Home away from away,"Form point of arrival, my 2 nights stay at Federal Palace...it was a relaxing experiencing. Despite that it was a business trip, I was so relaxed as the environment gave the right ambience. From the receptionist at arrival and the waiters that attended to me...I was totally Impressed at their politeness.  FPH comes highly recommended by me for any traveler or tourist.  G.A",July 2014,,,wrote a review Jul 2014,,['1 contribution'],50,[]
That's it for me.,"So, with a mixture of regret and relief, I bid farewell to the Federal Palace. I've spent maybe 20 or 30 nights here over the past few years, but after my most recent trip, I'm calling time now. On the regret side, the staff are friendly and cheerful. They've been consistently the positive side of the property. The relief is that I won't have to face the very sub-standard evening buffet again, the run-down exterior and public areas, the super-noisy aircon in the rooms, and I won't have to wonder why the owners don't swing the priority pendulum just a bit back from the casino where it lies, to the hotel, where it's needed. Net - competition's now strong and present, but in my view the Federal Palace, very sadly, is neither.",June 2014,,,wrote a review Jul 2014,"Dubai, United Arab Emirates","['14 contributions', '9 helpful votes']",20,[]
Don't come here...,They cut out the water with no warning what so ever. Want me to take a bath with a bucket of water. They call them self a 5star hotel and this is what you get after paying a fortune to stay here. Food takes forever to serve and once it arrives the food is cold. Really a bad experience and they should drop there star rating to a 3 star...,May 2014,,,wrote a review May 2014,"Greater Johannesburg, South Africa","['2 contributions', '5 helpful votes']",10,[]
Review Title,Review Text,Stay Date,Trip Type,Room Tips,Review Date,Author Location,Author Info,Overall Rating,Specific Ratings
India Education Fair-2014,"We recently held the first India Education Fair at FPH and our overall experience at FPH was satisfying and we would recommend others to use the venue for their business meetings/seminars. The staff were very cordial and the food served was excellent.---Vijay Kumar, STPL Nigeria",May 2014,,,wrote a review May 2014,,['1 contribution'],50,[]
Very Pleasant All Round Experience,"Stayed at Federal Palace and held our business reviews in their conference facilitates.   Rooms are spacious and clean. Bathrooms need a bit if attention to upgrade things a little.   Reception and communal areas are nice wide open spaces, something that's nice to have when you are in Lagos for a few days, with the grass in the front, that leads to the water (harbour entrance), making you feel like you are not in this exceptionally built up city.  Food has been enjoyable.   The conference area is well situated and while our room has no windows and is a little stuffy as a result, we have been comfortable and happy.",May 2014,,,wrote a review May 2014,"Johannesburg, South Africa","['249 contributions', '70 helpful votes']",40,[]
"An amazingly helpful set of staff, a beautiful setting...","From the day we set out to hold my niece's wedding reception at FPH, we were amazed at the helpfulness of FPH staff... nothing was too much for them to accommodate for us.  They worked tirelessly to ensure we got everything we asked for.  The food was superb, beautifully laid out and hot! The waiters and waitresses immaculately turned out and they served us to the very end (and the reception, which started at 1.30pm went on till 11pm)!  The marquee was spotless and nice and cool! I really cannot rate it any higher in my mind or in this review.  FPH, you did us proud, thank you so much. For ANYONE who wants a small, intimate, wedding in Lagos, in a lovely setting, with good food and good service AND chilled champagne, FPH is the place I'd strongly recommend! I can also recommend",April 2014,,,wrote a review May 2014,"Lagos, Nigeria","['6 contributions', '1 helpful vote']",50,[]
Surprised! Great Hotel,"I was a bit worried when I was told that I will be staying in this hotel.  This was because I usually see the tall run down building from the outside.  But I was suprised to see a new hotel building within the compound when I arrived.  I spent 5 days in the Hotel during an exhibition within the hotel and I must say it is definately one of the top 5 hotels in Lagos.  The room was clean, well decorated and spacious.  The Pool and garden area is awesome and can get quite busy in the weekend as it's a popular attaction for children.  The negative things about the hotel is that it only has one restaurant which I think is inadequate for such a big hotel, also the one or two 'lady friends' who came be found hanging out in thee bar on weekday nights and the lack of power sockets next to",April 2014,,,wrote a review May 2014,"London, United Kingdom","['125 contributions', '73 helpful votes']",40,[]
"Brilliant venue, brilliant service, fun and fantastic staff!!!!","Our daughter's wedding reception was held in the marquee because she wanted the backdrop of the hotel grounds in the wedding pictures. It helped of course that the recently renovated hotel has had the gardens beautifully landscaped into an ethereal experience with the Lagos Port and lagoon providing an unforgettable vision of nature. Add to this the fantastic service we got in the planning of the event.... Special discounts on the 'dodo' the bride wanted, hot TASTY meals (and I emphasise that because absolutely everybody commented on how exceptionally tasty the food was!!!) The ambience, the decor, the service was beyond excellent. A Huge thank you to all the brilliant people who made it so unbelievably fantastic.",April 2014,,,wrote a review Apr 2014,"Milton Keynes, United Kingdom","['37 contributions', '20 helpful votes']",50,[]
A pleasant stay,"I would like to stay that my stay was above expectations! Very nice welcome at check in by Michael who got me a nice room with a view when i told him , it was my very 1st stay! Breakfast is varied and tasteful! Staff is committed and eager to help ! It was a very nice stay in busy Lagos",April 2014,,,wrote a review Apr 2014,"Marseille, France","['394 contributions', '109 helpful votes']",40,[]
Best in Lagos,"Lovely, relaxing hotel in a city which is challenging. Reception staff helpful, room large and clean. Pool lovely and refreshing.  That said, the food and drink were alarmingly expensive. Very good breakfast",May 2013,,,wrote a review Apr 2014,"Siquijor Island, Philippines","['98 contributions', '76 helpful votes']",40,[]
